web-scraper-order,web-scraper-start-url,text1,text2,text3,text4,text5,text6
"1717532238-20","https://www.sueddeutsche.de/politik/gesundheit-cannabisgesetz-ministerin-warnt-vor-ueberlastung-der-justiz-dpa.urn-newsml-dpa-com-20090101-240222-99-84318","Gesundheit","Cannabisgesetz: Ministerin warnt vor Überlastung der Justiz","Gesundheit - Cannabisgesetz: Ministerin warnt vor Überlastung der Justiz","[{""text4"":""Schwerin (dpa/mv) - Kurz vor der Abstimmung im Bundestag über die umstrittene teilweise Legalisierung von Cannabis hat MV-Justizministerin Jacqueline Bernhardt (Linke) vor einer massiven Überlastung der Justiz durch die geplante Amnestie-Regelung gewarnt. „Gut gemeint ist nicht gleich gut gemacht“, kritisierte sie am Donnerstag in Schwerin mit Blick auf den Gesetzentwurf. Die Regelung zur geplanten Amnestie führe zu einer Überlastung der Staatsanwaltschaften und Gerichte.""},{""text4"":""Der Gesetzentwurf sieht laut Bernhardt vor, dass bereits verhängte Haft- oder Geldstrafen wegen Cannabis-Delikten, die nach dem neuen Gesetz nicht mehr strafbar sind, beim Inkrafttreten erlassen werden. Bernhardt geht allein in Mecklenburg-Vorpommern von etwa 6500 offenen Vollstreckungsverfahren aus, die Staatsanwaltschaften und Gerichte prüfen müssten, darunter rund 100 noch nicht vollständig verbüßte Haftstrafen.""},{""text4"":""Besonders heftig werde es für die Staatsanwaltschaften und Gerichte, so Bernhardt, wenn das Gesetz bereits zum 1. April in Kraft treten solle. Die bis dahin verbleibende Zeit sei für die Justiz zu kurz. Die Ministerin forderte ein verzögertes Inkrafttreten der Amnestieregelung.""},{""text4"":""Auch der Deutsche Richterbund warnte. „Die Justiz rechnet bundesweit mit mehr als 100.000 Akten, die im Falle des geplanten rückwirkenden Straferlasses bei Cannabis-Delikten nochmals zu überprüfen sind“, sagte der Bundesgeschäftsführer des Richterbunds, Sven Rebehn, dem Redaktionsnetzwerk Deutschland (Donnerstag).""},{""text4"":""An diesem Freitag will der Bundestag die kontrollierte Freigabe von Cannabis mit zahlreichen Regeln beschließen. Besitz und Eigenanbau bestimmter Mengen sollen damit für Volljährige vom 1. April an erlaubt sein. Nach Inkrafttreten des Gesetzes soll es auch eine Amnestie für Verurteilungen bei Fällen geben, die künftig erlaubt sind.""},{""text4"":""© dpa-infocom, dpa:240222-99-84318/2""}]","Eine Person raucht einen Joint. (Foto: Fabian Sommer/dpa)","Die teilweise Freigabe von Cannabis soll am Freitag im Bundestag beschlossen werden. Eine vorgesehene Amnestie treibt Richtern und Staatsanwälten Schweißperlen auf die Stirn."
"1717532242-21","https://www.sueddeutsche.de/meinung/cannabis-legalisierung-corona-pandemie-entscheidungsfreiheit-kommentar-1.6388794","Cannabis-Legalisierung","Der Murks geht in die richtige Richtung","Cannabis-Legalisierung: Der Murks geht in die richtige Richtung","[{""text4"":""In Deutschland darf künftig also offiziell gekifft werden. Der Bundestag hat am Freitagnachmittag ein entsprechendes Gesetz beschlossen, und um es gleich deutlich zu sagen: Es ist ein wirklich schlechtes Gesetz. Aber dass es beschlossen wurde, ist trotzdem eine gute Nachricht.""},{""text4"":""Die Regelungen, die für den Cannabis-Konsum in Deutschland fortan gelten sollen, sind umständlich, kleinteilig und bisweilen lebensfremd. Es gibt Einschränkungen nach allen denkbaren Parametern: Uhrzeiten, Orte, Bezugsquellen. Auch unter erwachsenen Freunden darf nicht geteilt werden, jeder muss sich also sein eigenes Cannabis besorgen. Wenn man die Auflagen ernst meint, muss man sie auch alle kontrollieren - viel Spaß auf der nächsten Feier vom Karnevalsverein oder beim Besserverdiener-Spieleabend in Berlin-Mitte. Die Beschwerden von Polizei und Justiz, dass sie da kaum hinterherkommen werden, sind mehr als nachvollziehbar.""},{""text4"":""Trotzdem ist dieses Gemurkse ein Schritt in die richtige Richtung. Zum einen, weil es zumindest im Grundsatz anerkennt, dass Menschen in der Cannabis-Frage ohnehin längst ihre eigene Entscheidung treffen. Wer kiffen will, der kifft. Zum Zweiten, weil mit der Legalisierung zahlreiche Maßnahmen zum Jugendschutz einhergehen sollen, vor allem in Sachen Aufklärungsarbeit, die man sich schon viel früher gewünscht hätte. Denn genau wie Rauchen oder Alkoholkonsum ist Cannabis für junge Menschen besonders schädlich. Wenn man sicherstellt, dass sie das auch in vollem Umfang wissen, verbessert das die Chancen, dass sie sich gegen den Konsum entscheiden - oder zumindest das Risiko einschätzen können. Zudem wird, auch wenn das Vertriebssystem recht umständlich ist, der Konsum sicherer: Cannabis mit einem Beipackzettel, der über Sorte und THC-Gehalt informiert, ist besser als Stoff vom Kleindealer aus dem Park.""},{""text4"":""Eine Liberalisierung in der Drogenpolitik ist aber noch auf anderer Ebene ein gutes Signal: In der Corona-Pandemie hat sich das Verhältnis zwischen Bürgern und Staat verändert. In weiten Teilen gab es dafür gute Gründe, schließlich hatte man es mit einer bis dahin nie gekannten Bedrohung zu tun. Niemand konnte sofort sagen, welche Maßnahmen zur Bekämpfung des Virus angemessen waren und welche nicht. Aber in diesem Chaos etablierte sich auch eine staatliche Wir-wissen-was-richtig-für-euch-ist-Haltung, die vor der Pandemie niemals akzeptiert worden wäre. Deshalb ist es gut, dass mit der Cannabis-Legalisierung nun ein Gesetz beschlossen worden ist, das die Entscheidungsfreiheit der Bürger vergrößert, statt sie zu beschneiden. Es ist auch ein Beitrag, um den zwischenzeitlichen Trend zur staatlichen Überfürsorge wieder umzukehren.""},{""text4"":""Die Freiheit des Einzelnen ist ein Wert an sich. Zu dieser Freiheit gehört, für den eigenen Körper Entscheidungen treffen zu können, die andere Leute nicht gut finden. Gesund, drogenfrei und leistungsfähig durchs Leben zu gehen, mag für die meisten Menschen aus guten Gründen erstrebenswert sein. Aber es muss auch in Ordnung sein, den eigenen Körper lieber für größtmögliches Vergnügen zu verbrauchen - sei es durch ungesundes Essen, Hochrisikosport oder zu viel Gras am Freitagabend. Deshalb ist die Cannabis-Legalisierung eine gute Sache. Sogar für die, die gar nicht kiffen wollen.""}]","Der Kampf ist gewonnen, in Deutschland darf fortan gekifft werden. (Foto: Olena Bondarenko/PantherMedia/IMAGO)","Nun also dürfen die Deutschen nach Herzenslust kiffen. Und das ist gut so, auch wenn das vom Bundestag verabschiedete Gesetz wahrlich unperfekt ist. Denn es profitieren auch jene, die gar nicht kiffen wollen."
"1717532245-22","https://www.sueddeutsche.de/politik/bundestag-livestream-cannabis-legalisierung-1.6388554","Drogenpolitik","Bundestag stimmt für Legalisierung von Cannabis","Bundestag stimmt für Cannabis-Legalisierung","[{""text4"":""Es ist ein historischer Tag in der deutschen Drogenpolitik: Der Bundestag hat der Legalisierung von Cannabis zugestimmt. 407 Abgeordnete stimmten für das Gesetz, 226 dagegen.""},{""text4"":""Es sieht eine kontrollierte Freigabe mit zahlreichen Vorgaben und Regeln vor. Anbau und Besitz bestimmter Mengen für den Eigenkonsum sollen demnach für Volljährige vom 1. April an erlaubt sein. Ab 1. Juli sollen Clubs zum nicht kommerziellen Anbau von Cannabis öffnen dürfen.""},{""text4"":""Die Ampelkoalition aus SPD, Grünen und FDP sieht die bisherige, deutlich restriktivere Drogenpolitik als gescheitert an. Sie hofft, durch den radikalen Wechsel den Gesundheitsschutz zu verbessern, den Kinder- und Jugendschutz zu stärken und den illegalen Markt für Cannabis einzudämmen.""},{""text4"":""Die Legalisierung ist hochumstritten. Die Innenminister der Bundesländer hatten zuletzt parteiübergreifend davor gewarnt und Kontrollmöglichkeiten infrage gestellt. Es seien \""gravierende negative Auswirkungen auf die Bekämpfung der organisierten Kriminalität, den Kinder- und Jugendschutz sowie den Gesundheitsschutz\"" zu befürchten. Damit nahmen sie Bedenken auf, die auch Ärzteverbände, Juristen, Kriminalbeamte und die Polizeigewerkschaft teilen.""},{""text4"":""Innerhalb der regierenden SPD haben ebenfalls einige Parlamentarier Einwände gegen die Cannabis-Legalisierung. Klar dagegen ausgesprochen haben sich Union und AfD.""},{""text4"":""Jedoch stimmten wohl nicht nur große Teile der Ampelkoalition für die Legalisierung, sondern auch Abgeordnete aus Reihen der Linken und des Bündnisses Sahra Wagenknecht. Beide Gruppen hatten schon bei einer Abstimmung im Gesundheitsausschuss für das Vorhaben votiert.""},{""text4"":""Nach der Zustimmung des Bundestags kommt das Gesetz am 22. März abschließend in den Bundesrat. Zustimmungsbedürftig ist es dort nicht, die Länderkammer kann aber den Vermittlungsausschuss anrufen und die Legalisierung so verzögern.""}]","Vor dem Brandenburger Tor demonstrieren Menschen für die Cannabis-Legalisierung. (Foto: Nadja Wohlleben/Reuters)","Die Abgeordneten treffen eine historische Entscheidung und votieren mehrheitlich für die Freigabe der Droge. Es gibt aber auch harsche Kritik."
"1717532249-23","https://www.sueddeutsche.de/wirtschaft/cannabis-legalisierung-branche-zukunft-1.6394269","Marihuana","Die Cannabis-Branche feiert die ""Legalisierung light""","Wie die Cannabis-Branche auf die Legalisierung reagiert","[{""text4"":""Freitagnachmittag, im Bundestag läuft gerade die Abstimmung zur Cannabis-Freigabe, als beim Hamburger Versandhändler Growmart bereits die Suchanfragen hochschnellen. Die Leute suchen in dem Shop nach Utensilien zum Anbau von Marihuana, nach Produkten wie LED-Pflanzenlampen, Reflexionsfolien und den sogenannten Growboxen. Geschäftsführer Constantin Otto, 38, sieht dem Treiben an seinem Bildschirm \""freudig\"" zu, erzählt er später am Telefon. Dieser historische Freitag, 23. Februar 2024, an dem Cannabis legal gemacht wurde, ist für sein Geschäft ein zukunftsweisender Tag.""},{""text4"":""Das jahrelange Warten und Bangen für Hunderte Unternehmen aus der Cannabis-Branche hat damit ein Ende. Vielerorts haben sich die Verantwortlichen nach all dem Stress am Freitag noch ein, zwei Gläschen Sekt gegönnt oder einen geraucht - auch wenn das Kiffen bis April und der Anbau bis Juli noch illegal bleiben. In den vergangenen Jahren hatte die Branche ein ständiges Auf und Ab der Gefühle erlebt.""},{""text4"":""Die Ampelkoalition um Bundesgesundheitsminister Karl Lauterbach (SPD) hatte zunächst eine weitreichende Legalisierung von Cannabis zum Freizeitkonsum in Aussicht gestellt, mit lizenzierten Shops und vielleicht sogar Freizeitgras aus Apotheken. Deutschland, lautete die Hoffnung der Branche, würde in kurzer Zeit zum größten Cannabis-Marktplatz der Welt avancieren mit einem jährlichen Umsatz von mehr als fünf Milliarden Euro. Reihenweise deutsche Start-ups investierten, von außen kamen Investoren. Doch die Hoffnung auf das große Geschäft zerschlug sich, da dem Vorhaben europäisches Recht im Wege stand. Der Handel mit Marihuana ist in der EU nur zu wissenschaftlichen und medizinischen Zwecken rechtskonform. Die Industrie musste sich also mit einer \""Legalisierung light\"" anfreunden, die sich Lauterbach neu erdachte: mit nicht-kommerziellen Anbaugemeinschaften, Cannabis Social Clubs genannt, statt gewinnorientierter Cannabis-Shops. Viele mussten ihre großen Pläne aufgeben.""},{""text4"":""Doch auch von der abgespeckten Legalisierung werden nun viele profitieren: Menschen wie Growmart-Gründer Constantin Otto. Die Privathaushalte und Anbaugemeinschaften brauchen zum Anbau nun schließlich das nötige Equipment. Otto sieht sein Geschäft zwar nur als Spezialisten für Indoor-Botanik, doch die Legalisierung spielt ihm in die Karten. Schon jetzt hätten sich die Anfragen und Verkaufszahlen verdreifacht, weshalb der Versandhändler in den vergangenen Wochen seine Lagerbestände schon deutlich aufgestockt habe. Denn bei manchen Produkten drohen bereits Lieferengpässe.""},{""text4"":""Besonders gefragt sind LED-Pflanzenlampen, deren Lichtspektrum für das Züchten von Cannabis ideal ist - und natürlich Growboxen. Sie sehen aus wie Kleiderschränke und sind - versehen mit Töpfen, Lampen, Ventilatoren und Abluft- und Bewässerungssystemen - im Prinzip klimatisierte Gewächshäuser fürs Zimmer, in denen die Cannabis-Pflanzen gedeihen können. Auch für all die Zulieferer von Utensilien wie Lampen oder Düngemitteln winkt jetzt ein gutes Geschäft. Otto sagt, er sei froh, dass Kunden, die Cannabis in seinen Growboxen züchten wollen, dafür nicht mehr verfolgt werden, solange sie sich an die gesetzlich vorgeschriebene Eigenanbaumenge von maximal drei Pflanzen halten.""},{""text4"":""Erleichterung ist am Freitag auch bei den großen Firmen der deutschen Cannabis-Wirtschaft zu spüren - wenn nicht gar Euphorie: \""Das ist ein absoluter Meilenstein. Wir arbeiten seit Jahren auf diesen Moment hin\"", sagt Constantin von der Groeben, der Mitgründer des sächsischen Start-ups Demecan. Das Unternehmen mit 80 Angestellten betreibt in einem ausrangierten Schlachthof bei Dresden eine von aktuell nur drei staatlich lizenzierten Anbaustätten für medizinische Cannabisblüten in Deutschland. Die anderen beiden sind die kanadischen Konzerne Aurora und Tilray.""},{""text4"":""Auch für medizinisches Cannabis, das in Deutschland seit 2017 legal ist, markiert der Freitag einen Wendepunkt: Durch das neue Gesetz werden Freizeitgras und auch Medizinalcannabis nicht mehr als Betäubungsmittel gelten. Für medizinisches Cannabis, dem ein eigenes Gesetz gewidmet wird - das MedCanG - wird daher kein spezielles Betäubungsmittelrezept mehr erforderlich sein. Für Ärztinnen und Apotheker fallen damit strenge Auflagen und Dokumentationspflichten weg. Es reicht ein einfaches Rezept wie bei starken Schmerzmitteln. Apotheken müssen die Blüten nicht länger in Tresore sperren und nicht jedes Gramm dokumentieren. Sie sparen sich Kosten und Zeit.""},{""text4"":""Die Hersteller und Importeure von medizinischem Cannabis, dazu zählen deutsche Firmen wie Cansativa und Cannamedical mit zweistelligen Millionenumsätzen, rechnen durch die Neuregelung mit einer deutlich steigenden Nachfrage. Medizinisches Gras, so lautet die Hoffnung, könnte zu einer Art Ibuprofen 600 werden. Viele Unternehmen stocken ihre Lagerbestände massiv auf, weil sie auf eine rasche Verdopplung und langfristig eine Verzehnfachung der Nachfrage spekulieren. Aktuell wird der Umsatz in Deutschland mit Cannabis-Medikamenten auf rund 300 Millionen Euro jährlich geschätzt.""},{""text4"":""Und da ist noch eine entscheidende Sache, die sich durch das neue Gesetz für deutsche Cannabis-Hersteller ändert: Sie können ihre Erntemengen jetzt deutlich hochfahren. Bisher waren Betriebe wie Demecan an einen Vertrag mit dem deutschen Staat gebunden und durften nur eine Tonne pro Jahr produzieren. Diese Deckelung empfanden sie als diskriminierend, weil auf der anderen Seite der Import von medizinischem Cannabis kaum limitiert war. Doch nun wird die einheimische Produktion dem Import gleichgestellt. Das Gesetz wird dahin gehend geöffnet, dass die Mengen auf einen Antrag hin erhöht werden können. Es darf im Prinzip nun jeder medizinisches Gras produzieren, der sich vom Staat eine sogenannte Arzneimittelherstellungserlaubnis besorgt hat.""},{""text4"":""Demecan hat die Expansion bereits in die Wege geleitet. In seinen Blüteräumen soll schon bald die doppelte Menge gedeihen. \""Wir können dann jede Woche ernten\"", sagt von der Groeben. Auf dem gesamten Gelände könnte die Produktion langfristig auf zehn bis 20 Tonnen erhöht werden. Denn das Start-up schielt auch auf die von Lauterbach angekündigte \""Säule 2\"" im Legalisierungsprozess: In Modellregionen soll es später unter wissenschaftlicher Beobachtung Freizeitcannabis auch aus öffentlichen Geschäften geben. Demecan stünde bereit, das Projekt mit Stecklingen, Qualitätsprüfungen oder auch Blüten zu unterstützen, heißt es aus dem Unternehmen.""},{""text4"":""Die sogenannten Cannabis Social Clubs dürfen das Marihuana künftig unter Auflagen züchten und bis zu 500 Mitglieder damit versorgen - ohne kommerzielle Absichten. Mehr als zwei Dutzend Mitglieder solcher Klubs haben sich am Freitagnachmittag, während der Abstimmung im Bundestag, im Keller des Berliner Hanfmuseums vor einer Leinwand versammelt. Dieser Keller ist nämlich auch die Zentrale des Dachverbands deutscher Cannabis Social Clubs, der offiziellen Vertretung der Anbauvereine. Ihr Vorsitzender ist Steffen Geyer, ein altbekannter Aktivist aus der Cannabis-Szene. Er berichtet, dass sich die Leute mit Tränen in den Augen in die Arme fielen, als das positive Ergebnis verkündet wurde. \""Ich habe 22 Jahre, elf Monate und fünf Tage für diesen Moment gekämpft. Ab jetzt brechen neue Zeiten an. Die Euphorie kickt total.\""""},{""text4"":""Bundesweit haben sich bereits knapp 300 Cannabis-Klubs gegründet, bis Jahresende rechnet Geyer mit bis zu 3000. Nach dem langen Hin und Her hätten die Vereine jetzt Planungssicherheit. Sie können sich Immobilien suchen und Anbaupläne erstellen. Mit den ersten Ernten in Berlin und Hamburg rechnet Geyer von Oktober an, da die Klubs erst vom 1. Juli an ihre eigentliche Arbeit aufnehmen dürfen. In Bayern und Baden-Württemberg, die für ihre rigide Drogenpolitik bekannt sind, dürfte alles etwas langsamer gehen, befürchtet Geyer. Die Behörden könnten den Vereinen Probleme bereiten.""},{""text4"":""Ohnehin herrscht nicht bloß Freude bei den Vereinen. Vielen greift das Gesetz deutlich zu kurz, da Cannabis-Konsumenten auch weiterhin verfolgt werden können und es keine offiziellen Shops geben wird. Der Schwarzmarkt wird deshalb weiterhin blühen, sind viele überzeugt. Vor allem aber fehlt den Vereinen der soziale Aspekt. Das neue Gesetz sieht vor, dass in den Klubheimen Cannabis zwar angebaut, aber nicht geraucht werden darf. \""Die Klubs werden zu einem asozialen Regime gezwungen, obwohl sozial draufsteht\"", sagt Steffen Geyer, und zieht bereits Klagen dagegen in Erwägung. Der Cannabis Social Club München hat daraus schon Konsequenzen gezogen. Der Verein will zwar weiter bestehen, aber anbauen will er nicht mehr - weil ihm die Geselligkeit fehlt.""}]","Demecan-Mitarbeitende überprüfen die Cannabis-Ernte. (Foto: MATTHIAS RIETSCHEL/REUTERS)","Nach einem Auf und Ab der Gefühle ist die Marihuana-Industrie erleichtert, dass Kiffen nun zumindest teilweise legal ist in Deutschland. Viele hoffen auf eine goldene Zukunft."
"1717532252-24","https://www.sueddeutsche.de/bayern/gesundheit-csu-prueft-klage-gegen-gesetz-zur-cannabis-legalisierung-dpa.urn-newsml-dpa-com-20090101-240226-99-129668","Gesundheit","CSU prüft Klage gegen Gesetz zur Cannabis-Legalisierung","Gesundheit - CSU prüft Klage gegen Gesetz zur Cannabis-Legalisierung","[{""text4"":""München/Berlin (dpa) - Die CSU prüft eine Klage gegen die gesetzliche Grundlage zur geplanten Teillegalisierung von Cannabis. „Wir vonseiten des Freistaats Bayern, wir werden uns an allem beteiligen, was dieses Gesetz außer Kraft oder verzögert oder später oder anders in Szene setzen lässt“, sagte Parteichef Markus Söder am Montag nach einer Sitzung des CSU-Vorstands in München. „Wir prüfen alle Klagen von der Zustimmungspflichtigkeit bis zur generellen Beschädigung. Und ich kann heute schon sagen, wir werden dieses Gesetz extremst restriktiv anwenden.“""},{""text4"":""„Dieses Gesetz ist nicht nur ein Schaden für junge Menschen, ist nicht nur eine Gefährdung der Sicherheit für junge Leute und der Gesundheit, sondern das Gesetz ist schlichtweg nicht umsetzbar“, betonte der bayerische Ministerpräsident. Viele wichtige Fragen seien ungeklärt - etwa wer kontrolliere, ob die Zonen um Schulen und Kindergärten, in denen der Konsum nicht gestattet sei, eingehalten würden. Zweifelhaft sei auch, wie mit den vielen laufenden Rechtsverfahren umzugehen sei. „Sollen die einfach gestrichen werden?“""},{""text4"":""Auf Nachfrage erklärte Söder, nun werde unter anderem geprüft, ob das Gesetz wegen seiner Auswirkungen auf die Länder nicht auch im Bundesrat zustimmungspflichtig sei. Auch müsse geklärt werden, ob sich durch das Gesetz keine ungelösten Sicherheitsfragen ergeben hätten. Söder räumte aber ein, dass diese Prüfung sehr schwierig sei und daher sorgfältig abgewogen werden müsse, ob es eine Klage geben könne.""},{""text4"":""Ungeachtet aller Rechtsfragen kündigte Söder an, dass Bayern weiter kein gutes Pflaster für Cannabis-Freunde sein werde: „Wer mit dem Thema Cannabis glücklicher werden will, der ist woanders besser aufgehoben als in Bayern. Das werden wir garantieren.“""},{""text4"":""Nach dem Bundestagsbeschluss für eine kontrollierte Freigabe von Cannabis richten sich die Blicke auf die letzte Hürde im Bundesrat. Möglicherweise schicken die Länder das Gesetz bei der Sitzung am 22. März in den Vermittlungsausschuss. Neben der Kritik von Medizinverbänden, Rechtsexperten und Innenpolitikern sind auch aus den Ländern Einwände laut geworden, dass die Legalisierung und die verbundenen Umstellungen schon zum 1. April greifen sollen.""},{""text4"":""© dpa-infocom, dpa:240226-99-129668/2""}]","CSU kritisiert geplante Teillegalisierung von Cannabis. (Foto: Christoph Soeder/dpa/Archivbild)","Die CSU trommelt schon lange gegen die Cannabis-Pläne des Bundes. Ohne Erfolg. Vor der Beratung im Bundesrat prüft sie juristische Konsequenzen. Bayern soll für Kiffer kein gutes Pflaster werden."
"1717532257-25","https://www.sueddeutsche.de/meinung/cannabis-kiffen-strobl-cdu-baden-wuerttemberg-kommentar-1.6488525","Baden-Württemberg","Die CDU und ihre Angst vor Kiffer-Touris","Cannabis: Baden-Württemberg wird keine Kiffer-Touristen bekommen","[{""text4"":""Jetzt beginnt sie also wieder, die Zeit der Schwarzmaler. Kaum hat sich nach dem Bundestag auch der Bundesrat beim Cannabis-Konsum zu einer Legalisierung light durchgerungen, malt Baden-Württembergs Innenminister Thomas Strobl (CDU) mit kräftigem Pinsel an einem Schreckensszenario für die Grenzregionen. Im Falle seines Bundeslandes: dem Einfall französischer Kiffer-Touristen ins benachbarte Südbaden. Mit all den möglichen Folgen, die einen Innenminister schon qua Amt schlecht schlafen lassen, vom erhöhten Cannabis-Schmuggel bis hin zu vermehrten Verkehrsverstößen infolge des Cannabis-Konsums.""},{""text4"":""Dabei spricht erst mal wenig für seine Thesen und viel dafür, die Chancen höher zu gewichten als die Risiken. Von Ostermontag an können Erwachsene in Deutschland zwar legal Joints rauchen. Die Legalisierung light enthält aber gerade keine Erlaubnis für Verkauf und Weitergabe von Cannabis an Dritte. In Kehl, der größten Stadt an der südbadischen Grenze zu Frankreich, liegt bislang nicht einmal ein Antrag zur Gründung einer Cannabis-Anbauvereinigung vor, einem weiteren Reformbaustein. Angesichts dieser Ausgangslage wünscht man dem Law-and-Order-Mann der Südwest-CDU etwas mehr von der Gelassenheit, die man den Menschen in Südbaden im Allgemeinen nachsagt und der der parteilose Kehler Oberbürgermeister Wolfram Britz in der Causa Cannabis-Tourismus eine wohltuende Stimme gibt. Der Mann der kommunalen Praxis sieht die Lage nämlich: südbadisch entspannt. Und nicht: parteipolitisch aufgeladen.""},{""text4"":""Natürlich gibt es auch gute Gründe, die Reform kritisch zu sehen. Das Szenario eines massenhaften Kiffer-Tourismus gehört sicher nicht dazu. Vielmehr dient es Strobl und seiner CDU offensichtlich zur parteipolitischen Profilierung. Aber auch das kann man gelassen sehen - da der grüne Seniorpartner in der Stuttgarter Regierung dies anders sieht, wird aus den Worten des Innenministers keine Politik werden.""}]","Von Ostermontag an können Erwachsene in Deutschland legal Joints rauchen. (Foto: dpa)","Der Stuttgarter Innenminister Thomas Strobl malt nach der Cannabis-Entscheidung ein Horrorgemälde. Soll er nur."
