web-scraper-order,web-scraper-start-url,text1,text2,text3,text4,text5,text6
"1717532359-50","https://www.sueddeutsche.de/gesundheit/fragen-antworten-oster-high-was-sich-mit-der-cannabis-legalisierung-aendert-dpa.urn-newsml-dpa-com-20090101-240329-99-503344","Fragen & Antworten","Oster-High: Was sich mit der Cannabis-Legalisierung ändert","Fragen & Antworten - Oster-High: Was sich mit der Cannabis-Legalisierung ändert","[{""text4"":""Berlin (dpa) - Die Befürworter freuten sich auf Ostermontag wie auf Weihnachten. Gegner befürchten ein Drogenchaos. Mit dem 1. April ist der Besitz und Konsum von Cannabis für Erwachsene in Deutschland legal geworden. Es stellen sich aber immer noch viele Fragen, wie das konkret aussehen soll.""},{""text4"":""Cannabis verschwindet von der Liste der verbotenen Substanzen im Betäubungsmittelgesetz. Wer 18 und älter ist, darf zu Hause bis zu 50 Gramm aufbewahren und draußen maximal 25 Gramm mit sich führen. Es geht explizit um den Eigengebrauch. Weitergabe und Verkauf bleiben verboten. Zu Hause - nicht im Kleingarten - dürfen außerdem drei Pflanzen angebaut werden. Samen, Pflanzen und geerntetes Cannabis müssen gegen Diebstahl und vor dem Zugriff von Kindern geschützt werden, beispielsweise mit abschließbaren Schränken und Räumen.""},{""text4"":""Aus einem Gramm Cannabis können nach gängiger Einschätzung ungefähr drei Joints gedreht werden - je nach persönlicher Dosierung auch mehr oder weniger. 50 Gramm wären also 150 Joints. Aus Sicht der Legalisierungsgegner ist das viel zu viel. 50 Gramm pro Monat, die Menge, die die künftigen Anbauvereine an ihre Mitglieder abgeben dürfen, nennt die Bundesärztekammer „eine relevante Menge“, „die einem Hoch-Risiko-Konsum entspricht und zu cannabisbezogenen Störungen führt“. Das Gesundheitsministerium argumentiert, es müsse auch legales Cannabis in größerer Menge da sein, wenn man den illegalen Schwarzmarkt ausstechen will.""},{""text4"":""Wo es nicht explizit verboten ist, darf gekifft werden. Verboten ist es auf Spielplätzen, in Schulen, Sportstätten, also auch Fußballstadien, Kinder- und Jugendeinrichtungen und jeweils in Sichtweite davon - in 100 Metern Luftlinie um den Eingangsbereich. Fußgängerzonen sind zwischen 7.00 und 20.00 Uhr ebenfalls kifffreie Zonen.""},{""text4"":""Außerdem ist der Konsum verboten „in unmittelbarer Gegenwart von Personen, die das 18. Lebensjahr noch nicht vollendet haben“. Tabu ist es also, sich einen Joint an einer Bushaltestelle voller Schulkinder anzustecken oder im Garten vor den eigenen minderjährigen Kindern, genauso wie vor einem Kino, wo auch Jugendliche warten. In Raucherkneipen entscheiden die Inhaber, wie sie damit umgehen.""},{""text4"":""Das ist ähnlich wie beim Sicherheitsgurt im Auto oder Handy-Telefonieren am Steuer - man muss schon erwischt oder angezeigt werden. Dass Ordnungsämter und Polizei im großen Stil Cannabis-Streifen losschicken, ist schon aus Personalgründen unwahrscheinlich.""},{""text4"":""Empfindliche Geldbußen und auch Gefängnis sind möglich. Wer etwa die Gramm-Vorgaben zum Besitz leicht überschreitet, riskiert ein Bußgeld. Dass kann laut Gesetz allerdings mit bis zu 30.000 Euro saftig ausfallen. Werden sogar mehr als 30 Gramm im Rucksack, mehr als 60 Gramm zu Hause oder mehr als drei Pflanzen in der Wohnung gefunden, greift das Strafrecht: Es droht im schlimmsten Fall Gefängnis.""},{""text4"":""Das gilt besonders für die Weitergabe der Droge an Kinder und Jugendliche. Wer kifft, wo kiffen nicht erlaubt ist - also auf oder in der Nähe von Spielplätzen, tagsüber in der Fußgängerzone oder in der Nähe von Kindern und Jugendlichen - begeht zwar nur eine Ordnungswidrigkeit, riskiert aber ebenfalls empfindliche Bußgelder bis zu 30.000 Euro.""},{""text4"":""Werden unter 18-Jährige mit Cannabis erwischt, muss die Polizei die Eltern informieren. Insbesondere wenn es sich um sehr junge Konsumenten mit sogenanntem riskantem Konsumverhalten handelt, muss auch das Jugendamt eingeschaltet werden. Die Betroffenen sollen dann an Präventionsprogrammen teilnehmen. Jugendliche müssen aber auch mit strafrechtlichen Konsequenzen rechnen, wenn die gefundenen Mengen die bei Erwachsenen erlaubten Mengen übersteigen, wenn sie dealen oder die Droge an andere Kinder und Jugendliche weitergeben.""},{""text4"":""Sie dürfen erst zum 1. Juli mit dem Anbau von Cannabis beginnen und es gelten strenge Regeln: Die Clubs müssen mindestens 200 Meter von Schulen, Kitas, Spielplätzen und anderen Kinder- und Jugendeinrichtungen entfernt sein, dürfen nicht in Wohngebäuden untergebracht sein und nicht durch auffällige Schilder oder anders für sich werben.""},{""text4"":""Der Konsum in den Anbauvereinigungen, wie sie im Gesetz heißen, ist ebenfalls tabu. Anbauflächen und Lager müssen gesichert werden. Die Vereine dürfen maximal 500 Mitglieder haben und Cannabis in begrenzten Mengen nur an diese Mitglieder abgeben, nicht verkaufen. Die Droge darf nur in einer neutralen Verpackung mit Beipackzettel abgegeben werden, der Informationen zu Gewicht, Sorte, THC-Gehalt (Tetrahydrocannabinol ist der Stoff mit der Rauschwirkung) und Hinweise zu Risiken des Konsums enthält.""},{""text4"":""Aber bis die Pflanzen Blüten treiben, ob zu Hause oder im Verein, vergeht Zeit. Das heißt: Auch mit der Legalisierung zum 1. April blüht weiterhin der Schwarzmarkt?""},{""text4"":""Genau das ist auch ein Kritikpunkt in der politischen Debatte. Ab dem 1. April könnten Erwachsene zwar legal mit größeren Mengen Cannabis unterwegs sein, dieses könne aber objektiv nicht aus legalen Quellen stammen, hatte Sachsen-Anhalts Ministerpräsident Reiner Haseloff zuletzt kritisiert. „Vor allem die ersten Monate werden zu einem Booster für den Schwarzmarkt“, warnte der CDU-Politiker.""},{""text4"":""Gesundheitsminister Karl Lauterbach (SPD) wies das zurück: Wenn jemand etwa am 2. April auf Grundlage einer eigenen angebauten Pflanze konsumiere, spiele es keine Rolle, wann die Pflanze gekauft und aufgebaut wurde oder wie viel Wasser sie hatte. Sondern es gelte: „Hier ist sie, sie ist jetzt legal, und der Konsum ist auch legal.“ Die meisten deutschen Baumärkte wollen erst einmal kein entsprechendes Saatgut in ihr Sortiment aufnehmen.""},{""text4"":""Erst einmal ändert sich nichts: Bei wem der Cannabis-Wirkstoff THC nachgewiesen wird, auch wenn der Konsum Tage zurückliegt, der begeht eine Ordnungswidrigkeit. In der Rechtsprechung hat sich dafür der niedrige Wert von 1 Nanogramm THC je Milliliter Blut etabliert, ab dem Geldbußen, Punkte und Fahrverbot drohen. Nach dem Vorbild der 0,5-Promille-Marke für Alkohol soll aber auch ein Toleranz-Grenzwert für THC kommen. Eine Expertenkommission schlug 3,5 Nanogramm vor. Erst ist aber der Bundestag am Zug, ein Gesetz dafür zu beschließen, was noch dauern dürfte.""},{""text4"":""Eigentlich wollte die Ampel doch auch den freien Verkauf von Cannabis in Drogerie-ähnlichen Geschäften ermöglichen. Was ist daraus geworden?""},{""text4"":""Das liegt auf Eis. Wegen europarechtlicher Hürden ist die Ampel von diesem ursprünglichen Ziel abgewichen und hatte angekündigt, Produktion, Vertrieb und Verkauf in speziellen Geschäften durch Unternehmen erst einmal nur regional und zeitlich begrenzt in Pilotprojekten zu erproben. Konkrete Pläne dafür liegen aber bis heute nicht vor.""},{""text4"":""Cannabis ist bisher die am häufigsten genutzte illegale Droge. Dazu, wie viel jährlich zu nicht-medizinischen Zwecken konsumiert wird, liegen laut Gesundheitsministerium aber noch keine validen Daten vor.""},{""text4"":""Laut einer Studie für 2021 haben 4,5 Millionen Erwachsene nach eigenen Angaben in den zurückliegenden zwölf Monaten wenigstens einmal Cannabis konsumiert - bei Männern 10,7 Prozent und bei Frauen 6,8 Prozent. In der Altersgruppe der 18- bis 24-Jährigen war der Konsum demnach am stärksten verbreitet. Dabei bestehen Experten zufolge bis zum Alter von 25 Jahren wegen des noch anhaltenden Reifeprozesses des Gehirns besondere Risiken für psychische, physische und soziale Beeinträchtigungen.""},{""text4"":""© dpa-infocom, dpa:240329-99-503344/7""}]","Ab 1. April für Erwachsene in Deutschland legal: Der Besitz und Konsum von Cannabis. (Foto: Lino Mirgeler/dpa)","Ab Ostermontag ist der Konsum von Cannabis in Deutschland für Erwachsene legal. Doch was heißt das konkret? Was ist wo und wie erlaubt? Und welche Probleme drohen?"
"1717532363-51","https://www.sueddeutsche.de/politik/cannabis-legalisierung-deutschland-gesetz-regeln-konsum-1.6388353","Drogen","Wer bald nach welchen Regeln Cannabis konsumieren darf","Cannabis Legalisierung: Wer bald in Deutschland nach welchen Regeln konsumieren darf","[{""text4"":""Nach langem Hin und Her hat der Bundestag an diesem Freitag ein Gesetz beschlossen, das den legalen Konsum von Cannabis vom 1. April an ermöglichen soll. Regeln gibt es aber trotzdem - und das nicht zu knapp. Ein Überblick.""},{""text4"":""Was genau ist künftig erlaubt?""},{""text4"":""Grundsätzlich dürfen ausschließlich Erwachsene konsumieren, für Kinder und Jugendliche bleibt Cannabis ohne Ausnahme verboten. Wer volljährig ist, darf bis zu 50 Gramm Cannabis für den privaten Konsum besitzen und in seinem Zuhause aufbewahren. Dort ist auch der Anbau von maximal drei Pflanzen erlaubt. Bringen die Pflanzen mehr Ernte, muss alles, was 50 Gramm überschreitet, sofort vernichtet werden. Im öffentlichen Raum dürfen maximal 25 Gramm mitgeführt werden. Und: Cannabis darf immer nur für den Eigenkonsum beschafft und aufbewahrt und nicht weitergegeben werden, auch nicht an Erwachsene.""},{""text4"":""Darf überall konsumiert werden?""},{""text4"":""Nein. In \""unmittelbarer Gegenwart\"" von Kindern und Jugendlichen darf Cannabis überhaupt nicht konsumiert werden. Außerdem ist die Verwendung der Droge auf Spielplätzen, in Schulen, Kitas, Jugendeinrichtungen und Sportstätten verboten - sowie in hundert Metern Sichtweite um all diese Einrichtungen. In Fußgängerzonen gilt ein Verbot in der Zeit zwischen sieben und 20 Uhr. In militärischen Bereichen der Bundeswehr ist der Drogenkonsum rund um die Uhr verboten.""},{""text4"":""Wo kann man Cannabis legal erwerben?""},{""text4"":""Hier wird es kompliziert. Das Gesetz sieht grundsätzlich zwei Möglichkeiten vor, Cannabis zu bekommen: Entweder man baut es zu Hause selbst an. Oder man wird Mitglied in einem sogenannten \""Social Club\"". Solche Anbauvereinigungen werden in den kommenden Monaten wohl bundesweit entstehen. Jeder dieser Klubs darf maximal 500 Mitglieder aufnehmen, diese müssen ihren Wohnsitz in Deutschland haben. In den Klubs kann gemeinschaftlich angebaut werden. An jedes Mitglied darf dann Cannabis abgegeben werden, maximal 50 Gramm im Monat und nicht mehr als 25 Gramm pro Tag. Zur Orientierung: Aus 25 Gramm lassen sich ungefähr 75 Joints herstellen. Für junge Erwachsene zwischen 18 und 21 Jahren gilt eine Sonderregelung - sie haben, die Klubmitgliedschaft vorausgesetzt, Anspruch auf maximal 30 Gramm pro Monat, wobei der THC-Gehalt höchstens bei zehn Prozent liegen darf. THC, also Tetrahydrocannabinol, ist der berauschende Wirkstoff. Cannabis-Klubs dürfen keine Werbung machen, Lager und Anbauflächen müssen gesichert sein.""},{""text4"":""Wie wird bezahlt?""},{""text4"":""Um Cannabis aus einem Social Club zu beziehen, muss man es persönlich vor Ort entgegennehmen und dabei den Mitgliedsausweis und den Personalausweis vorlegen. Postversand ist ausgeschlossen. Bezogen werden kann nur Cannabis in Reinform, keine Mischungen mit Tabak oder Lebensmitteln.""},{""text4"":""Das bedeutet: Fertig gedrehte Joints sind nicht zu bekommen, Hasch-Kekse auch nicht. Auf einem beigelegten Informationszettel müssen zudem Gewicht, Sorte und THC-Gehalt vermerkt sein, sowie Hinweise zu gesundheitlichen Risiken. Aber: Ein Kaufpreis darf nicht verlangt werden. Die Anbauklubs sollen sich über die Mitgliedsbeiträge finanzieren. Besonders für Gelegenheitskonsumenten könnte Kiffen also unverhältnismäßig teuer sein, wenn sie den gleichen Mitgliedsbeitrag bezahlen wie Menschen, die ihre 50 Gramm Monat für Monat voll ausschöpfen.""},{""text4"":""Was bedeutet das neue Gesetz für den Straßenverkehr?""},{""text4"":""Das Bundesverkehrsministerium arbeitet noch an einer Regelung für eine THC-Grenze am Steuer - vergleichbar mit der Promille-Grenze, die für Alkohol gilt. Kompliziert ist unter anderem, dass THC relativ lange im Blut nachweisbar ist, selbst wenn die berauschende Wirkung längst wieder nachgelassen hat. Bis zum 31. März soll es eine Lösung geben.""},{""text4"":""Ist es fix, dass die Legalisierung zum 1. April in Kraft tritt?""},{""text4"":""Nicht ganz. Grundsätzlich benötigt das Gesetz keine Zustimmung durch den Bundesrat. Die Länderkammer kann aber trotzdem den Vermittlungsausschuss anrufen. Damit könnte sie die Legalisierung nicht stoppen, aber zumindest verzögern. Das CSU-geführte Bayern hat bereits angekündigt, einen entsprechenden Antrag zu stellen. Die Unionsländer hoffen auf eine Stimmenmehrheit im Bundesrat, zumal auch viele Sozialdemokraten das Gesetz kritisch sehen. So haben sich unter anderem die Landesinnenminister geschlossen dagegen ausgesprochen - also auch die von der SPD. Auch im Bundestag wollte die SPD-Fraktion dem Gesetz nicht geschlossen zustimmen.""},{""text4"":""Ist die Legalisierung damit abgeschlossen?""},{""text4"":""Nach den offiziellen Plänen der Ampel-Regierung ist das Gesetz, das nun in Kraft tritt, nur ein erster Schritt. In einer zweiten Phase sollen Modellregionen definiert werden, in denen Cannabis in lizenzierten Geschäften frei verkauft wird. Allerdings: Schon der Gesetzgebungsprozess für Phase eins war turbulent - zwischenzeitlich schien die Mehrheit in der Koalition zu wackeln. Zudem ist Bundesgesundheitsminister Karl Lauterbach (SPD) nach einer kurzen Phase als Legalisierungsfan nun wieder zu einer eher rigiden Haltung zurückgekehrt. Ob Phase zwei also wirklich noch in dieser Legislaturperiode begonnen wird, ist zumindest fraglich.""},{""text4"":""Gibt es eine rückwirkende Amnestie?""},{""text4"":""Wer schon mal für ein Vergehen belangt wurde, das künftig nicht mehr strafbar ist, kann einen Antrag stellen und den Eintrag aus seiner Akte löschen lassen. Grundsätzlich wäre eine rückwirkende Amnestie auch möglich, wenn jemand gerade eine Gefängnisstrafe absitzt. Allerdings muss man für reine Konsumvergehen in der Regel nicht einsitzen. Denkbar ist aber, dass Häftlinge, die für mehrere Delikte verurteilt wurden, einen Antrag auf Reduktion ihrer Strafe stellen können.""}]","Kiffen wird legal - allerdings nur für Erwachsene und nicht überall. (Foto: Fabian Sommer/dpa)","Die Legalisierung von Cannabis ist eine fundamentale Änderung in der deutschen Drogenpolitik. Was sich mit dem neuen Gesetz ändert - die wichtigsten Fragen und Antworten."
"1717532367-52","https://www.sueddeutsche.de/politik/cannabis-gesetz-union-steinmeier-unterschrift-1.6484929","Cannabis-Gesetz","Die Union hofft auf den Bundespräsidenten","Cannabis-Gesetz: Die Union hofft auf den Bundespräsidenten","[{""text4"":""Dass die Union sich für den Bundespräsidenten begeistert, kommt auch nicht alle Tage vor. Nun aber ist Frank-Walter Steinmeier plötzlich zum Hoffnungsträger der CDU avanciert, wenn auch unfreiwillig. Denn der Bundespräsident, so stellen die Christdemokraten sich das vor, möge doch bitte das Gesetz zur Cannabis-Legalisierung aufhalten.""},{""text4"":""Am vergangenen Freitag hatte der Bundesrat das umstrittene Gesetzesvorhaben passieren lassen. Es sieht vor, dass von April an, wenn auch unter Einhaltung zahlreicher Auflagen, in Deutschland legal Cannabis konsumiert werden kann. Tino Sorge, der gesundheitspolitische Sprecher der Unionsfraktion im Bundestag, hofft nun, dass Steinmeier dem Gesetz die Unterschrift verweigert. \""Das Gesetz sollte nach der chaotischen Debatte vorerst gestoppt werden\"", sagte Sorge dem Redaktionsnetzwerk Deutschland.""},{""text4"":""Ob Steinmeier also die Idee vom legalen Kiffen beerdigt? Allzu große Hoffnungen sollte sich die Union wohl nicht machen. Im Bundespräsidialamt gibt man sich auf Anfrage zurückhaltend: Man prüfe jedes Gesetz \""sehr gründlich\"", sagt ein Sprecher. Diese Prüfung werde noch einige Tage in Anspruch nehmen. Bei der Prüfung durch den Bundespräsidenten geht es allerdings weniger darum, ob Steinmeier die Cannabis-Legalisierung persönlich gut oder schlecht findet. Im Vordergrund steht vielmehr die Frage, ob das Gesetz korrekt zustande gekommen ist und ob es mit dem Grundgesetz in Einklang steht.""},{""text4"":""Dass ein Bundespräsident ein Gesetz nicht unterschreibt, ist in der Geschichte der Bundesrepublik die absolute Ausnahme. Frank-Walter Steinmeier hat es allerdings schon einmal gemacht: 2020 verweigerte er einem Gesetz der damaligen schwarz-roten Bundesregierung die Unterschrift. Steinmeier hatte Sorge, ein Gesetz zur Bekämpfung von Rechtsextremismus und Hasskriminalität könnte in Teilen verfassungswidrig sein. Die Koalition musste nachbessern, erst dann unterschrieb Steinmeier - mit mehreren Monaten Verspätung.""},{""text4"":""Dass ein Gesetzesvorhaben endgültig scheitert, weil der Bundespräsident die Ausfertigung ablehnt, ist noch seltener. Zuletzt hatte Bundespräsident Horst Köhler im Jahr 2006 seine Unterschrift verweigert - und das gleich zweimal binnen weniger Wochen. So lehnte Köhler ein Gesetz zur Teil-Privatisierung der Flugsicherung ab, nur kurze Zeit später eines zur Neuregelung des Rechts auf Verbraucherinformation. Bei der Verbraucherinformation besserte die Regierung nach, die Flugsicherung wurde erst mehrere Jahre später wieder ein Thema.""},{""text4"":""Oft ging es beim Widerstand des Staatsoberhaupts eher um formelle denn um inhaltliche Fragen. Zum ersten Mal verweigerte 1951 der damalige Bundespräsident Theodor Heuss seine Unterschrift: Einem Gesetz über die Verwaltung der Einkommen- und Körperschaftsteuer fehlte die Zustimmung des Bundesrats. Gustav Heinemann wies erst 1969 das Ingenieurgesetz und 1970 das Architektengesetz zurück, weil er der Auffassung war, beide fielen nicht in den Kompetenzbereich des Bundes.""},{""text4"":""Bereits zuvor war Heinrich Lübke 1960 gegen ein Gesetz über den Betriebs- und Belegschaftshandel - er sah die Freiheit der Berufsausübung beeinträchtigt. 1976 stellte sich Walter Scheel gegen die Abschaffung der Gewissensprüfung von Wehrdienstverweigerern. Und Richard von Weizsäcker hatte 1991, ähnlich wie Jahre später Köhler, Bedenken bei einem Gesetz zur Flugsicherung. Er unterschrieb erst nach einer Verfassungsänderung.""},{""text4"":""2002 übte Johannes Rau Kritik am Zustandekommen des Zuwanderungsgesetzes: Damals war im Bundesrat eine uneinheitliche Stimmabgabe des Landes Brandenburg als Zustimmung gewertet worden. Rau unterschrieb, regte aber eine Prüfung durch das Bundesverfassungsgericht an - das kassierte das Gesetz.""},{""text4"":""Eine uneinheitliche Stimmabgabe im Bundesrat gab es auch jetzt beim Cannabis-Gesetz: Weil die sächsische Landesregierung sich nicht einigen konnte, wurde ihr Votum, wie vorgesehen, als ungültig verbucht. Für die Union bleibt also nur noch der Hoffnungsträger im Schloss Bellevue.""}]","Bei der Prüfung durch den Bundespräsidenten geht es weniger darum, ob Frank-Walter Steinmeier ein Gesetz gut oder schlecht findet - sondern darum, ob es korrekt zustande gekommen ist. (Foto: Britta Pedersen/dpa)","CDU und CSU fordern Frank-Walter Steinmeier auf, dem Gesetz zur Cannabis-Legalisierung die Unterschrift zu verweigern. Ist das realistisch?"
"1717532371-53","https://www.sueddeutsche.de/gesundheit/gesundheit-redmann-cannabis-gesetz-handwerklich-schlecht-gemacht-dpa.urn-newsml-dpa-com-20090101-240323-99-440139","Gesundheit","Redmann: Cannabis-Gesetz handwerklich schlecht gemacht","Gesundheit - Redmann: Cannabis-Gesetz handwerklich schlecht gemacht","[{""text4"":""Potsdam (dpa/bb) - Der Chef der CDU in Brandenburg, Jan Redmann, hält die geplante Teillegalisierung von Cannabis in der derzeitigen Form für falsch. Das Gesetz sei handwerklich so schlecht gemacht, dass zu befürchten sei, dass die Justiz ins Chaos stürze, sagte Redmann am Samstag im rbb. „Das Gesetz verlangt von der Justiz, innerhalb von nicht mal zwei Wochen mehrere Tausend Strafverfahren daraufhin zu prüfen, ob Menschen, die früher als Verbrecher bestraft wurden, weil sie nämlich im großen Stil gedealt haben (...), aus der Haft entlassen werden müssen.“ Das stelle die Justiz vor eine unlösbare Aufgabe.""},{""text4"":""Der Bundesrat hatte das vom Bundestag beschlossene Cannabis-Gesetz am Freitag passieren lassen. Trotz viel Kritik gab es in der Länderkammer keine Mehrheit dafür, den Vermittlungsausschuss von Bundestag und Bundesrat anzurufen und das Gesetz damit auszubremsen. Der Text erlaubt Besitz und Anbau der Droge für Volljährige mit zahlreichen Vorgaben zum Eigenkonsum. Die Zäsur in der Drogenpolitik kann damit am Ostermontag in Kraft treten, zuvor muss sie aber noch von Steinmeier unterzeichnet und amtlich verkündet werden.""},{""text4"":""Die Unionsfraktion im Bundestag hat Bundespräsident Frank-Walter Steinmeier aufgerufen, das Gesetz zur Cannabis-Legalisierung nicht zu unterzeichnen. „Wir appellieren an den Bundespräsidenten, das Cannabisgesetz nicht zu unterzeichnen. Zu groß ist die einstimmige Kritik sämtlicher Justiz- und Innenminister der Länder“, sagte der gesundheitspolitische Sprecher der Unionsfraktion, Tino Sorge, dem Redaktionsnetzwerk Deutschland (RND).""},{""text4"":""© dpa-infocom, dpa:240323-99-440139/2""}]","Vertreterinnen der Initiative „Omas gegen Rechts“ treffen sich am Rande der Plenarsitzung des Landtags Brandenburg mit Landtagspräsidentin Ulrike Liedtke. (Foto: Jens Kalaene/dpa)",""
