web-scraper-order,web-scraper-start-url,text1,text2,text3,text4,text5,text6
"1717532163-1","https://www.sueddeutsche.de/muenchen/landkreismuenchen/aschheim-cannabis-megastore-legalisierung-hanf-wenzel-cerveny-plaene-1.6317185","Anwohner besorgt","""Hanf-König"" will ""Megastore"" für Cannabis in Aschheim eröffnen","Bei München: „Hanf-König“ will „Megastore“ für Cannabis in Aschheim eröffnen","[{""text4"":""Viel deutet in dem Gebäude an der Aschheimer Saturnstraße nicht mehr auf den ehemaligen Supermarkt hin, die Hallen erinnern vielmehr an den Ausverkauf eines Warenhauses. Größtenteils leere Holzregale und Vitrinen stehen auf den Fliesen, Umzugskartons drängen sich dort, wo noch im Sommer Obst und Gemüse verkauft wurde. Vereinzelt erkennt man noch Hinweise auf die vorherige Nutzung: Schilder mit dem rot-weißen Logo der Supermarktkette weisen den Weg zum Parkplatz. Hinter den automatischen Schiebetüren steht außerdem eine Auslage für Gebäck, an der noch Schilder die verschiedenen Brotsorten anpreisen. Auch die Fleischtheke im hinteren Bereich des Ladens ist unverändert. Bald werden hier allerdings keine Würstchen und Steaks liegen, sondern Cannabisblüten.""},{""text4"":""Sobald das Gesetz es zulässt, will Wenzel Cerveny in dem ehemaligen Rewe-Markt im Aschheimer Gewerbegebiet seinen \""Chillout Club\"" betreiben. Dahinter steckt ein Cannabis-Verein, in dem Hanfpflanzen angebaut werden sollen und in dem sich Mitglieder jeden Monat eine festgelegte Menge der Blüten abholen dürfen - so erlaubt es jedenfalls der Gesetzentwurf zur Legalisierung von Cannabis, dessen Verabschiedung sich aktuell allerdings in Bundestag und Bundesrat verzögert.""},{""text4"":""Auch wenn die Droge im ehemaligen Supermarkt nicht offen verkauft werden wird - in der Aschheimer Bürgerversammlung sorgte die Aussicht auf einen Cannabis-Club kürzlich für Wirbel. Mehrere Mütter äußerten Besorgnis um ihre Kinder, fürchten eine regelrechte Drogenszene in Aschheim. Er könne die Ängste verstehen, sagt Cerveny, der Inhaber einer Ladenkette von elf Hanf-Shops und Vorsitzender des Cannabis Verband Bayern ist. Doch in seinem \""Megastore\"" werde alles \""sauber\"" laufen.""},{""text4"":""Der 62-jährige Unternehmer hat deutschlandweit den Ruf eines \""Hanf-Königs\"" und verkauft in seinen Läden Hanf-Produkte \""light\"" wie Tees, Öle und Kekse, aber auch Kleidung. Alles legal. Er handele nur mit THC-freien Produkten, sagt Cerveny. Tetrahydrocannabinol, abgekürzt THC, ist der Stoff, dem Marihuana seine berauschende Wirkung zu verdanken hat. Bei Nutzhanfsorten ist er weitgehend weg gezüchtet. Dennoch geraten seine Geschäfte immer wieder ins Visier der Polizei. \""Aber sie finden nie etwas Unerlaubtes\"", sagt Cerveny, der 2013 für die Bayernpartei und 2018 für die FDP in den Landtag einziehen wollte.""},{""text4"":""Gekifft hat Cerveny nach eigenen Angaben noch nie, aber er kämpft seit Jahren für die Legalisierung von Cannabis, weil er von dessen medizinischen Nutzen überzeugt ist. Cannabis wird beispielsweise in der Schmerztherapie eingesetzt, gegen manche Nebenwirkungen einer Chemotherapie und soll auch gegen den Tremor von Parkinson-Patienten helfen.""},{""text4"":""Für den Anbau-Verein in Aschheim haben sich dem Gründer zufolge bereits 200 Personen angemeldet. \""60 Prozent von ihnen sind Menschen, die bereits medizinisches Cannabis konsumieren\"", sagt Cerveny. Bis zu 500 Mitglieder darf ein Verein, wenn das Gesetz in Kraft tritt, mit je 50 Gramm im Monat versorgen, für einen Monatsbeitrag von 150 Euro. \""Bei uns kostet das Gramm drei Euro. Auf der Straße sind es je nach Qualität zehn bis 20 Euro\"", sagt der Vereinsgründer. Auch Medizin-Cannabis sei deutlich teurer.""},{""text4"":""Die Unsicherheit, wann das geplante Gesetz kommt, ärgert ihn. Ursprünglich wollte er bereits im Januar mit dem Anbau der Hanfpflanzen beginnen, jetzt rechnet er mit März oder April. Durch die Verzögerung entstehen ihm nach eigenen Worten enorme Kosten, aber trotz der Schwierigkeiten sieht Cerveny in der Legalisierung einen bedeutenden Schritt. \""Die Entkriminalisierung ist wichtig.\""""},{""text4"":""In Aschheim will Cerveny ebenfalls das Image von Cannabis aufbessern. Der Eingangsbereich des früheren Supermarkts soll eine Art Bistro werden, indem es kleine Snacks, Kaffee und andere nicht alkoholische Getränke gibt. Daran schließt sich eine Natur-Erlebniswelt an, wie der Hanf-König es nennt. Mit seiner bestehenden Kette soll der Laden in Aschheim aber nichts zu tun haben, er habe ein unabhängiges Unternehmen gegründet, das von seiner Frau geführt werde, sagt Cerveny. Verkauft werden sollen dennoch ähnliche Hanf-Produkte wie in seinen Läden, von Kleidung über Kosmetik bis hin zu Schuhen.""},{""text4"":""Ein Teil der Ware ist bereits in Aschheim angekommen: An Kleiderständern hängen Babystrampler und Damenshirts. Gleichzeitig soll man sich informieren können über alles, was aus Cannabis hergestellt werden kann. Cerveny vergleicht die Erlebniswelt mit einem Museum: \""Hanf ist ein Tausendsassa. Man kann alles Mögliche daraus machen.\""""},{""text4"":""Dieser Teil der Räumlichkeiten soll unabhängig von der Legalisierung Ende Februar öffnen und für alle zugänglich sein. \""Die Leute sollen sehen, dass es hier nicht kriminell zugeht.\"" Für den Betreiber ist Aufklärung \""das A und O\"", wie er sagt. Im Bistro will er daher regelmäßig verschiedene Fachvorträge organisieren, unter anderem von Medizinern.""},{""text4"":""Noch gelangt man vom Eingangsbereich ohne Weiteres in den hinteren Teil des früheren Supermarkts. Das wird sich ändern: Hier sollen bald die Räume entstehen, in denen die Pflanzen angebaut, getrocknet und verarbeitet werden. Betreten dürfen diese nur die fünf Mitarbeiter, die der Unternehmer beschäftigen will - nicht einmal die Mitglieder haben Zutritt. \""60 Prozent von ihnen sind Menschen, die bereits medizinisches Cannabis konsumieren\"", erklärt Cerveny.""},{""text4"":""Für sie gibt es einen gesonderten Eingang, an dem sie ihre Blüten abholen können. An der Ausgabetheke ist dann Schluss, sagt Cerveny. Denn die drei Anbauräume müssten absolut steril bleiben. Mit Straßenschuhen darf man nicht hinein, die Mitarbeiter müssen sich umziehen, um keine Keime einzuschleppen. Alle schmutzigen Arbeiten - damit meint Cerveny alles, was mit Erde zu tun hat - sollen in einem gesonderten Raum im Keller erledigt werden. Sortiert und abgepackt werden die Blüten in der früheren Fleischtheke, die laut Cerveny optimale Bedingungen bietet. Schließlich ist hier alles auf die Verarbeitung von Lebensmitteln ausgerichtet. \""Hygienischer geht es nicht.\""""},{""text4"":""Der Betreiber sieht die Räumlichkeiten auch als Blaupause: Bei dem Club in Aschheim handelt es sich seinen Angaben nach um den ersten in ganz Deutschland. Aschheim solle ein Vorzeigeprojekt werden, auf das man verweisen könne, wenn man in Landshut, Erding oder Rosenheim die nächsten Clubs eröffne. Bereits im Sommer nächsten Jahres soll es so weit sein.""}]","Wenzel Cerveny hat in Aschheim einen Hanf-Supermarkt eröffnet und will einen Cannabis-Anbauverein gründen. (Foto: Sebastian Gabriel/)","In einem ehemaligen Supermarkt zieht ein Cannabis-Club ein, der nach der Legalisierung Hanf anbauen und an seine Mitglieder verkaufen will. Dass es am Ort Ängste vor einer Drogenszene gibt, versteht der Betreiber sogar. Was dort nun geplant ist."
"1717532165-2","https://www.sueddeutsche.de/meinung/kommentar-cannabis-legalisierung-moratorium-1.6334274","Cannabis-Legalisierung","Besser, sie lassen es bleiben","Cannabis-Legalisierung: Lasst stecken","[{""text4"":""Bubatz legal, darauf hatten sich so manche in diesem Jahr gefreut. Im April sollte nach dem Willen der Ampelkoalition der Konsum von Cannabis erlaubt werden - zwar nur begrenzt, aber immerhin. Doch das Vorhaben steht auf der Kippe. Die Innenminister der Länder sprechen sich gegen die Legalisierung aus, im Bundesinnenministerium gibt es Bedenken. Ein neuer Bericht des Bundeskriminalamtes weckt weitere Zweifel, ob die Sicherheitsbehörden durch die Reform entlastet würden. Und ausgerechnet einige Abgeordnete aus der Bundestagsfraktion der SPD stemmen sich gegen die Pläne und bremsen mit Karl Lauterbach ihren eigenen Minister aus. Erneut könnte ein Prestigeprojekt der Regierung scheitern. Doch diese Niederlage könnte sich als Glücksfall erweisen.""},{""text4"":""Zunächst lässt es tief blicken, wenn die Ampel auch noch dabei versagt, das Marihuana freizugeben. Denn dass in der Haushalts-, der Verkehrs- oder der Sozialpolitik Welten zwischen SPD, Grünen und FDP liegen, war von Beginn der Koalition an klar. Gesellschaftspolitische Liberalisierung, wie beim Umgang mit Cannabis, sollte hingegen der Kitt sein, der die drei zusammenhält. Sie sollte das ganze Land spüren lassen, dass eine \""Fortschrittskoalition\"" am Werk ist.""},{""text4"":""Wenn es jetzt doch nicht zu einer Legalisierung kommen sollte, ist das zunächst aus gesundheitlicher Sicht zu begrüßen. Man nehme den Alkohol. Wenige Länder der Welt pflegen einen so laxen Umgang mit der Droge wie Deutschland. Bier, Wein, selbst Schnaps sind günstig und einfach zu besorgen - und richten enormen Schaden an: Mehr als 14 000 Menschen starben 2020 an Krankheiten, die ausschließlich durch Alkoholkonsum ausgelöst wurden. Doch die Volksdroge Alkohol ist gesellschaftlich fest verankert, daran ändert auch kein \""Dry January\"" etwas. Da braucht es auf dem legalen Markt nicht noch eine weitere Droge, mit deren Legalisierung der Staat auch noch das Signal sendet: Gras zu rauchen, sei nicht weiter gefährlich, ist ja jetzt legal.""},{""text4"":""Dabei wird angenommen, dass der Konsum vor allem bei jungen Menschen, deren Gehirne sich noch entwickeln, schädlich sein und das Risiko für psychische Krankheiten erhöhen kann. Fachleute gehen davon aus, dass diese Entwicklungsphase bis Mitte 20 andauert, der Gesetzentwurf koppelt den Besitz aber an das Erwachsenenalter, die Altersgrenze liegt also bei 18 Jahren.""},{""text4"":""Kritik an den Legalisierungsplänen gibt es ohnehin zuhauf: Der Richterbund beklagte schon im August etwa, die Cannabis-Pläne würden die Justiz nicht ent-, sondern eher belasten. Auch sei nicht zu erwarten, dass das neue Gesetz den Schwarzmarkt eindämme. Im Vergleich zu den geplanten Anbauvereinigungen und Cannabis-Clubs, in denen der Verkauf stattfinden soll, sei der Schwarzmarkt schlicht zu \""attraktiv\"".""},{""text4"":""Die Ampel wäre also gut beraten, ihren Gesetzentwurf unter ein Moratorium zu stellen und ihn zu überarbeiten. Er käme jetzt ohnehin zum politisch falschen Zeitpunkt: Gerade erst blockierten aufgebrachte Bauern mit ihren Traktoren das halbe Land, die Regierung hat mit Haushaltsdebakel und Heizungsgesetz eine Kette von Ärgernissen erzeugt. Die Cannabis-Legalisierung wäre vielleicht koalitionsintern ein kleiner Befreiungsschlag. Ihren Gegnern lieferte die Ampel dadurch aber neue Munition für Angriffe. Sie dürften - zu Recht - in Gestalt der Frage daherkommen: Gibt es denn nichts Wichtigeres?""}]","""Hey, das ist Spliff-Politik, so ein bisschen wie Krieg"", singt Rapper B-Tight - ob das derzeit im Sinn der Ampelkoalition ist? (Foto: Philipp von Ditfurth/dpa)","Gut möglich, dass es auch mit den drogenpolitischen Plänen der Ampelkoalition nichts wird. Auf den ersten Blick wäre es ein weiterer Rückschlag."
"1717532167-3","https://www.sueddeutsche.de/muenchen/dachau/dachau-cannabis-rezept-verkehrskontrolle-1.6318900","Verkehrskontrolle","Polizisten zweifeln an Echtheit von Cannabis-Rezept","Dachau: Polizisten zweifeln an Echtheit von Cannabis-Rezept","[{""text4"":""Die Polizei hat am Dienstagabend gegen 23.30 Uhr einen Autofahrer auf der Münchner Straße in Dachau kontrolliert, dessen Beifahrer eine geringe Menge Cannabis dabeihatte. Laut Polizei konnte der 27-jährige Dachauer zwar ein Rezept für den legalen Umgang mit dem Betäubungsmittel vorweisen, allerdings zweifelten die Beamten an der Echtheit beziehungsweise korrekten Verschreibung des Rezepts. Die Drogen wurden sichergestellt. Ob ein Betäubungs- und Urkundsdelikt vorliegt, wird noch ermittelt.""}]","",""
"1717532171-4","https://www.sueddeutsche.de/muenchen/wolfratshausen/cannabis-legalisierung-1.6516572","Cannabisgesetz bringt Justiz und Polizei Mehrarbeit","""Im Moment ist es verheerend""","Cannabis-Legalisierung: Wie es im Landkreis läuft","[{""text4"":""Das neue Gesetz zur Teillegalisierung von Cannabis der Bundesregierung macht Polizei und Justiz im Landkreis Bad Tölz-Wolfratshausen zumindest aktuell mehr statt wie versprochen weniger Aufwand. \""Im Moment ist es verheerend\"", sagt Friedrike Kirschstein-Freund. Weil die ab 1. April geltende Regelung eine rückwirkende Amnestie für Vergehen vorsieht, muss die Jugendstrafrichterin am Wolfratshauser Amtsgericht 105 Vollstreckungsverfahren nochmals überprüfen. Das bedeutet, Akten zu studieren, Verurteilte anzuschreiben und neu über das Strafmaß zu entscheiden. Das ist dann besonders aufwendig, wenn Täter zusätzlich wegen weiterer strafbarer Delikte verurteilt worden sind.""},{""text4"":""Wer versucht, bei den Polizeiinspektionen im Landkreis näher nachzufragen, wird an das übergeordnete Präsidium Oberbayern Süd in Rosenheim verwiesen - und erhält eine ebenso klare Antwort. \""Wir setzen die gültige Rechtslage um\"", so Sprecher Daniel Katz. \""Ich würde nicht sagen, dass das eine Entlastung ist.\""""},{""text4"":""In einer umfangreichen Stellungnahme hat der Deutsche Richterbund bereits den Entwurf des neuen Gesetzes kritisiert. Die Neuregelung erlaubt Erwachsenen, bis zu 25 Gramm unterwegs dabeizuhaben und bis zu 50 Gramm zu Hause zu besitzen. In den eigenen vier Wänden darf jede volljährige Person bis zu drei Cannabispflanzen im Eigenanbau haben. Weiterhin sind zahlreiche zusätzliche Vorschriften zu überwachen. Verboten ist es etwa, Cannabis in Sichtweite von Schulen oder Kinder- und Jugendeinrichtungen zu konsumieren. Auf Kinderspielplätzen oder in öffentlich zugänglichen Sportstätten beziehungsweise in deren Sichtweise ist das zudem unzulässig. Unerlaubt ist ebenso etwa in \""unmittelbarer Gegenwart\"" von Minderjährigen unter 18 Jahren zu kiffen.""},{""text4"":""Von einem größeren Augenmerk auf den Kinder- und Jugendschutz spricht daher der Sprecher des Rosenheimer Polizeipräsidiums. Darunter fällt für Katz insbesondere, verstärkt zu Cannabis aufzuklären und Präventivarbeit zu leisten. Generell müsse die Praxis zeigen, wie sich der Cannabiskonsum mit den Neuregelungen weiter entwickele. Katz lässt allerdings durchblicken, dass mit deutlich weniger Aufwand für die Polizei wohl künftig nicht zu rechnen sei. Nach der Legalisierung sei damit zu rechnen, dass mehr Personen öffentlich kifften, sagt er. Zudem blieben Straftatbestände wie illegaler Besitz oder Handel treiben weiterhin bestehen. \""Das wird uns weiter beschäftigen\"", so Katz. Denn es werde Personen geben, die sich nicht an die Beschränkungen halten.""},{""text4"":""Noch ungeregelt ist, was das neue Cannabisgesetz für Menschen bedeutet, die bekifft mit dem Auto unterwegs sind. Vorerst gilt wie bisher weiterhin, dass Geldbußen oder Punkte in Flensburg drohen, wenn Cannabis allein nachgewiesen wird. Ordnungswidrig handelt demnach, wer unter Wirkung eines berauschenden Mittels ein Kraftfahrzeug führt. In der Rechtsprechung hat sich ein Wert von einem Nanogramm THC je Milliliter Blut etabliert. Das bleibt erst einmal gültig, auch wenn eine Expertenkommission inzwischen eine THC-Obergrenze von 3,5 Nanogramm pro Milliliter Blutserum vorgeschlagen hat. Um Neues vorzuschreiben, müssten erst die Regelungen zum Straßenverkehr gesetzlich geändert werden.""},{""text4"":""Aufgabe der Polizei sei es aber allein zu kontrollieren, ob Ausfallerscheinungen wie Lallen, schwankender Gang oder Ähnliches vorlägen, sagt Präsidiumssprecher Alexander Huber. Für die weitere Strafverfolgung sei die Staatsanwaltschaft zuständig.""},{""text4"":""Zurück am Wolfratshauser Amtsgericht rechnet zumindest Jugendstrafrichterin Kirschstein-Freund auch künftig kaum, durch das neue Cannabisgesetz in ihrem Aufgabengebiet entlastet zu werden. Für das Jahr 2023 zählt sie 206 Verfahren auf, die sie geführt hat - Schöffengerichtsverfahren nicht inklusive. \""Davon waren 35 Betäubungsmittelverfahren\"", so Kirschstein-Freund. Darin sei es aber nicht nur um Cannabis gegangen. Grob geschätzt fiele durch die jetzige Gesetzesneuregelung etwa ein Verfahren pro Monat weg. Das werde nicht zu großen Arbeitsentlastungen führen.""}]","Seit April dieses Jahres greift das Gesetz zur Teillegalisierung von Cannabis - und das beschäftigt Behörden und Justiz im Landkreis gehörig. (Foto: Karl-Josef Hildenbrand/dpa)","Die Polizei im Landkreis muss zusätzliche Abstandsregeln zum Konsum kontrollieren. Und weil eine rückwirkende Amnestie gilt, muss die Jugendstrafrichterin am Amtsgericht viele Verfahren erneut prüfen."
"1717532174-5","https://www.sueddeutsche.de/kolumne/cannabis-nabokov-1.6340376","Weitere Leserbriefe","Warum regelt man die Cannabis-Freigabe nicht einfacher?","Weitere Leserbriefe: Warum regelt man die Cannabis-Freigabe nicht einfacher?","[{""text4"":""\""Der inszenierte Tod\"" vom 17. Januar:""},{""text4"":""Annette Ramelsberger schreibt über den Mord, den eine jesidische junge Frau in Auftrag gegeben hat, um gleichsam anstelle des Opfers ein neues Leben führen zu können: \""Es ist eine Geschichte, die man sich nicht ausdenken kann.\"" O doch. Vladimir Nabokov hat sie sich ausgedacht, der Roman heißt \""Verzweiflung\"" (1934), Rainer Werner Fassbinder hat daraus (auf der Basis des Drehbuchs von Tom Stoppard) die Geschichte 1978 verfilmt: \""Despair - eine Reise ins Licht\"". Die Handlung spielt 1930. Der Schokoladenfabrikant Hermann Hermann (Dirk Bogarde), dessen schizophrene Veranlagung sich zunehmend auswächst, will seiner Existenz entfliehen. Er begegnet auf einer Kirmes dem Arbeitslosen Felix (Klaus Löwitsch), und erkennt in ihm sofort seinen Doppelgänger und damit die Chance, seine gesellschaftlichen und privaten Wurzeln zu kappen. Die Motivlage für beide Geschichten, die reale und die fiktionale, ist verblüffend ähnlich. Außerdem ist der Fassbinder-Film unbedingt zu empfehlen.""},{""text4"":""Dr. Volker Klein, Köln""},{""text4"":""Kommentar \""Huch, Arbeit\"" vom 20. Januar:""},{""text4"":""Immer wieder lese ich gerne die sachlich guten Berichte und Kommentare von Ronen Steinke. Ich kann ihm nur zustimmen: Es würde der Polizei und Justiz weniger Arbeit machen, wäre Cannabis legalisiert. Die Mehrarbeit würde nur entstehen, wenn das vorgesehene Gesetz so kompliziert gemacht würde wie vorgesehen. Warum nicht einfacher: Eigenanbau in kleinen Mengen ist erlaubt, dealen auf der Straße ist verboten. Freie Abgabe geringer Mengen (30 g ist ja recht viel ...) von staatlich kontrolliertem Hanf durch lizenzierte Geschäfte an über 21-Jährige.""},{""text4"":""Das einzige Problem sind Blutkontrollen. Bei Marihuana können nach Tagen des Konsums noch minimale Mengen im Blut nachgewiesen werden, bei Alkohol nicht. Wenn jemand am Abend gekifft hat und am nächsten Tag wieder \""nüchtern\"" ist, gefährdet dieser Mensch den Verkehr wohl genauso wenig wie jemand, der am Abend davor ein oder zwei Gläser Wein getrunken hat - nur der \""Kiff-Nachweis\"" ist immer noch möglich. Das sollte das Gesetz berücksichtigen.""},{""text4"":""Bruno Martin, Südergellersen""},{""text4"":""Leserbriefe sind in keinem Fall Meinungsäußerungen der Redaktion, sie dürfen gekürzt und in allen Ausgaben und Kanälen der Süddeutschen Zeitung , gedruckt wie digital, veröffentlicht werden, stets unter Angabe von Vor- und Nachname und dem Wohnort. Schreiben Sie Ihre Beiträge unter Bezugnahme auf die jeweiligen SZ-Artikel an forum@sz.de . Bitte geben Sie für Rückfragen Ihre Adresse und Telefonnummer an. Postalisch erreichen Sie uns unter Süddeutsche Zeitung, Forum & Leserdialog, Hultschiner Str. 8, 81677 München, per Fax unter 089/2183-8530.""}]","Kiffer sehnen der Hanf-Freigabe entgegen, aber die lässt auf sich warten. (Foto: Hans Pennink/AP)","Die Ampelkoalition will Marihuana legalisieren, doch das Gesetz stockt. Ein SZ-Leser hat Ideen, wie man die Freigabe besser regeln könnte. Ein anderer fühlt sich durch einen spektakulären Kriminalfall an einen Roman von Nabokov erinnert - und empfiehlt dessen Verfilmung."
"1717532179-6","https://www.sueddeutsche.de/politik/cannabis-thc-grenzwert-strassenverkehr-1.6497965","Verkehrspolitik","Neuer Grenzwert für Cannabis am Steuer","Cannabis: THC-Grenzwert im Straßenverkehr soll bei 3,5 Nanogramm liegen","[{""text4"":""Wer am Abend einen Joint geraucht hat, kann sich künftig am nächsten Morgen beruhigt ans Steuer setzen: Der Grenzwert für THC im Blut soll deutlich steigen. Das hat eine von Bundesverkehrsminister Volker Wissing (FDP) eingesetzte Kommission am Donnerstag vorgeschlagen.""},{""text4"":""Ihr zufolge ist eine Konzentration von 3,5 Nanogramm Tetrahydrocannabinol (THC) je Milliliter Blutserum eine sinnvolle Obergrenze im Straßenverkehr. Ab diesem Wert sei \""nach aktuellem Stand der Wissenschaft eine verkehrssicherheitsrelevante Wirkung beim Führen eines Kraftfahrzeuges nicht fernliegend, aber deutlich unterhalb der Schwelle, ab der ein allgemeines Unfallrisiko beginnt\"". Die Kommission spricht hierbei immer noch von einem \""konservativen Ansatz\""; er sei demnach vergleichbar mit einer Blutalkoholkonzentration von 0,2 Promille.""},{""text4"":""Bislang ist die Regelung hierzulande sehr strikt: Autofahren nach dem Konsum von Cannabis ist faktisch verboten. Es gibt zwar keinen offiziellen Grenzwert wie etwa die 0,5-Promille-Grenze bei Alkohol. Fahrer müssen aber ab einem Wert von 1,0 Nanogramm mit einem Bußgeld und dem Entzug des Führerscheins (häufig in Verbindung mit einer Medizinisch-Psychologischen Untersuchung) rechnen - was schlicht dem untersten Wert entspricht, den die Messgeräte erfassen können. Sprich: Sobald THC im Blut nachweisbar ist, hat das Folgen.""},{""text4"":""Das soll sich nun ändern. Dem ADAC zufolge hat die Expertenkommission mit ihrem Vorschlag \""die Grenzen des mit Blick auf die Verkehrssicherheit Vertretbaren\"" ausgereizt. Wichtig sei aber, dass weiterhin der Grundsatz gelte, \""dass Personen, die unter der Wirkung von Cannabis stehen, kein Kraftfahrzeug führen sollten\"". Der TÜV-Verband kritisiert den Vorschlag als \""verfrüht\"" und \""wissenschaftlich nicht begründbar\"", die Entscheidung erscheine \""rein politisch motiviert\"". Der Verband befürchtet \""eine erhebliche Beeinträchtigung der Verkehrssicherheit\"", sollte sich der Vorschlag durchsetzen.""},{""text4"":""Viele Ampel-Politiker begrüßen hingegen den Vorschlag. \""Der Grenzwert von 3,5 Nanogramm pro Milliliter Blutserum schützt die allgemeine Verkehrssicherheit, aber auch die Freiheit der Konsumenten\"", sagt die sucht- und drogenpolitische Sprecherin der FDP-Fraktion Kristine Lütke. Auch die verkehrspolitische Sprecherin der SPD-Bundestagsfraktion Isabel Cademartori begrüßt den Vorschlag der Kommission. Die aktuelle Regelung von 1,0 Nanogramm sei schlicht \""nicht verhältnismäßig\"".""},{""text4"":""Tatsächlich kann THC bei regelmäßigem Konsum noch mehrere Tage nach dem letzten Joint im Blutserum nachgewiesen werden. Bei gelegentlichem Konsum von Cannabis mit Pausen von mehreren Tagen wird der aktuelle Grenzwert laut ADAC aber nur für etwa sechs Stunden überschritten. Mit dem neuen Grenzwert sollen der Expertenkommission zufolge \""nur diejenigen sanktioniert werden, bei denen der Cannabis-Konsum in einem gewissen zeitlichen Bezug zum Führen eines Kraftfahrzeuges erfolgte\"".""},{""text4"":""Auch Bundesverkehrsminister Volker Wissing hatte sich bereits gegen eine 0,0-Grenze für THC im Blutserum ausgesprochen. \""Das wäre ein Konsumverbot über das Verkehrsrecht. Das will ich nicht\"", sagte er. Wissing hatte die Expertenkommission eingesetzt, weil er selbst kein Mediziner sei und eine solche Fragestellung nicht entscheiden könne.""},{""text4"":""Die Kommission, der Experten aus Medizin, Recht, Verkehr und Polizei angehören, empfiehlt über die THC-Grenze hinaus ein absolutes Alkoholverbot am Steuer für alle Cannabis-Konsumenten. Der Mischkonsum stelle demnach im Straßenverkehr ein besonderes Risiko dar. Der ADAC spricht sich darüber hinaus dafür aus, dass bei Fahranfängern weiterhin die Grenze von 1,0 Nanogramm THC gilt.""},{""text4"":""Um den neuen THC-Grenzwert rechtlich zu verankern, ist nun eine Änderung des Straßenverkehrsgesetzes erforderlich. Zum Start der Cannabis-Legalisierung am Ostermontag gilt also vorerst weiterhin die Ein-Nanogramm-Schwelle.""}]","Einen Joint am Steuer zu rauchen ist und bleibt trotz der neuen Regelungen keine gute Idee. (Foto: Fabian Sommer/dpa)","Eine Expertenkommission schlägt eine THC-Obergrenze von 3,5 Nanogramm vor. Was das für den Cannabis-Konsum bedeuten würde."
