web-scraper-order,web-scraper-start-url,text1,text2,text3,text4,text5,text6
"1717532303-36","https://www.sueddeutsche.de/politik/drogen-lauterbach-will-cannabis-legalisierung-retten-dpa.urn-newsml-dpa-com-20090101-240318-99-379838","Drogen","Lauterbach will Cannabis-Legalisierung retten","Drogen - Lauterbach will Cannabis-Legalisierung retten","[{""text4"":""Berlin (dpa) - Bundesgesundheitsminister Karl Lauterbach will ein mögliches Scheitern der Legalisierung von Cannabis zum 1. April abwenden. Er werde die gesamte Woche über dafür kämpfen, dass es eine Anrufung des Vermittlungsausschusses im Bundesrat an diesem Freitag nicht gebe, sagte der SPD-Politiker in Berlin.""},{""text4"":""Er verwies auf Äußerungen unionsgeführter Länder wie Bayern und Sachsen, eine Befassung im Vermittlungsausschuss zu verzögern oder zu sabotieren. Das Gesetz würde dann dort letztlich sterben. „Dann würden wir die einmalige Gelegenheit verlieren, hier die gescheiterte Cannabispolitik zu reformieren. Das wäre aus meiner Sicht ein Triumph für den Schwarzmarkt.“""},{""text4"":""Lauterbach kündigte an, dass auch eine Protokollerklärung der Bundesregierung für die Bundesratssitzung vorbereitet werde. Damit wolle man versuchen zu erreichen, dass „einige der Sorgen der Länder, die jetzt den Vermittlungsausschuss anrufen wollen, genommen werden können“. Vorgesehen waren demnach auch Beratungen mit den Ministerinnen und Ministern für Inneres, Justiz und Gesundheit der Ampel-Parteien.""},{""text4"":""Nach dem vom Bundestag beschlossenen Gesetz sollen Besitz und Anbau der Droge mit zahlreichen Vorgaben für Volljährige zum Eigenkonsum vom 1. April an erlaubt sein. Das Gesetz kommt an diesem Freitag noch abschließend in den Bundesrat. Dort ist es nicht zustimmungsbedürftig, aber die Länderkammer könnte den gemeinsamen Vermittlungsausschuss mit dem Bundestag anrufen und das Verfahren damit abbremsen.""},{""text4"":""Bedenken sind aus den Ländern unter anderem gegen eine geplante Amnestie für Altfälle laut geworden, die nach dem neuen Recht nicht mehr strafbar wären. Befürchtet wird eine Überlastung der Justiz durch dadurch anfallende Fallprüfungen.""},{""text4"":""Lauterbach sagte, es entstehe dadurch eine einmalige Mehrbelastung. Den Behörden sei aber keine Frist gesetzt, so dass man die Fälle in der benötigten Zeit abarbeiten könne, ohne dass Schadenersatzansprüche entstünden. Er wies zudem auf eine Entlastung der Justiz hin, wenn 180.000 Verfahren pro Jahr zu Cannabis-Konsumdelikten künftig entfallen.""},{""text4"":""© dpa-infocom, dpa:240318-99-379838/2""}]","Der Besitz und Anbau von Cannabis sollen vom 1. April an erlaubt sein. (Foto: Matt Masin/Zuma Press/dpa)","Eine Freigabe von Cannabis soll zum 1. April kommen. Doch im Bundesrat braut sich Widerstand zusammen. Der Minister will ein Platzen des ganzen Vorhabens verhindern."
"1717532307-37","https://www.sueddeutsche.de/politik/cannabis-legalisierung-karl-lauterbach-spd-plaene-aus-gruende-1.6333784","Drogenpolitik","Cannabis-Legalisierung droht das Aus","Cannabis-Legalisierung: Pläne von Lauterbach drohen Aus - die Gründe","[{""text4"":""Die Sache schien eigentlich schon geregelt. Anfang Dezember hieß es aus der Koalition, man habe sich nun auch in letzten Detailfragen geeinigt, das Gesetz zur Cannabis-Legalisierung werde nun im Bundestag beschlossen. Von April an könne in Deutschland legal gekifft werden - der Besitz von bis zu 25 Gramm Cannabis soll straffrei, der Eigenanbau von bis zu drei Pflanzen zum Eigenkonsum und die Gründung von Anbauvereinigungen möglich sein. Das Kabinett hatte das schon im August 2023 beschlossen.""},{""text4"":""Aber dann flog die Abstimmung über das Gesetz im Dezember doch wieder von der Tagesordnung. Eine rein kosmetische Entscheidung, hieß es damals: Man wolle die Legalisierung nicht mitten im Haushaltsstreit beschließen, wie sehe das denn aus. Aber nach Weihnachten, da werde alles eingetütet. Ganz bestimmt.""},{""text4"":""In dieser Woche nun tritt der Bundestag erstmals im neuen Jahr wieder zusammen. Und wieder hakt es mit der Verabschiedung des Cannabis-Gesetzes. Dass es jetzt auf die Tagesordnung komme, sei höchst unwahrscheinlich, heißt es in der SPD. Gegen die Pläne von Gesundheitsminister Karl Lauterbach (SPD) gibt es erbitterten Widerstand - aus den eigenen Reihen, vor allem von Innen- und Verkehrspolitikern. Immer mehr Sozialdemokraten sind gegen die Legalisierung. \""Es ist absolut unklar, ob das noch etwas wird\"", heißt es aus der Partei. Im Klartext: Dem Cannabis-Gesetz droht das Aus.""},{""text4"":""Besonders ausgeprägt sind die Bedenken bei den Landesinnenministern, aber auch bei Bundesinnenministerin Nancy Faeser (SPD) - und in der SPD-Bundestagsfraktion wäre eine Mehrheit für den Gesetzesentwurf aktuell sehr unsicher. In Faesers Haus wird betont, man stelle sich nicht quer, aber es gebe halt klassische Sicherheitsargumente dagegen. Der Süddeutschen Zeitung liegt ein entsprechend kritischer interner Bericht vor, der im Auftrag der Innenministerkonferenz vom Bundeskriminalamt (BKA) federführend erstellt worden ist. Und der widerlegt eines der zentralen Argumente für die Legalisierung - eine Entlastung der Polizei. \""In der Gesamtschau kann festgestellt werden, dass auf die Strafverfolgungs- und Ordnungsbehörden der Länder zusätzliche Aufgaben und Aufwendungen in Form von Personal- und Sachkosten zukommen werden\"", heißt es in dem Bericht.""},{""text4"":""So wird in dem Papier auch betont, dass im Zuge der Legalisierung deutlich mehr Arbeit im Bereich der Verkehrskontrollen auf die Polizei zukommen könnte. So steige \""die Wahrscheinlichkeit, dass die Verkehrssicherheit beeinträchtigt wird\"". Fahrten unter Einfluss von Cannabis könnten zunehmen. \""Insofern erscheint es sinnvoll, die Kontrolltätigkeit durch den Polizeivollzugdienst zumindest vorübergehend zu intensivieren, auch um deutlich werden zu lassen, dass Fahren unter dem Einfluss von Cannabis (und anderen Drogen) weiterhin verboten ist.\"" Immerhin werde nun das ursprünglich von der Ampelkoalition genannte Ziel der Entlastung der Strafverfolgungsbehörden im aktuellen Gesetzentwurf nicht mehr explizit als Ziel der Cannabis-Legalisierung genannt.""},{""text4"":""Das BKA habe darauf hingewiesen, dass Polizeikontrollen weiter stattfinden müssen, sei es bezüglich der mitgeführten Besitzmenge von maximal 25 Gramm Cannabis oder der Konsumverbote, etwa an Schulen und Kitas sowie im Umkreis von 200 Metern um diese. All das bringe Kontrollerfordernisse mit sich, soll der Konsum von Cannabis doch auch in unmittelbarer Gegenwart von Personen, die das 18. Lebensjahr noch nicht vollendet haben, verboten bleiben, ebenso in öffentlich zugänglichen Sportstätten, in Fußgängerzonen zwischen 7 und 20 Uhr und im Umfeld von Anbauvereinigungen. Zudem bleibt der Konsum im militärischen Bereich der Bundeswehr verboten.""},{""text4"":""Insgesamt werde immer noch eine jährliche Entlastung der Strafverfolgungsbehörden von geschätzt rund 7,9 Millionen Euro mit der Begründung genannt, dass sich mit der gesetzlichen Erlaubnis zum straffreien Cannabis-Besitz der Aufwand für Polizei- und Ordnungsbehörden sowie die Staatsanwaltschaften reduziere. Die Berechnung basiere auf den bisher jährlich erfassten 180 000 konsumnahen Cannabis-Delikten. Die Belastbarkeit dieser Berechnung müsse aber eindeutig infrage gestellt werden.""},{""text4"":""Aus Sicht von Grünen und Liberalen ist der neue Widerstand in der SPD unverständlich - die kleineren Koalitionspartner sehen in einer Cannabis-Legalisierung einen Prestigeerfolg, den die Ampel dringend brauchen könnte. Auch für Lauterbach ist die Sache peinlich, schließlich stehen mit dem Transparenzgesetz und der Krankenhausreform auch seine anderen beiden wichtigsten Vorhaben auf der Kippe, weil die Länder Widerstand leisten.""},{""text4"":""Noch in dieser Woche finden deshalb zwischen Lauterbach und seinen Fraktionskollegen Krisengespräche statt, um das Projekt zu retten. Im Bundesgesundheitsministerium heißt es dazu nur, man stehe \""immer in intensiven Gesprächen mit den Fraktionen\"". Im Raum steht die Hoffnung, das Gesetz am Mittwochmorgen doch noch kurzfristig auf die Tagesordnung setzen zu können.""},{""text4"":""Die Aussichten darauf stehen allerdings denkbar schlecht - auch weil der Minister selbst von seinem Gesetzesentwurf nur mäßig begeistert ist. Zu Beginn der Legislaturperiode gefiel sich Lauterbach in der Rolle eines vermeintlichen Pioniers einer neuen Drogenpolitik. Weil seine ursprünglichen Ideen aber nicht mit den Vorgaben der EU vereinbar waren, musste er zahlreiche Abstriche machen. Zuletzt warnte Lauterbach immer offensiver vor den Gefahren, die mit Cannabiskonsum einhergingen. Aus seinem Umfeld heißt es nun: Ein Scheitern wäre zwar eine Niederlage - aber eine, mit der Lauterbach persönlich gut leben könnte.""}]","Auch nach einer Legalisierung gäbe es für Anbau und Konsum von Cannabis noch immer viele Einschränkungen. (Foto: FADEL SENNA/AFP)","Die Pläne von Gesundheitsminister Karl Lauterbach, den Konsum von Marihuana zu entkriminalisieren, stoßen in der eigenen Partei auf größeren Widerstand. Hektische Gespräche mit der SPD-Fraktion sollen das Prestigeprojekt retten."
"1717532313-38","https://www.sueddeutsche.de/politik/podcast-nachrichten-cannabis-legailisierung-kiffen-bundesrat-1.6476160","SZ-Podcast ""Auf den Punkt""","Cannabis: Scheitert die Legalisierung doch noch?","SZ-Podcast: Cannabis: Scheitert die Legalisierung doch noch?","[{""text4"":""Es wird ersehnt von allen regelmäßig kiffenden Menschen in Deutschland. Und ersehnt auch von Gesundheitsminister Karl Lauterbach von der SPD: das neue Gesetz zur Legalisierung von Cannabis. Nach langem Ringen wurde es am 23. Februar endlich im Bundestag verabschiedet. Und steht einen Monat später nun wieder auf der Kippe.""},{""text4"":""Das hat damit zu tun, wie in Deutschland Gesetze auf den Weg gebracht werden. Und damit, dass in vielen Bundesländern mindestens eine Ampelpartei zusammen mit der Union regiert. Wie könnte es ausgehen? Das erklärt in dieser Folge Angelika Slavik, Korrespondentin im SZ-Parlamentsbüro in Berlin.""},{""text4"":""Weitere Nachrichten: Deutsche Bahn-Bilanz""},{""text4"":""Zum Weiterlesen und -hören: Emmanuel Macron boxt wie Rocky, zumindest auf Fotos.""},{""text4"":""So können Sie unseren Nachrichtenpodcast abonnieren:""},{""text4"":""\""Auf den Punkt\"" ist der Nachrichtenpodcast der Süddeutschen Zeitung zu den wichtigsten Themen des Tages. Der Podcast erscheint von Montag bis Freitag immer um 17 Uhr. Sie finden alle Folgen auf sz.de/nachrichtenpodcast. Verpassen Sie keine Folge und abonnieren Sie unser Audio-Angebot in Ihrer Lieblings-Podcast-App oder bei iTunes, Spotify, Deezer. Eine Übersicht über all unsere Podcasts finden Sie unter www.sz.de/podcast und hier erfahren Sie, wie Sie unsere Podcasts hören können.""},{""text4"":""Sie haben Fragen oder Anregungen? Dann schreiben Sie uns: podcast@sz.de.""},{""text4"":""Moderation, Redaktion: Franziska von Malsen""},{""text4"":""Redaktion: Nadja Schlüter, Johannes Korsche""},{""text4"":""Produktion: Jakob Arnu""}]","""Auf den Punkt"" - der Nachrichtenpodcast der Süddeutschen Zeitung. (Foto: SZ)","Der Besitz von Cannabis wird legal. Das hat der Bundestag vor einigen Wochen beschlossen. Nun steht das Gesetz wieder auf der Kippe. Wovon hängt ab, ob es doch noch klappt?"
"1717532317-39","https://www.sueddeutsche.de/muenchen/bgh-cannabis-arzt-urteil-rechtskraeftig-haft-1.5794742","München","Dreieinhalb Jahre Haft für Cannabis-Arzt","Münchner Cannabis-Arzt: BGH bestätigt Urteil - 3,5 Jahre Haft","[{""text4"":""Mehrere Hundert Mal hat ein Arzt aus München ohne medizinischen Grund Cannabis verschrieben - nun ist seine Verurteilung zu einer Freiheitsstrafe von dreieinhalb Jahren rechtskräftig. Der Bundesgerichtshof (BGH) habe die Revision des Angeklagten als unbegründet verworfen, soweit sie sich auf den Schuld- und Strafausspruch bezog, teilte das Gericht am Mittwoch in Karlsruhe mit.""},{""text4"":""Das Landgericht München I hatte den Mann im Februar 2022 unter anderem wegen des unerlaubten gewerbsmäßigen Verschreibens von Betäubungsmitteln in 539 Fällen und des Besitzes einer Pistole verurteilt. Auf die Idee war der Arzt dem Urteil zufolge durch eine Gesetzesänderung im März 2017 gekommen. Sie erlaubt das Verschreiben von Cannabis, wenn eine Untersuchung ergibt, dass die Anwendung des Mittels aus ärztlicher Sicht geeignet und erforderlich ist.""},{""text4"":""Nach Überzeugung des Gerichts stellte der Münchner die Rezepte aber ohne vorherige Untersuchung aus und verlangte dafür jeweils zwischen 60 und 150 Euro in bar. Unter dem Deckmantel seiner ärztlichen Zulassung habe er beschlossen, Handel mit Marihuana zu betreiben. Die Praxis des Mannes sei für \""eine Untersuchung und ordnungsgemäße Diagnosestellung\"" aber gar nicht ausgestattet gewesen. Nicht einmal eine Liege habe sich darin befunden, wie der Anwalt des Angeklagten im Prozess einräumte.""},{""text4"":""Stattdessen nutzte der Mediziner verschiedene Münchner Cafés und Restaurants für seine Tätigkeit. Dort reservierte er einen Tisch und ließ nach und nach seine Patienten herantreten, um ihnen gegen Barzahlung die Privatrezepte auszuhändigen. Wenn ein Patient nicht bezahlen konnte, habe er vor dessen Augen das Rezept zerrissen, hielt der Vorsitzende Richter am Landgericht dem Angeklagten in der Verhandlung vor. Auch auf Cannabis-Messen trat der Mann als spezialisierter Arzt auf und ak­qui­rie­rte dort neue Kunden.""},{""text4"":""Der BGH stellte das Verfahren nun in Teilen ein, sodass am Ende nur noch 455 Fälle des unerlaubten Verschreibens übrig blieben, dazu der vorsätzliche Besitz einer halbautomatischen Kurzwaffe und der Besitz von Betäubungsmitteln. Der Ausspruch über die Gesamtstrafe habe aber Bestand, befand das Karlsruher Gericht.""},{""text4"":""Das im Urteil verhängte Berufsverbot dagegen hob der 1. Strafsenat auf. Der Mann habe freiwillig auf seine Approbation verzichtet, hieß es. Zudem wurde die Summe gesenkt, die der 69-Jährige durch die Taten verdient haben soll - statt 47 700 Euro werden nach BGH-Angaben nur 43 110 Euro als Taterträge eingezogen. Die Pistole ließ der Mann widerstandslos einziehen.""}]","Cannabis gab es bei dem verurteilten Münchner Arzt auf Rezept. (Foto: Christian Beutler/dpa)","Weil er ohne medizinischen Grund mehrere Hundert Rezepte für das Betäubungsmittel ausstellte, wurde ein 69-Jähriger verurteilt. Der Bundesgerichtshof hat die Revision des Angeklagten nun verworfen."
"1717532321-40","https://www.sueddeutsche.de/projekte/artikel/muenchen-starnberg/cannabis-legalisierung-gesetz-polizei-justiz-sucht-e229928/","","","Zoff um den Stoff","[]","",""
"1717532325-41","https://www.sueddeutsche.de/meinung/cannabis-legalisierung-karl-lauterbach-kommentar-1.6479121","Cannabis","So wird die Freigabe zum Problem statt zur Lösung","So wird die Cannabis-Legalisierung zum Reinfall","[{""text4"":""In Deutschland kann bald legal Cannabis konsumiert werden - das ist, ganz grundsätzlich, eine gute Entscheidung. Die restriktive Drogenpolitik, die über Jahrzehnte verfolgt wurde, hat keinerlei Erfolge gezeitigt, schon allein deshalb ist es sinnvoll, jetzt einen neuen Weg einzuschlagen. Doch auch wenn die Absicht dahinter richtig ist: So, wie es jetzt beschlossen wurde, kann das Cannabis-Gesetz nicht bleiben.""},{""text4"":""Eine Legalisierung könnte zahlreiche Vorteile haben. Wenn Menschen, die ohnehin kiffen, ihr Cannabis legal kaufen können, schwächt das den Schwarzmarkt. Zudem steigt die Sicherheit für die Konsumenten. Beides ist uneingeschränkt erstrebenswert. Die Regelungen im von April an gültigen Gesetz allerdings sind lebensfremd; so besteht das Risiko, dass die erhofften positiven Effekte nicht eintreten.""},{""text4"":""Der legale Bezug von Cannabis ist vor allem für Gelegenheitskonsumenten viel zu kompliziert: Wer dreimal im Jahr an einem Joint ziehen will, müsste auch dafür in einem Cannabis-Klub Mitglied werden - und dort feste Mitgliedsbeiträge zahlen. Da könnte vielen der Schwarzmarkt dann als attraktivere Option erscheinen. Dazu kommen zahlreiche andere Probleme: Die Amnestieregelung ist für die Länder zu kurzfristig, der angedachte Kontrollaufwand ein Albtraum für die Polizei.""},{""text4"":""Karl Lauterbach hat den Ländern versprochen, beim Cannabis-Gesetz zügig nachzubessern. Diese Chance sollte er umfassend wahrnehmen. Sonst könnte die Legalisierung ein Reinfall werden.""}]","Ein Kraut, über das in Deutschland jetzt lange diskutiert wurde: Hanf, auch Cannabis genannt. (Foto: Markus Schreiber/AP)","Die Legalisierung der Droge hätte viele Vorteile. Das vorliegende Gesetz droht jedoch ein Reinfall zu werden."
"1717532330-42","https://www.sueddeutsche.de/politik/cannabis-legalisierung-anbauvereinigungen-gras-kaufen-1.6513115","Cannabis","""Ich gehe ja auch nicht in einen Joghurtverein, wenn ich Joghurt essen will""","Cannabis ist nun legal – aber wo sollen Kiffer das Gras kaufen?","[{""text4"":""Sie lagen sich in den Armen vor Freude, die etwa 1500 Menschen, die in der Nacht zum Montag am Brandenburger Tor in Berlin zusammenkamen, um an ihrem ersten legalen Joint zu ziehen. Seit dem 1. April ist der Konsum von Cannabis erlaubt. Die rasche Einführung des Cannabisgesetzes führt allerdings dazu, dass sich die Konsumenten das Gras zunächst noch überwiegend auf dem Schwarzmarkt holen werden.""},{""text4"":""Viele Interessenten hätten sich zwar schon mit Samen für den Eigenanbau eingedeckt, sagt Georg Wurth, Geschäftsführer des Deutschen Hanfverbandes. Doch die Anbauvereinigungen, in denen Cannabis an erwachsene Mitglieder weitergegeben werden darf, starten erst im Juli.""},{""text4"":""Wer in diesen sogenannten Cannabisklubs mitmachen will, muss beitreten und einen Mitgliedsbeitrag bezahlen. Dass die Anbauvereinigungen allerdings die Nachfrage nach Cannabis decken, davon geht Georg Wurth nicht aus. Für Gelegenheitskonsumenten seien sie schlicht nicht attraktiv genug. \""Man geht nicht in einen Verein, um sich ein paar Gramm Gras zu holen\"", sagt Wurth. \""Ich gehe ja auch nicht in einen Joghurtverein, wenn ich ab und zu einen Joghurt essen will.\"" In einer Studie der Uni Düsseldorf wird die Nachfrage deutscher Konsumenten auf 400 Tonnen Cannabis im Jahr geschätzt.""},{""text4"":""Auch wegen der Gelegenheitskonsumenten fordert Wurth das, was das Bundesgesundheitsministerium die zweite Säule seines Cannabis-Modells nennt: einen Modellversuch, bei dem erprobt werden soll, was sich viele Kiffer schon lange wünschen, den Verkauf der Droge in Fachgeschäften.""},{""text4"":""Noch liegt dazu erst ein Eckpunktepapier des Bundesgesundheitsministeriums vor. Das sieht einen lizenzierten und staatlich kontrollierten Rahmen vor, in dem Unternehmen Cannabis produzieren und in Geschäften verkaufen dürfen. Erst einmal als Versuch, fünf Jahre lang \""ab eingerichteter Lieferkette\"" und nur in bestimmten Regionen. Der Plan, solche Modellregionen einzurichten und damit die Auswirkungen kommerzieller Lieferketten wissenschaftlich zu untersuchen, geht auch auf die Einsicht in der Bundesregierung zurück, dass die EU-Kommission bei einer flächendeckenden Freigabe von Cannabis wohl rechtliche Bedenken anmelden würde.""},{""text4"":""Zumindest diese abgestufte Version solle aber kommen, fordert Kirsten Kappert-Gonther, Bundestagsabgeordnete der Grünen. \""Dieser Schritt ist wichtig, um für Gelegenheitskonsumierende das Gesundheitsrisiko zu minimieren und Alternativen zum Schwarzmarkt zu schaffen\"", sagt sie der Süddeutschen Zeitung. Viele Regionen hätten bereits Interesse signalisiert. \""Dafür sollten nun zeitnah die rechtlichen Rahmenbedingungen festgelegt werden.\"" Bislang gibt es aber nicht einmal einen Gesetzentwurf. Aus Lauterbachs Ministerium heißt es in Bezug auf die zweite Säule nur: \""Zurzeit laufen zusammen mit den beteiligten Ressorts Vorbereitungsarbeiten zum Beispiel zu den Modellregionen oder zu den künftigen Kontrollstrukturen.\"" Weitere Details könne man nicht nennen.""},{""text4"":""In der Schweiz und in den Niederlanden laufen hingegen schon Versuche zur Regulierung des Drogenanbaus und -verkaufs. In Zürich kann Cannabis in speziellen Bezugsstellen im Rahmen von Social Clubs gekauft und konsumiert werden. Das Personal ist geschult, die Ware stammt aus kontrolliertem biologischen Anbau, für den die Produzenten eine Ausnahmebewilligung erhalten haben. Das Experiment wird wissenschaftlich eng begleitet, andere Städte wollen folgen.""},{""text4"":""In den Niederlanden ist Cannabis eine illegale Droge. Konsum und Verkauf werden bis zu einem gewissen Grad toleriert. Doch das Gras, das man in den Coffeeshops kaufen kann, stammt aus illegalen Quellen. Die Politik will das ändern, ist aber uneins über Weg und Ziel. Seit Dezember läuft jetzt ein Versuch, der langfristig zehn Städte umfassen soll. Vorreiter sind Breda und Tilburg. Die dortigen Coffeeshops werden derzeit ausschließlich von drei staatlich kontrollierten Cannabiszüchtern beliefert. Die zu klärenden Detailfragen waren derart kompliziert - welche Qualität muss zu welchem Preis produziert werden, wie müssen Anbauer und Händler zertifiziert werden, wo sind mögliche Einfallspunkte für Kriminelle und vieles mehr -, dass das Experiment um mehrere Jahre später als geplant begonnen hat. Gegen Ende des Jahrzehnts soll es evaluiert werden.""}]","Gefeiert wird schon, aber wo das Gras künftig kaufen? (Foto: Christian Mang/REUTERS)","Cannabis ist nun legal - aber wo sollen Kiffer es kaufen? Ob der Vertrieb in Fachgeschäften wenigstens erprobt wird, ist offen. Andere Länder sind da weiter."
