web-scraper-order,web-scraper-start-url,text1,text2,text3,text4
"1717598389-1","https://www.tichyseinblick.de/meinungen/wie-das-selbstbestimmungsgesetz-die-realitaet-neu-definieren-will/","Befindlichkeit statt Wirklichkeit","Wie das Selbstbestimmungsgesetz die Realität neu definieren will","Mit dem Selbstbestimmungsgesetz wird nicht lediglich bürokratisches Prozedere verändert. Die Realität selbst wird frei modellierbar. Als Gesetz, das auf Wirklichkeit nicht reagiert, sondern sie definiert, wäre es Ausgangspunkt einer Entwicklung, die wir nicht abschätzen können: Wie weit kann Recht fragmentiert werden?","Über Dinge, auf die wir keinen Einfluss haben, können wir nicht bestimmen. Eine Binsenweisheit, die auch für Selbstbestimmung gilt: Wohnort, Studienfach oder Ehepartner wählen wir weitgehend selbst; kein Mensch kann hingegen „bestimmen“, mit welchen Chromosomen und genetischen Anlagen er geboren wird. Für das Gesetz „über die Selbstbestimmung in Bezug auf den Geschlechtseintrag“, kurz SBGG, spielt dies indes keine Rolle: In Zukunft kann jeder, der eine Diskrepanz zwischen biologischem Geschlecht und eigener Wahrnehmung empfindet, durch Antrag beim Standesamt Namen und Geschlechtseintrag ändern, verbunden mit dem Anspruch, sich Urkunden neu ausstellen zu lassen.








Selbstbestimmungsgesetz


Lisa Paus und ihr Kampf gegen die Realität




Anders als in einem früheren Entwurf soll diese Änderung nach einer Frist von drei Monaten wirksam werden, sodann gilt eine Sperrfrist von einem Jahr. Diese soll leichtfertigen und auf kurzfristige Vorteile bedachten Anträgen vorbeugen. Statt, wie ursprünglich vorgesehen, alle zwölf, kann ein Bürger also alle fünfzehn Monate „entscheiden“, welchem Geschlecht er sich zugehörig fühlt. Gänzlich entfällt die Verpflichtung, psychologische oder sonstige Gutachten beizubringen; eine Überprüfung der Glaubwürdigkeit des Anliegens unterbleibt. Lediglich eine Erklärung ist abzugeben, in der der Antragsteller versichert, sich der Bedeutung des Schrittes bewusst zu sein.
Damit ist das Selbstbestimmungsgesetz von grundsätzlich anderer Qualität als das Transsexuellengesetz, das die Änderung des Geschlechtseintrags bisher regelte, in Teilen aber vom Bundesverfassungsgericht als verfassungswidrig eingestuft worden war. Dieses Gesetz sollte ausdrücklich „in besonderen Fällen“ greifen. Da Recht gewöhnlich objektiven Parametern verpflichtet ist, wurde der Ausnahmecharakter des TSG als Konzession an das subjektive Empfinden von Menschen mit tiefsitzender Geschlechtsidentitätsstörung klar gekennzeichnet.
Das neue Gesetz versteht sich hingegen nicht mehr als pragmatische Reaktion auf eine Ausnahmesituation, sondern als Maßnahme, um der Selbstbestimmung eines jeden gerecht zu werden. Die Ausnahme wird zur Normalität erklärt. Folgerichtig umfasst das Gesetz auch Kinder und Jugendliche. Anstatt diese zu schützen, werden sie in doppelter Weise ausgeliefert: Zwar können Jugendliche ab 14 Jahren nur mit Zustimmung der Eltern ihren Geschlechtseintrag ändern. Im Zweifel sollen jedoch Familiengerichte das Votum der Eltern aufheben können. Eine gefährliche Einschränkung elterlicher Autorität, haben Eltern doch oft kaum Zugriff auf das, was medial auf ihre Kinder einprasselt. Ein durch Peer Pressure oder Influencer beeinflusster Jugendlicher kann sich per Gerichtsentscheid dem schützenden Nein der Eltern entziehen.








Selbstbestimmungsgesetz


Die Ampel mauert, schweigt und unterdrückt kritische Stimmen




Für jüngere Kinder dagegen sieht das Gesetz vor, dass die Eltern über eine Änderung des Geschlechtseintrags befinden. Eine fatale Weichenstellung, die das Kindeswohl nachhaltig gefährdet. Durch den Transgenderhype und die damit einhergehende Stereotypisierung des Geschlechts könnten Eltern versucht sein, bereits den Griff des Kleinkinds zur Puppe statt zum Bagger als Signal zu werten. Bereits 2016 regte das Bundesfamilienministerium im Flyer „Ihr transgeschlechtliches Kind“ sogar ausdrücklich dazu an, als geschlechtsuntypisch empfundenes Verhalten entsprechend zu hinterfragen. In den USA macht der Fall von Jazz Jennings Schlagzeilen: Auf Betreiben der Mutter begann seine „Transition“, als er fünf Jahre alt war. Die spätere medikamentöse und schließlich operative Geschlechtsumwandlung wurde als Reality Show produziert und von der Familie medial ausgeschlachtet.
Sicher ein Extremfall. Dennoch: Eltern wird suggeriert, für die geschlechtliche Identität ihres Kleinkindes verantwortlich zu sein; Jugendlichen wird die Verantwortung dafür ausgerechnet während der von Unsicherheit geprägten Pubertät zugeschoben. So treibt das Gesetz einen Keil in die Familie, die sich gezwungen sehen kann, innerfamiliäre Konflikte vor Gericht austragen zu müssen. Dem Gesetzgeber scheint das Problem bewusst zu sein, beabsichtigt er doch, „in diesem Zusammenhang, die Beratungsangebote insbesondere für minderjährige Personen auszubauen und zu stärken.“, wie es im Referentenentwurf heißt. Welche Interessenverbände werden wohl für solche Beratung herangezogen werden?
Angesichts dessen erscheint der „Aufreger“, der dem Selbstbestimmungsgesetz im Frühjahr 2023 einige Aufmerksamkeit verschaffte, geradezu als Lappalie. Denn damals drehte sich alles lediglich um die Frauensauna: Es hatte die Befürchtung die Runde gemacht, dass biologische Männer durch das SBGG Zugang zu Frauen vorbehaltenen Räumen erwirken könnten. Obwohl auch der aktuelle Entwurf betont, dass das Hausrecht unberührt bleibe, ist die rechtliche Unsicherheit nicht ausgeräumt. Durchaus könnte die Anwendung des Hausrechtes einen Verstoß gegen das sogenannte Offenbarungsverbot konstituieren: Das Verbot, das biologische Geschlecht öffentlich zu machen. Zwar bezieht sich der Wortlaut des Gesetzes auf absichtliche Schädigung des Betroffenen durch die Offenlegung der früheren Identität; wann eine solche vorliegt, wird im konkreten Fall wohl Ansichtssache bzw. Sache der Gerichte sein. Gleichfalls vage bleibt der Hinweis, dass der Sport sich weiterhin eigenständig organisieren könne. Wie will man sich dort gegen etwaige Forderungen absichern?








„Selbstbestimmungsgesetz”


Schlachtfeld Frauensauna




Mit dem SBGG wird also nicht lediglich bürokratisches Prozedere verändert. Die Realität selbst wird frei modellierbar. Als Gesetz, das auf Wirklichkeit nicht reagiert, sondern sie definiert, wäre es Ausgangspunkt einer Entwicklung, die wir nicht abschätzen können: Wie weit kann Recht fragmentiert werden? Wir wissen es (noch) nicht: Warum sollte das Privileg, dass sich das Recht der eigenen Empfindung zu beugen habe, nur Menschen zustehen, die sich einem anderen als ihrem biologischen Geschlecht zugehörig fühlen?
Zu guter Letzt darf die Gefahr von Trittbrettfahrern nicht unterschätzt werden. Das ist keine Panikmache: In den USA und Großbritannien haben sich bereits mehrfach Sexualstraftäter mit Hinweis auf angebliche Transgeschlechtlichkeit in Frauengefängnisse verlegen lassen, um dort zum Teil wieder übergriffig zu werden. Regelmäßig hören wir von Sportlern, die Frauen den Rang ablaufen, nachdem sie im Männersport lediglich mittelmäßige Erfolge erzielten. Und nicht nur in Mexico gelangten Politiker nach ihrem Outing über die Frauenquote auf einen Listenplatz – dort schritten die Gerichte allerdings ein, um derart opportunes Verhalten zu unterbinden.
Praktisch privilegiert der vorliegende Gesetzentwurf also insbesondere Männer, die sich dem weiblichen Geschlecht zuordnen wollen – auf Kosten von Frauen, und von Kindern beiderlei Geschlechts. Angesichts dessen ist es legitim, zu fragen, ob man der Akzeptanz transgeschlechtlicher Menschen hier nicht einen Bärendienst erweist. Es steht zu befürchten, dass das Selbstbestimmungsgesetz den Graben zwischen Politik und Eliten einer- und der Gesamtbevölkerung andererseits vertieft, und Vorurteile und Misstrauen eher befördert denn ausräumt.

Anzeige"
"1717598392-2","https://www.tichyseinblick.de/meinungen/das-selbstbestimmungsgesetz-ist-kein-sieg-fuer-die-freiheit/","Gegenstimmen werden ignoriert","Das Selbstbestimmungsgesetz ist kein Sieg für die Freiheit","Ein Blick nach Großbritannien zeigt, wie zensorisch und schädlich die Transgender-Ideologie sein kann. Von Sabine Beppler-Spahl","„Alle Menschen haben ein Recht darauf, dass der Staat ihre geschlechtliche Identität achtet“, sagte Bundesjustizminister Marco Buschmann nach den Beratungen zum neuen Selbstbestimmungsgesetz. Das klingt fortschrittlich und tatsächlich hat der Ruf nach mehr Freiheit die Debatte über Geschlecht und Gender von Anfang an begleitet. Aber es gibt auch Gegenstimmen, die mit Argumenten und konkreten Beispielen zu einem ganz anderen Schluss kommen
Dazu lohnt sich zunächst ein Blick nach Großbritannien, wo die Debatte schon länger geführt wird. In London wurde im Frühjahr die Schließung der bekannten Tavistock-Klinik beschlossen. Vorgeworfen wird ihr ein zum Teil fahrlässiger Umgang mit Kindern und Jugendlichen, denen – manchmal schon im Alter von 10 oder 12 Jahren – Pubertätsblocker verschrieben wurden. Ein sehr gut recherchiertes Buch der BBC-Journalistin Hannah Barnes beschreibt die Missstände in der Klinik. Gegründet wurde sie, um jungen Patienten mit Genderdysphorie zu helfen. Doch immer stärker wurde in der Institution unkritisch eine Transgenderideologie gepflegt. Seit 2011, so Barnes, sei die Verschreibung von Pubertätsblockern, mit zum Teil irreversiblen Nebenwirkungen, faktisch ein Selbstzweck der Klinik geworden. Einige frühere Klinik-Mitarbeiter haben die Praxis sogar mit dem DDR-Doping verglichen.
Das in Deutschland diskutierte Selbstbestimmungsgesetz, das gerade vom Kabinett beschlossen wurde, fordert keine operativen Geschlechtsumwandlungen. Es räumt Menschen die Möglichkeit ein, ihr Geschlecht nicht nur selbst zu bestimmen, sondern es auch staatlich – also offiziell – anerkennen zu lassen. Aber, es basiert auf der gleichen Ideologie, die in der Tavistock-Klinik gepflegt wurde. Diese besagt, dass Menschen im „falschen Körper“ stecken können und dass das Geschlecht nicht bei Geburt festgelegt ist, sondern wandelbar oder fluide ist. Ein Mensch mit Penis und Hoden kann dann von sich behaupten, eine Frau zu sein und auf sein Recht pochen, dass alle anderen ihn auch so sehen. Sollte der Gesetzesentwurf den Bundestag passieren, könnten sich Menschen jedes Jahr eine neue Geschlechtsidentität zulegen. Da sehr viele Menschen, wahrscheinlich die große Mehrheit der Bevölkerung, diese Ideologie nicht teilt, muss sie von oben herab, mit Zwang durchgesetzt werden. So soll künftig, wenn das Gesetz durchkommt, jeder mit einem Bußgeld rechnen müssen, der eine Transperson wiederholt nicht mit ihrem neuen Namen anspricht.

„Manche im Bundestag haben bereits kritisiert, dass der Gesetzesentwurf Minderjährige zu wenig schützt, und damit haben sie recht.“

Auch dafür, wie zensorisch die Transgenderideologie ist, lässt sich in Großbritannien beobachten. Dort hat eine staatliche Klinik die Worte „Frau“ und „Frauen“ aus einer Informationsbroschüre über die Wechseljahre gestrichen und durch „menstruierende Menschen“ ersetzt – aus Angst, die Translobby zu verletzen. Manche Kritiker der Transgenderideologie wurden sogar aus ihren Jobs vertrieben. (Eines der prominentesten Opfer dieser zensorischen Politik ist die Feministin und Universitätsprofessorin Kathleen Stock, dazu zählen aber auch die Tänzerin und Choreografin Rosie Kay und viele andere). Die Lobbyisten, die so gerne von ihrer eigenen Freiheit sprechen, sind zu einer Bedrohung für die freie Meinungsäußerung anderer geworden.
Manche im Bundestag haben bereits kritisiert, dass der Gesetzesentwurf Minderjährige zu wenig schützt, und damit haben sie recht. Der Entwurf will Jugendlichen ab einem Alter von 14 Jahren erlauben, eine Änderungserklärung für ihren Geschlechtereintrag abzugeben. Als Liberale sehen wir Erwachsene als mündige Bürger an, die über ihren Körper und ihr Leben selbst bestimmen können und sollen (ein Verbot geschlechtsangleichender Operation wäre daher illiberal und falsch). Für Kinder und Jugendliche aber gilt etwas anderes, denn ihnen fehlt die Reife und die Erfahrung. Deswegen ist es ihnen nicht erlaubt, Bordelle aufzusuchen, als Schöffe einer Gerichtsverhandlung beizuwohnen, Pornofilme auszuleihen, Schnaps zu erwerben und vieles andere (selbst das Verbot für Zigarettenwerbung wird mit dem Argument begründet, sie könne Kinder oder Jugendliche verführen). Geht es aber um Transgender, gilt dieses wichtige Prinzip der Unterscheidung zwischen Kindern und Erwachsenen nicht mehr viel.

„Nur in unfreien Staaten wird Eltern mit dem Verlust ihres Entscheidungsrechts gedroht, wenn sie nicht der richtigen Ideologie huldigen.“

Das Recht eines Minderjährigen, eine Änderungserklärung durchzusetzen wertet ein möglicherweise nur kurzfristiges Gefühl auf. Diese Gefahr aber ficht die Befürworter des Gesetzes offenbar ebenso wenig an, wie die nun so heftig kritisierten Mitarbeiter der britischen Klinik. Zahlreiche junge Erwachsene haben zwischenzeitlich die Tavistock-Klinik verklagt, weil ihnen als Minderjährige zu voreilig, wie sie heute finden, suggeriert wurde, sie steckten im falschen Körper. – und bei ihnen eine entsprechende medizinische Behandlung eingeleitet wurde. Einige der Jugendlichen, die Probleme mit ihrer sexuellen Identität hatten, dürften ganz einfach schwul oder lesbisch gewesen sein. Doch so eifrig und fest glaubten die Mitarbeiter an ihre Ideologie, dass Vorsicht und Zurückhaltung – und auch die Möglichkeit des Irrtums – weitgehend ausgeschlossen wurden.
Auch in Deutschland nimmt die Zahl der Jugendlichen, die sich einer Geschlechtsumwandlung unterziehen, rapide zu. Laut einem Artikel in der F.A.Z. lag die Zahl bei 15- bis 25-Jährigen im Jahr 2007 noch bei 54, doch 2021 war sie bereits auf 917 angestiegen. Zwar müssen die Minderjährigen, die eine Änderungserklärung abgeben, laut dem neuen Gesetzesentwurf die Zustimmung der Sorgeberechtigten einholen. Vorgesehen ist jedoch, dass deren Zustimmung durch ein Familiengericht ersetzt werden kann, wenn es zu Konflikten kommt. Eltern, die sich Sorgen um ihre Kinder machen, müssen dies als Bedrohung empfinden. Auch wenn die meisten Familiengerichte gute Arbeit leisten, widerspricht diese Vorgabe den Grundsätzen eines freiheitlichen Staats, der das Elternrecht respektiert. Nur in unfreien Staaten wird Eltern mit dem Verlust ihres Entscheidungsrechts (und faktisch mit ihrem Erziehungsrecht) gedroht, wenn sie nicht der richtigen Ideologie huldigen.
Wenn unsere Abgeordneten demnächst über den Gesetzentwurf abstimmen, werden sie hoffentlich all diese Aspekte berücksichtigen.

Dieser Beitrag ist zuerst bei Novo erschienen.
Mehr von Sabine Beppler-Spahl lesen Sie in dem Buch „Raus aus der Mitte! Wie der Parteienkonsens die Demokratie untergräbt“. Beppler-Spahl ist Autorin von “Experimente statt Experten – Plädoyer für eine Wiederbelebung der Demokratie“.

Anzeige"
"1717598397-3","https://www.tichyseinblick.de/meinungen/selbstbestimmungsgesetz-rueckschlag/","Klärungsbedarf bei FDP","Selbstbestimmungsgesetz liegt auf Eis","Das Selbstbestimmungsgesetz, eines der zentralen gesellschaftspolitischen Projekte der Ampelkoalition, erleidet offenbar einen weiteren Rückschlag. Ausgerechnet die FDP, die das Gesetz maßgeblich mit ihrem Justizminister Marco Buschmann vorantreiben wollte, bremst das Vorhaben nun.","Die Ampel ist ein Club von Dilettanten. Nichts bringt sie zustande: Die deutsche Wirtschaft stürzt ab oder wandert aus. Die Energieversorgung wackelt, die Preise dafür steigen. Die Staatsverschuldung erklimmt immer neue Höhen. Die innere Sicherheit liegt in weiten Bereichen darnieder, die Kriminalitätszahlen nehmen zu. In Großstädten herrscht tagelang der Mob. Jüdische Mitbürger sitzen auf gepackten Koffern oder müssen ihre Identität wieder verstecken. Die Infrastruktur (Straßen, Brücken, Bahn) harrt der Sanierung. Polizei und Bundeswehr haben Personallücken zu Tausenden.
Hunderte von Krankenhäusern stehen vor dem Aus. Es mangelt selbst an Standardmedikamenten. Hunderttausende Wohnungen müssten gebaut werden, werden aber nicht gebaut. Der Wirtschaft fehlen die Fachkräfte, weil es in (!) Deutschland 2,5 Millionen junge Menschen (davon 1,5 Millionen Zuwanderer) zwischen 20 und 34 Jahren ohne Berufsabschluss und 2,9 Millionen Studenten gibt. Die „Bildungsnation“ ist nur noch eine vormalige. Außenpolitisch spielt Deutschland trotz üppigster Reisetätigkeit der Kabinettsmitglieder in der dritten Liga. Aber das Land bleibt Sehnsuchtsland aller Mühseligen und Beladenen dieser Welt; täglich (!) kommen eintausend neue Flüchtlinge hinzu, aber ab 2024 sollen 600 dieser Leute pro Jahr (!) mehr abgeschoben werden. Für die Versorgung von „Migranten“ werden tagtäglich (!) 132 Millionen Euro (im Jahr 2023: 48,2 Milliarden) ausgegeben. Während deutsche Rentner verschämt zu den „Tafeln“ gehen müssen.
Und noch ein „Gipfel“ und noch ein „Gipfel“: Migrations-, Digital-, Energie-, Ernährungs-, Bau-„Gipfel“, ein Bürgerrat für Ernährung und so weiter und so fort. Ampel – das ist seit zwei Jahren ein Berg, der ständig kreißt, aber nicht einmal Mäuschen gebiert.
Brechen wir die Aufzählung ab und fragen, ob die Ampel denn wenigstens ihre hochideologischen Lieblingsprojekte zu der von ihr monomanisch verfolgten gesellschaftlichen „Transformation“ hinbekommt, nämlich so, wie sie im Koalitionsvertrag vom Dezember 2021 festgehalten wurden. Nein, nicht einmal das funktioniert in diesem Dilettantenclub. Erstes Beispiel: das Gesetz zur Freigabe von Cannabis. Ursprünglich sollte es bereits für 2023 gelten, nun ist nicht einmal sicher, dass der SPD/FDP/Grünen-Lauterbach/Buschmann/Özdemir-Plan überhaupt schon 2024 Gesetz wird.




„Ampel“-Prestigeobjekt 
Cannabis-Legalisierung: Das Kabinett der Kiffer





„Selbstbestimmungsgesetz“ blockiert
Widmen wir uns zweitens dem anderen Ideologieprojekt der Ampel: dem „Gesetz über die Selbstbestimmung in Bezug auf den Geschlechtseintrag (SBGG)“. Auch hier geht es drunter und drüber. Jetzt bremst ausgerechnet die FDP, die das Gesetz maßgeblich mit ihrem Justizminister Marco Buschmann vorantreiben wollte. Wie aus Koalitionskreisen zu erfahren ist, wird die öffentliche Anhörung im Familienausschuss dazu nicht wie geplant am 13. November 2023 stattfinden. Dabei sollte das SBGG noch in dieser Woche in die erste Lesung in den Bundestag gehen. Daraus wird aber nichts. Denn die FDP, so heißt es, habe intern noch Klärungsbedarf.
Da hat FDP-Justiz-Mann Buschmann wohl doch zu viel mit der „grünen“ Familien- und Jugendministerin Lisa Paus und ihrem Staatssekretär Sven Lehmann („Queer“-Beauftragter der Bundesregierung) geklüngelt statt mit den eigenen Leuten. Eine partei- und fraktionsinterne Klatsche also für Buschmann. Noch am 8. November jedenfalls sollte die Verschiebung der Anhörung der Experten den beteiligten Verbänden mitgeteilt werden. Das Vorhaben, das SBGG im Jahr 2023 durch alle Lesungen im Bundestag bis zum Beschluss zu bringen, sei laut Koalitionskreisen aber nach wie vor das Ziel. Geplant ist dann ein Inkrafttreten des Gesetzes zum 1. November 2024. Wenn das keine Dynamik ist!
Aber es ist gut so, wenn der Gesetzentwurf auf Eis liegt. Vielleicht gibt es doch noch ein Einsehen, dass dieser Entwurf Schrott ist.
Worum geht es?
Das SBGG soll das seit 1980 existierende Transsexuellengesetz (TSG) ersetzen. Trans- und intergeschlechtlichen Menschen soll die Änderung von Namen und Geschlechtseintrag erleichtert werden. Statt wie bisher zwei psychiatrischer Gutachten sowie einem Gerichtsbeschluss soll mit dem SBGG nur noch eine einfache Erklärung beim Standesamt notwendig sein.
73 Seiten umfasst der SBGG-Entwurf laut Kabinettsbeschluss vom 23. August 2023. Es sind dies zwar nur insgesamt 15 Paragraphen. Letztere machen im Entwurf nur sechseinhalb Seiten aus. Hinzukommt die Darstellung der Auswirkungen auf andere Gesetze, als da sind: Passgesetz, Bundesmeldegesetz, Personenstandsgesetz, Personenstandsverordnung, Rechtspflegegesetz, Bundeszentralregistergesetz, Gesetz über das Verfahren in Familiensachen und in den Angelegenheiten der freiwilligen Gerichtsbarkeit, Gerichts- und Notarkostengesetz, Justizvergütungs- und -entschädigungsgesetz, Einführungsgesetz zum Bürgerlichen Gesetzbuch. Hinzukommen ferner weitschweifige Erklärungen.
Für Minderjährige bis 14 Jahre sollen nur die Sorgeberechtigten die Änderungserklärung gegenüber dem Standesamt abgeben können. Minderjährige ab 14 Jahren sollen die notwendige Erklärung selbst abgeben dürfen; die Erklärung bedarf der Zustimmung der Sorgerechtsberechtigten. Stimmen die Sorgerechtsberechtigten nicht zu, kann diese Zustimmung vom Familiengericht ersetzt werden; dies allerdings nur dann, wenn die Änderung des Geschlechtseintrags und der Vornamen dem Kindeswohl nicht widerspricht.
Nach einer erfolgten Änderung des Geschlechtseintrags und der Vornamen soll für eine erneute Änderung eine Sperrfrist von einem Jahr gelten. Auf Grundlage des Gesetzes kann ein Bußgeld verhängt werden, wenn jemand die Änderung des Geschlechtseintrags von transgeschlechtlichen, nichtbinären oder intergeschlechtlichen Personen gegen deren Willen offenbart und dadurch die betroffene Person absichtlich schädigt („dead naming“; sogenanntes Offenbarungsverbot). Eine Bußgelddrohung von 10.000 Euro sei angesichts der Tatbestandsvoraussetzung der absichtlichen Schädigung der betroffenen Person angemessen (Zusammenfassung hier).
Das „Saunaproblem“, das heißt: die Frage, ob Transfrauen, also vormalige oder biologisch immer noch Männer, in die Frauensauna gehen dürfen, wird auf die Ebene vor Ort verlagert. Der Saunabetreiber soll das entscheiden dürfen. Wie es im Wettkampfsport mit Transfrauen weitergehen soll, ist auch offen. Selbst die Bedenken des Bundeskriminalamtes (BKA), dass straffällige Personen mit dem SBGG einfach ihren Namen ändern könnten, um einer Strafverfolgung zu entgehen, wurden vom Tisch gewischt. Denn voraussichtlich sollen zuständige Standesämter die Daten bei den Anträgen an die Meldebehörden, also auch die Strafverfolgungsbehörden, weitergeben. Diese schauen dann, ob gegen die Person bereits ein Verfahren oder eine Fahndung läuft. Ist das nicht der Fall, sollen die Daten direkt wieder gelöscht und nicht gespeichert werden. Falls es doch der Fall ist, wissen die Sicherheitsbehörden, dass die Person einen neuen Namen angenommen hat, und können das registrieren. Wir sind schon mal gespannt, wie die Datenschutzbeauftragten das sehen.




Ideologie- und Lobby-Projekt nimmt seinen Weg
Nun denkt wenigstens der Bundesrat an die Kinder





 
Anzeige"
