web-scraper-order,web-scraper-start-url,text1,text2,text3,text4
"1717598402-4","https://www.tichyseinblick.de/meinungen/ampel-selbstbestimmungsgesetz-anhoerung-farce-cdu-csu-korte/","Seltsames Gehabe der CDU/CSU-Fraktion","Anhörung als Farce: Wie die Ampel das Selbstbestimmungsgesetz durchpeitscht","Ende November veranstaltete die Ampel eine Anhörung zum neuen Selbstbestimmungsgesetz, die zwar kontrovers verlief, die man aber getrost als Farce bezeichnen kann. Die CDU/CSU-Fraktion war kompetent vertreten. Doch der ursprünglich vorgesehene Fachmann Alexander Korte verschwand plötzlich von der Einladungsliste.","Darum geht es: Das „Selbstbestimmungsgesetz“ (SBGG) soll das seit 1980 geltende Transsexuellengesetz (TSG) ersetzen. Trans- und intergeschlechtlichen Menschen soll die Änderung von Namen und Geschlechtseintrag erleichtert werden. Statt wie bisher zwei psychiatrischer Gutachten sowie einem Gerichtsbeschluss soll mit dem SBGG nur noch eine einfache Erklärung beim Standesamt notwendig sein. 73 Seiten umfasst der SBGG-Entwurf. Für Minderjährige bis 14 Jahre sollen nur die Sorgeberechtigten die Änderungserklärung gegenüber dem Standesamt abgeben können. Minderjährige ab 14 Jahren sollen die notwendige Erklärung selbst abgeben dürfen; die Erklärung bedarf der Zustimmung der Sorgerechtsberechtigten. Stimmen diese nicht zu, kann diese Zustimmung vom Familiengericht ersetzt werden; dies allerdings nur dann, wenn die Änderung des Geschlechtseintrags und der Vornamen dem Kindeswohl nicht widerspricht.
Nach einer erfolgten Änderung des Geschlechtseintrags und der Vornamen soll für eine erneute Änderung eine Sperrfrist von einem Jahr gelten. Was nichts anderes heißt als dies: Man kann sein „Geschlecht“ jährlich wechseln. Auf Grundlage des Gesetzes kann ein Bußgeld verhängt werden, wenn jemand die Änderung des Geschlechtseintrags von transgeschlechtlichen, nichtbinären oder intergeschlechtlichen Personen gegen deren Willen offenbart („dead naming“; sogenanntes Offenbarungsverbot). Ein Bußgeld von bis zu 10.000 Euro sei dann angemessen.
Eine Anhörung als Farce
Nun will die Ampel Dampf machen. Am 28. November veranstaltete sie dazu eine Anhörung, die zwar kontrovers verlief, die man aber getrost als Farce bezeichnen kann. 11 Experten waren zugegen: nominiert von AfD (1), Linke (1), Grüne (2), CDU/CSU (3), SPD (3), FDP (1). Oder anders gerechnet: 6 Professoren aus den Bereichen Psychiatrie, Psychologie, Jura saßen zusammen mit einem von der CDU/CSU nominierten Publizisten (transkritischer Transmann) und 4 NGO-Vertretern (Institut für Menschenrechte, Bundesverband Trans*, Transgender Europe, Frauenrat). Viermal darf man raten, welche Fraktion wen eingeladen hatte.
Und noch anders gerechnet: Zu den 11 Expertisen der anwesenden Experten kamen hinzu: weitere 11 angeforderte Stellungnahmen und 43 unangeforderte Stellungnahmen. Von 8.30 bis 10.00 Uhr (gigantische 90 Minuten) nahm man sich dafür Zeit. Denn um 10.00 Uhr ging es in den Plenarsaal zu einer Regierungserklärung des Kanzlers. Pro anwesenden Experten gab es 4 Minuten Redezeit. Siehe hier das Wortprotokoll und hier eine (tendenziöse) amtliche Zusammenfassung.
Das Herumeiern der CDU/CSU-Fraktion – Kotau vor „Springer“?
Die CDU/CSU-Fraktion war mit einem Professor für Psychologie, einer Professorin für Rechtswissenschaften und einem Betroffenen sehr kompetent vertreten. Aber es war ursprünglich anders geplant. Die CDU/CSU hatte als Experten zunächst Dr. Alexander Korte (*1969) nominiert. Korte ist Facharzt für Kinder- und Jugendpsychiatrie und Psychotherapie am LMU-Klinikum München sowie Vorstandsmitglied der Deutschen Gesellschaft für Sexualmedizin, Sexualtherapie und Sexualwissenschaft. Seit 2004 behandelt er Jugendliche mit Geschlechtsdysphorie.
Korte ist allerdings nicht nur ein erfahrener Fachmann, sondern auch ein mutiger Mann, der zusammen mit vier anderen Fachleuten Anfang Juni 2022 vor einem quasi öffentlich-rechtlichen, indoktrinierenden „Gender-Hype“ gewarnt hatte. Er hatte dies in einem Gastartikel am 1. Juni 2022 im Springer-Blatt „WELT“ veröffentlicht. Die Gegenreaktion der Springer-Spitze ließ nicht lange auf sich warten. Springer-Vorstandschef Döpfner schlug am 3. Juni 2022 zurück und diskreditierte Kortes Beitrag öffentlich als „intolerant und ressentimentgeladen“. In der Folge verließen übrigens mehrere namhafte Journalisten das Haus Springer.
Nun aber hat die CDU/CSU in Sachen Korte reichlich verspätet, aber plötzlich kalte Füße gekriegt und Angst bekommen vor der Öffentlichkeit – womöglich auch vor Springer. Denn plötzlich verschwand Korte von der CDU/CSU-Einladungsliste; seine bereits abgegebene Stellungnahme verschwand, wiewohl sie noch vor der Anhörung auf der Website des Familienausschusses – für drei Tage – veröffentlicht worden war. Kortes Text sollte anschließend lediglich als „unangeforderte“ Stellungnahme wieder online gehen können, was Korte – zu Recht – zurückwies.
Und dann Springers Salto mortale: Am 18. Dezember 2023 veröffentlichte die „Welt“ Kortes Stellungnahme. Ob Springer Korte mit der Veröffentlichung des für die Anhörung vorgesehenen Textes rehabilitieren wollte? Die einmal mehr rundgelutschte CDU/CSU steht jedenfalls als begossener Pudel da.
Da die Stellungnahme hinter einer Bezahlschranke steht, fassen wir hier Kortes Argumente straff zusammen:
1. Besonders problematisch sind aus kinder- und jugendmedizinischer Sicht die vorgesehenen Regelungen bei Minderjährigen … Es stellen sich hier zwei Fragen. Wer, wenn nicht ein/e Facharzt/-ärztin für KJP, soll – erstens – die Bewertung vornehmen, ob die Änderung der Angaben zum Geschlecht und der Vornamen dem Kindeswohl entspricht (oder diesem zuwiderläuft), und – zweitens – ob Elternrechte ausreichend berücksichtigt werden und Jugendliche mit vollendetem 14. Lebensjahr regelhaft in der Lage sind, Bedeutung, Tragweite und Folgen einer solchen Entscheidung einschätzen zu können … Wir wissen aus Langzeitstudien, dass sich die Selbstdiagnose „trans“ im Entwicklungsverlauf vieler Kinder/Jugendlicher nachträglich als Fehleinschätzung herausstellt.
2. Weitere wichtige Argumente gegen den Gesetzentwurf kommen von Frauengruppierungen, die unabhängig von finanzieller Förderung durch Ministerien und auch unabhängig vom Deutschen Frauenrat sind. So wird u.a. darauf hingewiesen, dass die gefühlte „Geschlechtsidentität“ im Kern auf traditionellen Geschlechterstereotypen aufbaut. Die staatliche Gleichstellungspolitik nach Art. 3 (2) GG, die diesen Stereotypen durch geeignete Maßnahmen entgegenwirken soll, würde damit konterkariert, Geschlechterstereotype und Rolleneinengung, die es ja gerade aufzulösen gelte, würden festgeschrieben.
3. Mit der Neudefinition der rechtlichen Kategorie „Geschlecht“, die im deutschen Rechtssystem seit jeher auf körperlichen Merkmalen beruht, künftig aber auf der Grundlage eines „Geschlechtsidentitäts“-Empfindens definiert werden soll, könnten Gleichstellungspolitik und Frauen-/Mädchenförderprogramme nicht mehr an der objektiv gegebenen, körperlichen Geschlechtszugehörigkeit ansetzen, um Nachteile auszugleichen, die Frauen aufgrund eben derer erfahren. Geschlechtsbezogene Daten und deren valide Erhebung sind aber essenziell für Sozial-, Medizin- und Kriminalstatistiken ebenso wie für die Transparenz und faire Bewertung bei Sportwettbewerben.
4. Zudem untergräbt der Gesetzentwurf die Sicherheit von Frauen und Mädchen. Er sieht vor, dass Männer, die sich per Sprechakt zu Frauen erklärt haben, Zugang zu allen Institutionen und Bereichen erhalten, die zum Schutz von Frauen und Mädchen vor Übergriffen und Dominanz durch Männer geschaffen wurden. Dazu gehören z.B. Frauenhäuser, öffentliche Toiletten, Mädchen-/Frauenumkleiden und -duschen in Schulen und Sportstätten, Frauengefängnisse, Frauengesundheitszentren, Zimmer für Frauen in Krankenhäusern und Pflegeeinrichtungen sowie die separierten Bereiche für Frauen und Mädchen in Unterkünften für Geflüchtete.
5. Fortgesetzt geleugnet werden von der Regierung die im Zuge mit Self-ID-Gesetzgebung in anderen Ländern bereits gemachten Negativ-Erfahrungen. Es wird als frauenverachtend abgelehnt, dass im Selbstbestimmungsgesetz der Begriff „schwangere“ oder „gebärende Person“ statt Frau/Mutter verwendet wird. Auch werden homosexuelle Frauen sprachlich quasi eliminiert, wenn Männer sich per Sprechakt rechtlich zu „Frauen“ und so ggf. auch zu „Lesben“ erklären können.
6. Mehrere Frauengruppierungen und Eltern-Selbsthilfe-Organisationen kritisieren außerdem, dass das Bundesministerium für Familie, Senioren, Frauen und Jugend deren fristgerecht eingereichte kritische Stellungnahmen erst auf beharrliches Nachfragen hin und mit großer Verspätung auf seiner Internetseite veröffentlicht habe. Damit habe das Ministerium den Meinungsbildungsprozess tendenziös beeinflusst.
7. Das sogenannte „Selbstbestimmungs“-Gesetz ist ein Etikettenschwindel. Tatsächlich geht es schlichtweg um die Forderung nach Bestätigung durch andere. Es geht darum, dass andere einen als demjenigen Geschlecht zugehörig identifizieren, das man selbst für sich proklamiert. Aus Sicht des Sachverständigen und der allermeisten Kritiker des Gesetzentwurfs ist es eine Frage der Toleranz, der Höflichkeit und des Respekts, erwachsene transidentifizierte Personen nach erfolgter sozialer und juristischer Transition in ihrem Wunschgeschlecht, mit dem gewählten neuen Namen und den gewünschten Personalpronomina anzusprechen. Das vorgesehene bußgeldbewehrte Offenbarungsverbot jedoch würde die ganze Gesellschaft unter Strafandrohung zwingen, eine Illusion zu bestätigen und Realität zu leugnen.

Anzeige"
"1717598406-5","https://www.tichyseinblick.de/meinungen/selbstbestimmungsgesetz-ampel-vorzeigeprojekt/","Keine Mehrheit für Ideologie-Projekte","Selbstbestimmungsgesetz – vom Vorzeigeprojekt der Ampel zu einem ihrer größten Probleme","Das Selbstbestimmungsgesetz sollte Vorzeigeprojekt der Ampel werden - jetzt ist es ihr größtes Problem. Schon allein, weil sie derzeit keine Mehrheit für das grüne Ideologie-Projekt hat.","In der beschönigend-leichten Sprache der Ampel wurde es „Selbstbestimmunsgesetz“ genannt; und wer könnte schon etwas gegen Selbstbestimmung haben? In der Sache müsste es „Gesetz zur sexuellen Transformation von Kindern“ lauten, denn darum geht es: Kinder einfach und ohne Beratung oder Einfluß der Eltern zu Transmenschen umzugestalten. Eigentlich sollte das Selbstbestimmungsgesetz längst verabschiedet sein. Doch zuerst ging es länger als geplant nicht durchs Kabinett. Nun liegt es auf Eis, obwohl es bereits im November in die erste Lesung gegangen ist. Wenn es zu einer namentlichen Abstimmung kommt – und die ist wahrscheinlich – dann könnte das Gesetz keine Mehrheit haben.
Strittig ist die im Gesetz zentrale Frage, ob und unter welchen Umständen Kinder ihren Geschlechtseintrag ändern lassen können. Erwachsene können das etwas umständlicher bereits heute.
Um Kinder geht es, und nur um sie.
Der „Queer-Beauftragte“ der Bundesregierung, Sven Lehmann (Grüne) hat vor wenigen Tagen Schlagzeilen damit gemacht, dass sich Kinder auch ohne Beratungspflicht vom Jungen zum Mädchen oder umgekehrt erklären können. Eine Anfrage der Union ließ Lehmann unbeantwortet, unter welchen Umständen ein medizinischer Eingriff bei Kindern möglich sein soll, um das Geschlecht operativ „anzugleichen“.
Außerdem sollen die Krankenkassen die Kosten für die Verstümmelung vornehmen – denn nach ärztlichem Ethos handelt es sich genau darum, wenn einem gesunden Körper Brust und Geschlechtsorgane amputiert werden. Das Vorhaben ist umso bedenklicher, weil die sexuelle Identität gerade in der Phase der Pubertät fragil ist. Kindliche Empfindungen in dieser Phase sind nicht hinreichend, um ohne gründliche Beratung mit hormonellen oder chirurgischen Eingriffen unumstößliche Folgen zu erzeugen, die nach breiter Erkenntnislage von den Betroffenen zu häufig bitter bereut werden. Auch dass die Eltern komplett übergangen werden sollen, verstößt gegen den grundgesetzlich verankerten Schutz der Familie. Aber gerade hier sehen Lehmann und seine Anhänger die Chance, Kinder aus dem Familienverband herauszubrechen und zu manipulieren. Lehmann will offensichtlich statt medizinischer Beratung die Transsexuellen-Verbände finanziell fördern – für Beratung in eigener Sache und faktisch der Mitgliedergewinnung einer winzigen Minderheit mit Mitteln der Geschlechtsumwandlung.
Ohnehin gibt es keinen zwingenden Grund für dieses Gesetz: Nach heutigem Gesetz können sich Erwachsene einer Geschlechtsumwandlung vollziehen – nach ärztlicher Beratung. Warum die Altersschwelle gesenkt werden soll kann daher nur mit dem Bestreben der Transsexuellen-Verbände erklärt werden, die auf Kinder Zugriff suchen und für ihre Lebensform neuerdings breit Werbung in Kitas, Kindergärten und Schulen betreiben und dabei auf Broschüren zurückgreifen, die grüne Ministerien finanzieren. So feiert eine von der SPD-nahen Arbeiterwohlfahrt herausgegebene und vom Bund geförderte Broschüre Transsexualität schon bei 2-Jährigen, wobei die Kinder gezielt darauf hingeführt werden sollen.




Geschlechtswechsel im Kindergarten
Von der Bundesregierung geförderte Broschüre feiert Transsexualität bei 2-Jährigen





Lehmanns Antwort auf die Frage der Union nach Ausgestaltung Details der Regelung zur Geschlechtsmanipulation bei Kindern war wohl taktischer Natur. Der Grüne wollte öffentlich eine Sprachregelung setzen, damit Fakten schaffen und die beiden Koalitionspartner auf grünen Kurs bringen. Die einstige politische Heimat der pädophilen „Indianerkommune“ will möglichst keine Barrieren bei der Geschlechtsumwandlung von Kindern sehen. Heute nehmen organisierte Verbände von Päderasten gezielt Einfluß auf die Details Gesetzgebung. Egal ob in der Erklärung oder bei medizinischen Eingriffen – hier sollen Fakten geschaffen werden.
Doch dafür fehlt den Grünen nur voraussichtlich doch eine Mehrheit im Bundestag. Teile der SPD und sogar einzelne Abgeordnete der FDP, die in ihrer Gesamtheit dieses Missbrauchs-Vorhaben als „liberal“ verstehen, wollen das Gesetz so nicht mittragen. Damit stellen sich der Ampel die ersten beide Probleme mit dem Selbstbestimmungsgesetz: Es ist ein Gesetz, das die grüne Minderheit gegen die Mehrheit in Parlament und Gesellschaft durchdrücken will. Und es ist das nächste öffentliche Ringen, das um ein Vorhaben der Ampel droht. Bei einem Projekt, bei dem die ungleichen Partner SPD, Grüne und FDP ursprünglich gedacht haben, eine gemeinsame Basis zu haben. Zunehmend erkennen aber Abgeordnete den Sprengstoff im Gesetz und das Risiko durch wachsenden Widerstand, ebenso wie Umkehrmaßnahmen in den USA und weiteren europäischen Ländern.
Wenn das Selbstbestimmungsgesetz aber doch noch im grünen Sinn durch den Bundestag gehen sollte, fangen die Probleme der Ampel erst an. Familienministerin Lisa Paus (Grüne) ist in ihrer Mitarbeit am Entwurf das gleiche passiert wie bei der Kindergrundsicherung: Sie sollte eine Regelung vereinfachen – und hat sie letztlich deutlich verkompliziert. Denn: Kinder brauchen keine Pflichtberatung und auch keine Unterschrift der Eltern mehr für einen Geschlechtswandel. Das hört sich in der unterkomplexen Gedankenwelt der Grünen einfach an. Ist es aber nicht. Im Gegenteil.
Es drohen viele Konstellationen, die in Rechtsstreit und sogar Eingriffen des Staates in die Familien münden könnten. Etwa wenn das Kind gegen den Willen der Eltern eine Geschlechtsumwandlung will. Aber auch wenn ein Elternteil diese Umwandlung will und das andere nicht, was dann wiederum zum Streit der Eltern führt. Bei Scheidungen könnte die Identität des Kindes zur Streitmasse im Verfahren werden.
Geht es nach den Grünen, entscheidet in solchen Fällen das Jugendamt um die Zukunft des Geschlechts des Kindes. Damit würden die Eltern ausgeschaltet, die Familie ein Gegenstand der Behandlung durch Bürokratien. Wobei Paus, Lehmann und Co den Ämtern sogar das Recht zugestehen wollen, in solchen Fällen das Sorgerecht zu entziehen. Denn wer nicht will, das der 12 Jahre alte Lars auch auf dem OP-Tisch zu Lauretta wird, betreibt nach grüner Lesart seelische Grausamkeit am Kind, was entsprechend mit dem Entzug des Sorgerechts geahndet werden kann. Dass Erfahrungen aus skandinavischen Ländern, Großbritannien und den USA zeigen, dass diese Maßnahmen von den Betroffenen in immer zunehmender Zahl bitterlich bereut werden, stört die Grünen in ihrem ideologischen Eifer nicht und wird von den agierenden Verbänden der Transsexuellen und Päderasten geleugnet. Allein gegen die britische Tavistock-Kllinik, die in großem Umfang Geschlechtsmanipulationen vorgenommen hat, haben über 1000 Betroffene Klage eingereicht. Es mehren sich Stimmen, die konstatieren, dass sich bei etwa 80% der Transkinder das Gefühl im falschen Körper geboren zu sein als Homosexualität herausstellt, eine chemische Behandlung durch Pubertätsblocker oder sogar Operation in vielen Fällen nicht notwendig bis hin zu irreversibel ist.




über 1000 Familien
Tavistock: Auf die Transgender-Klinik rollt eine historische Klagewelle zu









Unerzählte Geschichten
Trans-Propaganda: Immer mehr Fälle bekannt, in denen die Opfer Therapien oder Operationen bitter bereuen





Für die Betroffenen hat das von den Transsexuellen-Verbänden maßgeblich betriebene Gesetzesvohaben verheerende Folgen: Es droht rechtliche Unsicherheit. Der Staat trägt Streit in die Familien. Der Staat droht Familien, diese zu zerreißen. Kinder könnten zu einem übereilten Geschlechtswechsel ermutigt werden, der dann nicht mehr gutzumachen ist – zumindest nicht ohne massive, tatsächliche seelische Grausamkeiten. Inhaltlich ist dieses Gesetz ein höchst unmoralisches Vorhaben und dient nur der Befriedigung einer Lobby, die sich buchstäblich den eigenen Nachwuchs künstlich erzeugen will.
Für die Ampel würde es im Fall der Zustimmung zu einer politischen Katastrophe werden. Im Wahljahr 2025 würden immer wieder öffentliche Berichte über Familien drohen, denen das Sorgerecht entzogen wurde. Oder über Familien, die vor Gericht über das Geschlecht ihres Kindes streiten. Damit drohen SPD und FDP im Wahljahr immer wieder Erinnerungen daran, dass sie bereit waren für den Erhalt der Koalition grüne Ideologie mitzutragen, die nicht nur gesellschaftlich keine Mehrheit hat – sondern auch keine Mehrheit unter SPD- und FDP-Wählern.
Besonders für die FDP ist das schwierig. Denn mit Justizminister Marco Buschmann ist einer ihrer vier Bundesminister maßgeblich in das Gesetzesvorhaben verwickelt. Eigentlich will sich die FDP in den verbleibenden zwei Jahren als die Partei des Bürokratieabbaus etablieren. Das Gesicht zu diesem Thema soll eben der Justizminister werden. Die Chancen, mit dem Thema Bürokratieabbau durchzudringen, stehen ohnehin schlecht. Mit einem Marco Buschmann, der immer und immer wieder mit dem verheerenden Folgen des Selbstbestimmungsgesetzes verbunden wird, kann die FDP das Rettungsring-Projekt Bürokratieabbau noch vor dessen Beginn vergessen. Dazu kommt, dass ihr ohnehin fraglicher Anspruch auf Liberalismus endgültig in den Schmutz gezogen wird, wenn darunter Kinder leiden die offenkundig manipuliert und mißbraucht werden.
Aus diesen Gründen ist das Selbstbestimmungsgesetz entgegen den eigentlichen Plänen noch nicht verabschiedet. SPD und FDP suchen nach einem Weg, genügend Selbstbestimmungsgesetz zu verabschieden, dass die Grünen zufrieden sind und wenig genug davon, dass es ihnen in der außerparlamentarischen Öffentlichkeit nicht um die Ohren fliegt. Die Grünen beharren indes auf der reinen Lehre und dem Angriff auf die Selbstbestimmung der Familien, die endgültig beendet werden soll. Bisher sind solche Debatten in der Ampel immer zugunsten der Grünen ausgegangen. In der ersten Hälfte der Legislatur war den Abgeordneten der Erhalt der Koalition wichtiger als die inhaltliche Vernunft. In der zweiten Hälfte der Legislatur dämmert ihnen, dass diese Linie derart unbeliebt in der Bevölkerung ist, dass sie zum Einde ihrer Karriere im Herbst 2025 führen wird. Das Wohl der Kinder spielt bei derartigen taktischen Finessen kaum eine Rolle und kann daher auch auf der Strecke bleiben.
 
Anzeige"
