web-scraper-order,web-scraper-start-url,text1,text2,text3,text4
"1717598410-6","https://www.tichyseinblick.de/gastbeitrag/selbstbestimmungsgesetz-beschlossen/","Weiterer Ampel-Irrweg","Das Selbstbestimmungsgesetz wurde gegen jede Vernunft beschlossen","Das „Selbstbestimmungsgesetz“ wendet sich gegen den Menschen selbst – gefährdet die Gesundheit und Entwicklung junger Leute. Es erlaubt Männern, sich bedingungslos als Frau auszugeben. Es ist ein Rückschritt und Rückschlag für die Sicherheit von Frauen und gegen Frauenrechte. Von Sylvia Pantel","Der Begriff klingt banal und harmlos – das als „Selbstbestimmungsgesetz“ raffiniert betitelte Gesetz ist am 12. April 2024 im Deutschen Bundestag beschlossen worden. Es ist jugendgefährdend und totalitär. Es beinhaltet nicht nur eine Art Neuerfindung des Mensch-Seins. Bei diesem Gesetz wird verschwiegen, dass eine lebenslange medizinische und pharmazeutische Behandlung notwendig sein wird, die von der Gesellschaft getragen werden soll.
Auch wird derjenige mit einem Bußgeld von bis zu 10.000 Euro bestraft, der einen biologischen Mann weiterhin als Mann bezeichnet, wenn dieser sich selbst als soziales weibliches Wesen bezeichnet, oder bei einer biologischen Frau, die sich selbst als Mann sieht. Das selbst ernannte soziale Geschlecht kann jedes Jahr aufs Neue verändert werden.








Selbstbestimmungsgesetz


Gerichte entscheiden künftig über das Geschlecht von Kindern




Durch die mit dem Selbstbestimmungsgesetz ermöglichte beliebige Wahl des Geschlechtseintrags werden die Rechte und Schutzräume von Frauen massiv gefährdet, die Meinungsfreiheit beeinträchtigt und die Sicherheit im Rechtsverkehr der Bürger untereinander zerstört.
Dieses Gesetz unterstützt Minderjährige, mit vollendetem 14. Lebensjahr, ohne Zustimmung der Eltern, mit Hilfe des Familiengerichts ihren Personenstand (soziale Transition) zu ändern, ohne vorherige verpflichtende Beratung von Ärzten oder Psychologen. Kinder und Jugendliche werden in ihrer Identitätsfindung allein gelassen. Anstatt mit Gesprächen oder Therapien werden sie mit Pubertätsblockern und der lebenslangen Einnahme von Hormonen versorgt, mit anschließender Operation, die die eigene Gesundheit und Fruchtbarkeit dauerhaft und weitgehend irreversibel ruiniert. Dagegen wird derzeit psychische Beratung in Deutschland sogar abgelehnt und mit Strafe bedroht.
Studien belegen, dass die meisten Menschen nach der Pubertät sehr gut mit ihrem Geschlecht zurechtkommen. Die aktuellen Studien der Universität Groningen haben die Entwicklung der geschlechtsspezifischen Unzufriedenheit im Jugend- und früheren Erwachsenenalter untersucht. Das Unzufriedensein mit dem eigenen Geschlecht und der Identität in der Pubertät ist und war, auch bei psychisch gesunden Teenagern, nichts Ungewöhnliches. Größere psychische Probleme und Selbstwertprobleme hingegen scheinen die Unzufriedenheit der Geschlechtszugehörigkeit jedoch zu verstärken. Die Studie belegt, was viele Ärzte in anderen Ländern seit langem beobachten: Vermehrt glauben betroffene Mädchen in der Pubertät, die auf eine Geschlechtsumwandlung drängen, eine sozial hoch akzeptierte Scheinlösung gefunden zu haben, da sie durch den Transhype mit den unzähligen Trans-Influencern und Trans-Promis in den sozialen Medien bestärkt werden.
Die Evidenz zur Beurteilung der Auswirkung einer Hormonbehandlung auf die Bereiche bei Kindern und Jugendlichen mit Geschlechtsdysphorie ist unzureichend und der Effekt der Gabe von Pubertätsblockern zur Behandlung der sogenannten Gender Dysphorie noch nicht ausreichend belegt. Langzeitstudien zu den Nebenwirkungen wurden noch gar nicht durchgeführt. Hier könnte sich derselbe Fehler wie zu Zeiten der Covid-Impfkampagne wiederholen. Wir sehen also auch eine reale Gefahr für die körperliche Unversehrtheit unserer Kinder.








Selbstbestimmungsgesetz


SPD, Grüne und FDP kriminalisieren Frauenrechtlerinnen




Erfahrungen in anderen Länder belegen zusätzlich, dass die sogenannte Self-ID, die geschlechtliche Selbstidentifizierung ohne biologische Tatsachengrundlage auch extrem gefährlich für die Sicherheit von Frauen ist. In Schottland wollte sich einige Tage nach der Reform ein Vergewaltiger in ein Frauengefängnis verlegen lassen. Inzwischen können Transgender-Männer im Sport für einen unfairen Wettkampf sorgen und auf Kosten von Frauen Medaillen gewinnen.
In Deutschland soll künftig mit Minderjährigen ein psychosoziales Großexperiment mit zum Teil irreversiblen Konsequenzen für eine gedeihliche psychische und gesundheitliche Entwicklung junger Menschen stattfinden. Demgegenüber haben unsere europäischen Nachbarn aus solchen Fehlern gelernt: In den Niederlanden, Schweden, Finnland, Norwegen, Dänemark, Frankreich und Italien wurden vergleichbare Fehleinschätzungen der letzten Jahre korrigiert und die Behandlung von Kindern mit Pubertätsblockern stark eingeschränkt beziehungsweise ganz untersagt.
Die Ampelregierung aber geht erneut uneinsichtig und stur einen ideologisch verbrämten Sonderweg. Jede Kritik an der Genderideologie wird als Hass („hate“) bezeichnet und wer den Vorgaben dieses Gesetz nicht Folge leistet, soll künftig bestraft werden können. Dabei werden die Erkenntnisse des Wissenschaftlichen Dienstes des Deutschen Bundestags ebenso wie evidenzbasierte Standards in anderen Ländern komplett ignoriert.
Erneut gefährdet die Ampelregierung damit – ähnlich wie bei der Legalisierung von Cannabis – unter der falschen Fahne vermeintlicher Liberalität nachhaltig die Gesundheit und Sicherheit junger Menschen; mühsam errungene Rechte von Frauen werden missachtet und konterkariert. Hoffentlich erkennt unsere Gesellschaft bald, welchen Irrsinn diese Ampelregierung fabriziert. Es ist zu hoffen, dass uns solche Gesetze gegen alle Vernunft zukünftig erspart bleiben.

Anzeige"
"1717598415-7","https://www.tichyseinblick.de/daili-es-sentials/selbstbestimmungsgesetz-spd-gruene-fdp/","Selbstbestimmungsgesetz","SPD, Grüne und FDP öffnen Männern Schutzräume für Frauen – und regieren in Familien hinein","Das „Selbstbestimmungsgesetz“ geht voraussichtlich am Freitag final durch den Bundestag. Über Familiengerichte regiert die Ampel dann in die Familien hinein und gefährdet Schutzräume für Frauen.","Bisher müssen Personen, die den Eintrag über ihr Geschlecht offiziell ändern wollen, nachweisen, dass sie sich je nachdem nicht als Frau oder als Mann fühlen. Das pathologisiere den Wunsch, ein anderes Geschlecht anzunehmen, der Wunsch werde also zu etwas Krankhaftem gestempelt, argumentiert die Ampel und hat daher das „Selbstbestimmungsgesetz“ in den Bundestag eingebracht. Für diesen Freitag ist die finale Abstimmung geplant.
Dann kann jeder Volljährige zum Standesamt oder zur Auslandsvertretung gehen, um seinen Vornamen und den Eintrag zu seinem Geschlecht ändern zu lassen. Ämter dürfen die alten Daten speichern. Private dürfen das nicht – mit Ausnahme der jeweiligen Ehepartner, Kinder oder des jeweils andere Elternteils, wenn Vater und Mutter nicht verheiratet sind. Nennt jemand trotzdem einen Geschlechtswandler bei dessem alten Namen, sieht das Selbstbestimmungsgesetz Strafen von bis zu 10.000 Euro vor.
Mit dem Selbstbestimmungsgesetz regiert die Ampel unter Federführung von Justizminister Marco Buschmann (FDP) in die Familien hinein. Zwar sieht das Gesetz vor, dass Eltern einem Kind die Zustimmung zum Geschlechtswandel verweigern können, wenn das zwischen 14 und 18 Jahren alt ist. Doch dann entscheiden laut Buschmanns Entwurf Familiengerichte, „wenn die Änderung des Geschlechtseintrags und der Vornamen dem Kindeswohl nicht widerspricht“. Buschmann hat also eine Beweislastumkehr eingebaut. Eltern, die ihrem 15 Jahre alten Sohn den Eintrag als Mädchen verweigern wollen, müssen nachweisen, dass der Wechsel dem Kindeswohl widersprechen würde.
Die Ampel betreibt an der Stelle Etikettenschwindel mit dem Selbstbestimmungsgesetz. Die Passage soll suggerieren, dass Eltern über den Geschlechtswandel ihrer minderjährigen Kinder entscheiden. Damit soll verhindert werden, dass die letzten liberalen und konservativen Wähler verschreckt von FDP und SPD weglaufen. Doch in der Realität regieren nun die Familiengerichte in der Frage der Geschlechtsidentität in die Familien hinein.
Den nächsten Etikettenschwindel betreibt die Ampel mit den Schutzräumen für Frauen. Zwar heißt es in dem Entwurf: „Es ist daher etwa im Rahmen des Hausrechts weiterhin möglich, aus sachlichem Grund, etwa um den Schutz der Intimsphäre oder der persönlichen Sicherheit Rechnung zu tragen, im Einzelfall zu differenzieren.“ Das soll so klingen, als wenn Männern weiterhin der Zugang zu Saunen, Toiletten oder Heimen für Frauen verwehrt bleibt.
Doch faktisch wälzt die Ampel eine Aufgabe auf Privatpersonen ab, die der Staat laut eigener Argumentation nicht leisten kann. Ein sachlicher Nachweis gilt für SPD, Grüne und FDP beim Geschlechtswandel als unzumutbar, die Besitzer von Saunen, die Verantwortlichen für Toiletten oder Frauenhäuser sollen ihn aber „im Einzelfall differenzieren“ können, wenn sie Paulas mit Penis und Biggis mit Bärten den Zutritt verweigern wollen. Angesichts existenzvernichtend hoher Strafen werden die Verantwortlichen im Zweifelsfall Männer durchwinken. SPD, Grüne und FDP öffnen Männern die Schutzräume für Frauen – und übernehmen noch nicht einmal die Verantwortung dafür, sondern verstecken sich hinter den Betreibern.
Wenn es um den eigenen Bereich geht, mutet sich die Ampel solche Unklarheiten nicht zu. Im „Spannungs- oder Verteidigungsfall“ muss Klaus weiterhin zum Gewehr greifen, auch wenn er sich selbst als Claudia liest. Ist der Konflikt ausgebrochen, ist es erst einmal zu spät für ihn. Wer dem Dienst an der Waffe aus dem Weg gehen will, muss sich gleich als Frau eintragen lassen. Bricht in den zwei Monaten nach dem Wandel kein Spannungs- oder Verteidigungsfall aus, bleibt der Geschlechtswechsel gültig.

Anzeige"
"1717598418-8","https://www.tichyseinblick.de/meinungen/frauen-wehren-sich-gegen-spd-gruene-und-fdp/","Selbstbestimmungsgesetz","Frauen wehren sich gegen SPD, Grüne und FDP","Die Ampel drückt morgen voraussichtlich das Selbstbestimmungsgesetz durch den Bundestag. Mehrere Frauengruppen haben Protest dagegen angekündigt. Sie bezeichnen das Gesetz als „alles andere als harmlos“.","Schweden, Großbritannien und die Niederlande gelten als Vorreiter in Sachen „Selbstbestimmung“. Sie haben es jedem Mann erlaubt, sich als Frau auszugeben und sich so Zugang zu Schutzräumen für Frauen zu verschaffen. Angefangen von der Frauensauna, über das Frauenhaus bis hin zum Frauenknast. Die Vorreiter sehen jetzt ihre Fehler ein und kehren der Reihe nach um – in Deutschland läuft die Ampel den Irrweg jetzt erst recht entlang. Unter Federführung von Justizminister Marco Buschmann (FDP).
Die FDP mag es sich leisten können, liberale und konservative Wähler zu verprellen. Ihre Wählerschaft hat sich ohnehin auf einen harten Kern reduziert, der direkt oder indirekt über die FDP sein Geld verdient. Doch SPD und Grüne erfahren nun Widerstand von einer Gruppe, die in den jeweiligen Anfangsjahren der Parteien wichtige Stützen waren: den Frauenrechtlerinnen. Sie demonstrieren am Freitag vor dem Reichstag, während drinnen SPD, Grüne und FDP ihr Selbstbestimmungsgesetz in der finalen Abstimmung durchsetzen werden.




Selbstbestimmungsgesetz
SPD, Grüne und FDP öffnen Männern Schutzräume für Frauen – und regieren in Familien hinein





Zu den vier Gruppen, die zum Protest gegen das Selbstbestimmungsgesetz aufgerufen haben, gehört der Verein Frauenheldinnen. Diese haben auf der Seite der Ruhrbarone erklärt, warum sie sich gegen das Gesetz von SPD, Grünen und FDP wehren. Das Gesetz verletze die Schutzräume für Frauen, gefährde die Meinungsfreiheit und die Rechtssicherheit.
Die Frauenheldinnen schildern Fälle von Vergewaltigern, die sich in schottische Frauengefängnisse verlegen lassen wollten. Von Männern, die Frauensport ad absurdum führen, indem sie dort die Realität der Biologie über das Wunschdenken der Ideologie siegen lassen. Oder von spanischen Offizieren, die sich als Frauen haben eintragen lassen, ohne auch nur den Namen oder das Aussehen zu verändern.
Schon jetzt müssten Frauenrechtlerinnen, die auf solche Fehlentwicklungen hinweisen, mit Abmahnungen und Ermittlungen wegen „Volksverhetzung“ rechnen. Mit dem Selbstbestimmungsgesetz und Strafen von bis zu 10.000 Euro eröffnen SPD, Grüne und FDP nun endgültig die Jagd auf Frauen, die für ihre Rechte einstehen. Wie sehr der Ampel-Zeitgeist sich gegen Frauenrechte ausspricht, hat das Staatsfernsehen gezeigt. Der Aktivist Jan Böhmermann durfte im ZDF Frauenrechtlerinnen unwidersprochen als „Schei…aufen“ bezeichnen. Abgeordnete von SPD und Grünen, die ihr Mandat und damit ihre wirtschaftliche Existenz Frauenquoten verdanken, schwiegen dazu feige – ebenso wie ZDF-Intendant Norbert Himmler, der seine Fäkalschleuder noch mit einer Erhöhung der Bezüge belohnt hat.
Die Niederlande hat jetzt ihr Selbstbestimmungsgesetz gestoppt. Die britische Gesundheitsbehörde „National Health Service“ hat die Behandlung von Kindern mit Pubertätsblockern untersagt. Schweden hat ebenfalls ein Selbstbestimmungsgesetz gestoppt. Finnland, Norwegen, Dänemark und Frankreich haben Irrtümer im Umgang mit der Selbstfestlegung des Geschlechts eingeräumt. Nur die Ampel macht unverdrossen weiter. SPD, Grüne und FDP handeln nach dem Motto: Wir geben uns der Realität erst geschlagen, wenn sich die Niederlage nicht mehr vertuschen lässt – und wir geben beim Vertuschen wirklich alles.




Das Leben der Lena-Sophies
Die woke Revolution frisst ihre Kindfrauen





 
Anzeige"
"1717598421-9","https://www.tichyseinblick.de/daili-es-sentials/selbstbestimmungsgesetz-frauenquoten/","Selbstbestimmungsgesetz","Marco Buschmanns Regeln führen die Quote für Frauen ins Absurde","Das Selbstbestimmungsgesetz der Ampel hat viele Schwächen. Aber, was sich Justizminister Marco Buschmann für Frauenquoten ausgedacht hat, spielt Champions League. Dank SPD, Grünen und FDP haben sich Quoten eigentlich erledigt.","„Hallo, ich bin die Ute. Ehrlich gesagt, verstehe ich nicht viel von Politik. Aber wenn etwas ist, frage ich meinen Mann, den Klaus.“ Mit diesen Worten bewarb sich Ute 1994 für den Spitzenplatz der Grünen zur Kreistagswahl im saarländischen Neunkirchen. Nun hatte der Kreisverband zwei Probleme. Zum einen wollte er die Ute nicht, weil die Ute so redete und weil der Klaus, ihr Mann, als ein Vertrauter des Landesvorsitzenden Hubert Ulrich galt. Zu dem stand der Kreisverband in Opposition. Zum anderen bestand der Kreisverband aber nur aus 70 Mitgliedern, von denen sich höchstens drei Frauen engagierten, aber keine für ein Mandat kandidieren wollte, obwohl der Verband ein strenges Frauenstatut sein Eigen nannte.








Selbstbestimmungsgesetz


SPD, Grüne und FDP öffnen Männern Schutzräume für Frauen – und regieren in Familien hinein




Der Kreisverband musste also nun mehrheitlich dagegen stimmen, dass die Ute, die Frau vom Klaus, ihre Spitzenkandidatin bei der Kreistagswahl wird. Daraufhin musste der Verband eine zweite Wahlversammlung einberufen und die Ute wieder ablehnen. Es folgte eine dritte Wahlversammlung, auf der die Mitglieder Ute erneut verhindern mussten. Bei der vierten Wahlversammlung mussten sie nochmal gegen Ute stimmen, konnten dann aber – schwuppdiwupps und ganz pragmatisch – eine Liste zur Kreistagswahl aufstellen. Waren ja erst sechs Wochen und acht Stunden netto vergangen. Frauenquoten haben schon immer ihre absurden Momente mit sich gebracht.
Mit dem Selbstbestimmungsgesetz von FDP, SPD und Grünen wird es noch absurder. Denn das bestimmt in Paragraph 7: „Wenn für die Besetzung von Gremien oder Organen durch Gesetz eine Mindestanzahl oder ein Mindestanteil an Mitgliedern weiblichen und männlichen Geschlechts ist, so ist das im Personenstandsregister eingetragene Geschlecht der Mitglieder zum Zeitpunkt der Besetzung maßgeblich.“ Das heißt: Wenn Klaus künftig auf einem Frauenplatz kandidieren will, muss er nicht mehr die Ute vorschicken, um für ihn anzutreten. Es reicht, rechtzeitig aufs Standesamt zu gehen, sich für mindestens ein Jahr Claudia zu nennen und schwupps, gehört der Spitzenplatz ihm.
Sorry, ihr. Vorsicht. Das kann demnächst teuer werden. Wer die Geschlechter falsch zuordnet, dem drohen dank des Gesetzes von Justizminister Marco Buschmann (FDP) künftig Strafen von bis zu 10.000 Euro. Wer das für absurd hält … Wer jetzt denkt, das lässt sich an Absurdität nicht mehr steigern, der tut Marco Buschmann bitter Unrecht. Das liberale Genie hat immer noch einen drauf, wenn es darum geht, an Absurdität und Bürokratie einen draufzulegen.
Was ist nämlich, wenn der Klaus… sorry, die Claudia – so ein Fehler kostet demnächst 10.000 Euro. Also wenn die Claudia wieder Klaus werden will, nachdem sie den Quotenplatz hat? Also für den Fall hat sich Marco Buschmann ganz was Tolles einfallen lassen. Achtung, vor dem Lesen noch einmal Luft holen. Es folgt Paragraph 7, Punkt 2:
„Eine nach der Besetzung erfolgte Änderung des Geschlechtseintrags eines Mitglieds im Personenstandsregister ist bei der nächsten Besetzung eines Mitglieds zu berücksichtigen. Reicht dabei die Anzahl der neu zu besetzenden Sitze nicht aus, um die gesetzlich vorgesehene Mindestanzahl oder den gesetzlich vorgesehenen Mindestanteil an Mitgliedern zu erreichen, so sind diese Sitze nur mit Personen des unterrepräsentierten Geschlechts zu besetzen, um dessen Anteil sukzessive zu steigern.“








Selbstbestimmungsgesetz


Frauen wehren sich gegen SPD, Grüne und FDP




Okay. Was heißt das jetzt? Besteht ein unter Quote stehendes Gremium aus sieben Penisen und fünf Vaginas, dann muss das Gremium um eine Vagina aufgestockt und um einen Penis gekürzt werden. Liest sich fortan aber einer der Penise selbst als Vagina, dann ist das Gremium wieder im Soll. Entschließen sich gleich fünf Penise, sich als Vagina zu lesen, besteht das Gremium aus zwei Ur-Penisen, fünf Penis-Vaginas und fünf Ur-Vaginas. Dann dürften noch acht weitere Ur-Penise ins Gremium. Selbstverständlich auch acht Vagina-Penise. Na? War das jetzt so kompliziert?
Es gibt vier Dinge, die Marco Buschmann gut kann: Grimmig gucken und trotzdem niedlich wirken. Die Jagd auf die Saboteure der Nord-Stream-Pipeline versprechen, ohne auch nur im Geringsten zu liefern. Den Abbau von unsinniger Bürokratie ankündigen. Und dann für den Aufwuchs von unsinniger Bürokratie zu sorgen. Es mag sein, dass die Ute sich blamiert und die Quote ad absurdum geführt hat, um dem Klaus den (später erfolgreichen) Weg zum Staatssekretär zu ebnen. Doch so wie Marco Buschmann mit dem Selbstbestimmungsgesetz die Quote ins Absurde geführt hat, da könnten sich Klaus und Ute noch eine Scheibe von abschneiden.

Anzeige"
"1717598426-10","https://www.tichyseinblick.de/daili-es-sentials/selbstbestimmungsgesetz-bundestag-beschlossen-geschlecht/","Selbstbestimmungsgesetz","Gerichte entscheiden künftig über das Geschlecht von Kindern","FDP, SPD und Grüne haben das Selbstbestimmungsgesetz durch den Bundestag gebracht. Jeder kann nun einmal jährlich sein Geschlecht wechseln. Gerichte regieren damit in Familien hinein und Schutzräume für Frauen sind in Gefahr.","Petra Pau stellt die Regeln für die Debatte zum Selbstbestimmungsgesetz klar. In einer früheren Debatte hat sie für das Gesetz gesprochen, jetzt soll sie die Debatte neutral leiten und ermahnt die Abgeordneten, die Geschlechter der anderen zu achten – also im Sinne des noch zu beschließenden Gesetzes. Eigentlich dürfte Pau nicht mehr Vizepräsidentin des Bundestags sein, weil ihre Partei Die Linke keine Fraktion mehr stellt. Doch die Ampel hat Pau das Amt gnädig gelassen. Jetzt führt sie es im Sinne der Ampel aus. Man kennt sich, man hilft sich.
Dabei wäre die Ermahnung gar nicht nötig gewesen. Zumindest nicht im Fall der größten Oppositionspartei, der Union. Die schickt Mareike Lotte Wulf ans Pult. Die ist in Niedersachsen zweimal als Direktkandidatin angetreten. Zweimal hat der Wähler sie zurückgewiesen. Doch die CDU hat die jeweilige Liste genommen, um Wulf trotzdem noch ins Parlament zu bringen. Manchen Frauen helfen Quoten in der Karriereplanung. Dank des Selbstbestimmungsgesetzes können Männer, die sich als Frauen lesen, diese Plätze nun auch für sich beanspruchen.
Am wichtigsten in der Debatte um das Selbstbestimmungsgesetz ist Mareike Lotte Wulf, dass die Ampel nicht so schlecht über das alte Transsexuellengesetz reden solle. Es sei doch für seine Zeit recht modern gewesen. Dann sagt sie noch, dass das neue Gesetz „möglichem Missbrauch“ nichts entgegensetze. Ohne zu sagen, welchen möglichen Missbrauch sie meint. Aber wirklich wichtig ist Wulf, dass das alte Gesetz gut wegkommt. Die CDU ist eine Oppositionspartei, die sich selbst als Teil der grün-roten Regierung liest.




Selbstbestimmungsgesetz
Frauen wehren sich gegen SPD, Grüne und FDP





Kritischer als Wulf, aber dafür auch polemischer tritt Martin Reichardt (AfD) auf. Er vergleicht die Möglichkeit, sich sein Geschlecht künftig frei wählen zu können, mit einem Kanzler Olaf Scholz (SPD), der sich künftig als Napoleon Bonaparte ausgeben dürfte. Reichardt sagt, das Selbstbestimmungsgesetz wäre „unfreiwillig komisch, wenn es nicht auch so traurig, aber auch gefährlich wäre“. Er sieht darin eine „Infantilisierung des aktuellen Mainstreams“ und wirft Transfrauen vor, sie würden mit ihrem Kostüm nur die „eigenen Stereotypen von Weiblichkeit“ widerspiegeln.
In der Sache sind es Susanne Hierl (CSU) und Sahra Wagenknecht, die die Schwächen des Selbstbestimmungsgesetzes vorführen. Hierl macht ihre Kritik daran fest, dass künftig schon Fünfjährige einen Geschlechtswandel verlangen können. Zwar sieht das Gesetz eine Beratungspflicht vor. Doch Hierl weist darauf hin, dass diese Beratung von jedem kommen könne. Zum Beispiel auch von einer „queeren“ Interessengruppe.
Tatsächlich hat es der Paragraph drei des Gesetzes in sich. Lehnen Eltern einen Geschlechtswandel eines Kindes zwischen 14 und 18 Jahren ab, sind Standesämter verpflichtet, das dem jeweiligen Familiengericht zu melden. Vor diesem Gericht müssen die Eltern dann nachweisen, dass der Geschlechtswandel nicht dem „Kindeswohl“ widerspricht. Justizminister Marco Buschmann (FDP) hat also eine Beweislastumkehr durch den Bundestag gebracht. Eltern müssen vor Gericht nun nachweisen, dass ihre Entscheidungen für ihre minderjährigen Kinder richtig sind.
Noch weiter geht die Regelung für Kinder zwischen fünf und 14 Jahren. „Bei der Ablehnung eines Wunsches nach Änderung des Geschlechtseintrags und der Vornamen müssen das Kindeswohl und der Entwicklungsstand des Kindes im Zentrum stehen“, heißt es im Gesetz. Widersprechen Eltern dem Wunsch ihres Kindes nach einem Geschlechtswandel, wenn das noch nicht einmal 14 Jahre alt ist, werden sie zum Fall fürs Gericht: „Das Familiengericht kann jederzeit von Amts wegen oder auf Anregung der Beteiligten (des Minderjährigen, der Eltern) wie auch Dritter (dem Jugendamt, Beratungsstellen, Vertrauenspersonen) tätig werden.“ Also eröffnen FDP, SPD und Grünen queeren Interessengruppen, Kinder zu ermutigen, ihre Eltern vor Gericht zu bringen. Und nicht nur das: Widersetzen sich Eltern dem Geschlechtswandel eines achtjährigen Kindes, kann das Gericht einen „Ergänzungspfleger“ für die Familien bestellen.




Selbstbestimmungsgesetz
SPD, Grüne und FDP öffnen Männern Schutzräume für Frauen – und regieren in Familien hinein





Sahra Wagenknecht kritisiert, dass das „Geschlecht von einer biologischen Tatsache zu einer Frage der Gemütsverfassung“ werde. Sie berichtet aus Spanien, wo gewalttätige Ehemänner Transgesetze genutzt haben, um sich Zugang zu den Frauenhäusern zu verschaffen, in denen ihre misshandelten Frauen lebten.
Wagenknecht wirft der Ampel vor, solche Übergriffe zu ermöglichen – und das auf der Grundlage einer Ideologie, an die sie selber nicht glaube. Denn im Kriegsfall gibt es plötzlich keine verletzten Gefühle mehr. Nennt ein privater Bürger eine Claudia Klaus, muss er dank Ampel dafür bis zu 10.000 Euro Strafe zahlen. Nennt Verteidigungsminister Boris Pistorius (SPD) im Kriegsfall eine Claudia Klaus, heißt er auch Klaus und muss zur Waffe greifen und das Vaterland verteidigen.
Der Bundestag hat das Selbstbestimmungsgesetz mit 374 gegen 251 Stimmen nach der dritten Lesung angenommen. In der zweiten Lesung stimmten noch zwei Abgeordnete der FDP dagegen. Allerdings hat keiner der liberalen Abgeordneten den „German Mut“ gehabt, diese Position auch am Mikrofon des Bundestages zu vertreten.
 
Anzeige"
