web-scraper-order,web-scraper-start-url,text1,text2,text3,text4,text5,text6
"1717585865-9","https://www.faz.net/aktuell/politik/ausland/premier-gabriel-attal-unter-druck-bauernprotest-in-frankreich-19482406.html","Pariser Blockaden :","Die Machtprobe der französischen Bauern","Premierminister Gabriel Attal muss seine erste Regierungserklärung mitten in einer Krise halten. Der Unmut der Bauern in Frankreich wird vom Rassemblement National unterstützt – und den Protesten in Deutschland inspiriert.","[{""text4"":""In der Auseinandersetzung mit den Landwirten wächst der Druck auf den französischen Premierminister Gabriel Attal, einen gesichtswahrenden Ausweg zu finden. Mit einem Großaufgebot von 15.000 Polizisten hat die Regierung am Montag versucht, die von den Agrarverbänden angekündigte Blockade abzuwenden. Acht Autobahnen Richtung Paris wurden am Montag von Traktoren blockiert. Die beiden großen Bauernverbände hatten zur „Belagerung der Hauptstadt“ aufgerufen.""},{""text4"":""„Wir bleiben in gewisser Entfernung, wir wollen keine Gewalt“, sagte der Vorsitzende des größten Bauernverbands FNSEA, Arnaud Rousseau, im Radiosender RTL. „Wir werden Paris aushungern“, kündigte einer der Blockierer auf der A11, der Landwirt Benoit Durand, im TV-Sender BFM an. Die Zugangsstraßen zum Pariser Großmarkt Rungis wurden von Panzerfahrzeugen der Gendarmerie überwacht.""},{""text4"":""Im ganzen Land wurden insgesamt 25 Autobahnblockaden gezählt. Der Generalsekretär der Polizeigewerkschaft Unité SGP, Jean-Christophe Couvy, forderte die Regierung auf, „den sozialen Feuerlöscher rauszuholen“. In fünf Monaten seien die Olympischen Spiele in Paris, die Beamten müssten sich schonen und dürften nicht bereits in einem Kräftemessen mit den Landwirten aufgerieben werden.""},{""text4"":""Für den 34 Jahre alten Regierungschef Attal kommt die von den deutschen Protesten inspirierte Bauernerhebung besonders ungelegen. Er wollte an diesem Dienstag in seiner allgemeinen Regierungserklärung in der Nationalversammlung ein Signal zu einem neuen Aufbruch senden. Stattdessen droht seiner Regierung nun ein neuer sozialer Flächenbrand. Am Montag schlossen sich spontan die Taxifahrerverbände den Aktionen der Landwirte an und blockierten die A13, die Hauptverbindung von der Normandie nach Paris. Auch in Bordeaux und Toulouse kam es zu Protestaktionen. Die Taxifahrer begehren gegen die Kürzungen bei der Erstattung der Krankentransporte auf, die zur Sanierung der staatlichen Krankenversicherung beschlossen wurden.""},{""text4"":""Präsident Emmanuel Macron hält sich bewusst zurück. Im Élysée-Palast wird der soziale Konflikt als erste Bewährungsprobe für den jungen Premier angesehen. Der Präsident bricht am Montagabend zu seinem geplanten Staatsbesuch nach Schweden auf. Bei der vorgezogenen Regierungskabinettsitzung am Montagnachmittag soll die Stimmung angespannt gewesen sein. Die komplette Kabinettsliste ist noch nicht veröffentlicht. Viele wichtige Ressorts, darunter das für Europa und das für Energie, sind bislang unbesetzt. Es hieß, aufgrund der Proteste könnte sich die Postenvergabe weiter hinauszögern.""},{""text4"":""Die Regierung will den Bauern entgegenkommen und auf eine Lockerung der EU-Umweltauflagen dringen. In den kommenden 48 Stunden werde die Regierung Vorschläge zur Unterstützung der Landwirte auf den Tisch legen, sagte Landwirtschaftsminister Marc Fesneau im Fernsehsender France 2. Frankreich wolle in Brüssel durchsetzen, dass die neuen Biodiversitätsregeln abgeschwächt und weniger Agrarflächen brach gelegt werden müssten. Viele Bauern beklagen, dass die Pflichtbrachen ihren Betrieb erheblich beeinträchtigen würden.""},{""text4"":""Sie protestieren aber auch gegen Bürokratie und sinkende Einnahmen. „So lange unsere Forderungen nicht erfüllt sind, bleiben wir voll mobilisiert“, sagte Rousseau vom Bauernverband FNSEA. Der Verband hat insgesamt 122 Forderungen an die Regierung aufgestellt. Premierminister Attal hatte am Freitag bereits den Verzicht auf eine geplante Steuererhöhung für Agrardiesel und höhere Entschädigungen bei bestimmten Rinderkrankheiten zugesagt. Außerdem sagte er Nothilfen über 100 Millionen Euro für von Unwettern getroffene Landwirte und für Biobetriebe zu. Auch den unter Überproduktion leidenden Weinbauern versprach Attal Hilfen.""},{""text4"":""Mehrere Umweltorganisationen solidarisierten sich mit den Bauernprotesten. „Es ist sehr gut möglich, sich zugleich für die Umwelt und eine zukunftsfähige Landwirtschaft einzusetzen“, heißt es in einem Aufruf, der von Greenpeace und der Klimaschutzgruppe „Extinction Rebellion“ unterzeichnet wurde.""},{""text4"":""Politische Unterstützung erhalten die Landwirtsverbände zudem vom Rassemblement National. Marine Le Pen ließ sich bei der Fahrt auf einem roten Traktor filmen und bezichtigte die EU, die Misere der Landwirte heraufbeschworen zu haben. Ein großes Thema des französischen Bauernprotests ist der aus ihrer Sicht unlautere Wettbewerb der Ukraine. Seit Sommer 2022 werden keine Zölle mehr auf landwirtschaftliche Einfuhren aus der Ukraine erhoben. „Wir werden kontrolliert und müssen strikte Normen einhalten. Aber für die ukrainischen Erzeugnisse gelten die Normen nicht“, kritisierte auch der FNSEA-Vorsitzende Rousseau. Besonders betroffen von der „illoyalen Konkurrenz“ seien Zucker- und Weizenproduzenten sowie Hühnerzüchter.""},{""text4"":""Der RN-Spitzenkandidat für die Europawahl, Jordan Bardella, versucht, den Unmut für den Wahlkampf zu instrumentalisieren. Die Landwirte hätten im Juni die Gelegenheit, „Nein“ zu dem Agrarwahnsinn der EU zu sagen. „Unser Agrarmodell ist bedroht. Wir können es retten“, sagte er am Montag im TV-Sender BFM. Bardella forderte, dass in den französischen Schulkantinen nur noch Fleisch französischer Landwirte serviert werde. Es dürften keine Agrarprodukte mehr importiert werden, die nicht den strengen französischen Auflagen entsprechen würden, so der Spitzenkandidat.""}]","[{""text5"":""Taxifahrerverbände schließen sich den Landwirten an""},{""text5"":""Marine Le Pen fährt auf einem Traktor mit""}]","[]"
"1717585868-10","https://www.faz.net/aktuell/wirtschaft/mehr-wirtschaft/braende-bei-bauernprotesten-in-bruessel-eu-parlament-teils-abgeriegelt-19489146.html","EU-Parlament teils abgeriegelt :","Brennende Barrikaden bei Bauernprotesten in Brüssel","Am Rande des EU-Gipfels in Brüssel haben Landwirte zum Teil gewaltsam gegen Umweltauflagen und ein Handelsabkommen protestiert. Die Polizei riegelt das Parlamentsgebäude teils ab.","[{""text4"":""Parallel zum Ukraine-Sondergipfel der EU-Staats- und Regierungschefs haben Bauern Teile Brüssels blockiert. Etwa 1300 Traktoren seien in die belgischen Hauptstadt gerollt, teilte die Polizei am Donnerstag mit. Wegen der weiträumigen Absperrungen um das Gipfelgebäude konzentrierten sich die Proteste rund um das EU-Parlament. Demonstrierende Landwirte entzündeten dort Rauchbomben und legten Feuer mit Paletten. Einige wenige warfen Eier auf das Gebäude.""},{""text4"":""Vor den Gebäuden wurden Gegenstände in Brand gesetzt, die Polizei schützte den Haupteingang mit Stacheldraht und Einheiten in Schutzmontur, wie am Donnerstag auf Fotos zu sehen war. In einigen Fällen sei es zu Auseinandersetzungen gekommen, wobei Gegenstände geworfen und Tränengas eingesetzt worden sei.""},{""text4"":""Wegen der Proteste vor dem Parlament wurden Mitarbeiter von der Verwaltung zur Vorsicht gebeten. „Es wird dringend empfohlen, sich den Demonstrationen nicht zu nähern und keine Fotos zu machen.“ Einige Eingänge seien geschlossen worden, damit Demonstranten nicht in das Gebäude eindringen könnten. EU-Parlamentspräsidentin Roberta Metsola sagte: „Wir sollten uns nicht darauf konzentrieren, denjenigen, die protestieren, die Schuld zu geben, sondern vielmehr sagen, dass wir Ihnen zuhören.“ Als Parlament sei man der Meinung, dass die Stimme von niemandem ignoriert werden sollte.""},{""text4"":""Die Landwirte fordern weniger Bürokratie und höhere Subventionen. „Stopp Mercosur“ war zudem auf einem der Plakate zu lesen, eine Anspielung auf das geplante Freihandelsabkommen mit Südamerika. Die meisten Teilnehmer der Protestaktion kamen nach Polizeiangaben aus Belgien, aber auch aus Frankreich und Deutschland wurden Bauern erwartet.""},{""text4"":""Angesichts massiver Bauernproteste signalisieren Regierungen und EU-Kommission Kompromissbereitschaft. Etliche EU-Regierungschefs äußerten am Donnerstag vor Beginn des EU-Gipfels Verständnis für die Kundgebungen. Irlands Regierung kündigte Widerstand gegen das EU-Mercosur-Handelsabkommen an. Bauernverbände fürchten Preisdruck durch erleichterte Agrarimporte aus Lateinamerika. Die EU-Kommission hatte bereits in den vergangenen Tagen Ausnahmen bei Umweltauflagen für Landwirte angekündigt und will Konkurrenz durch ukrainischen Getreideimporte verringern.""},{""text4"":""Etliche EU-Staats- und Regierungschefs hatten am Mittwochabend das Agrarthema diskutiert, Ungarns Ministerpräsident Viktor Orban traf sich auch mit Bauern. Landwirte in mehreren Ländern protestieren seit Wochen gegen Sprit- und Düngerpreise, Auflagen im Umweltschutz und außereuropäische Konkurrenz. Führende Politiker treibt die Sorge um, dass die Proteste rechtsnationalistische Parteien Wähler bei der Europawahl Anfang Juni zutreiben könnten.""},{""text4"":""Belgiens Ministerpräsiden Alexander de Croo begrüßte, dass die EU-Kommission die Ausnahmen von Auflagen verlängert hat. Dabei geht es um stillgelegte Ackerflächen für den Umweltschutz. „Besser wäre, das nicht nur für ein Jahr zu verlängern“, sagte er. Irlands Ministerpräsident Leo Varadkar forderte, dass die EU solle in den kommenden Jahren darauf verzichten, neue Auflagen zu erlassen. Die Bundesregierung hatte eine Entbürokratisierung versprochen und will bis Sommer entscheiden, wie sie Landwirte entlasten kann.""},{""text4"":""Besonders polnische und osteuropäische Bauern hatten in den vergangenen Monaten gegen Agrarimporte aus der Ukraine demonstriert. Sie sehen ihr Geschäft gefährdet, weil Einfuhrzölle auf Lieferungen aus der Ukraine wegen des Krieges ausgesetzt wurden. Die EU ist in einem Zielkonflikt, weil sie eigentlich die durch den Krieg angeschlagene ukrainische Wirtschaft stabilisieren will. Als Zugeständnis an die EU-Bauern schlug die EU-Kommission vor, Agrarimporte aus der Ukraine zu begrenzen.""},{""text4"":""Die Importzölle sollen demnach zwar um ein weiteres Jahr bis Juni 2025 ausgesetzt bleiben. Allerdings könnten auf Produkte wie Geflügel, Eier und Zucker Zölle erhoben werden, wenn davon mehr in die EU importiert werden sollte, als im Schnitt der Jahre 2022 und 2023.""},{""text4"":""Irland schloss sich dem französischen Widerstand gegen die Ratifizierung des Handelsabkommens der EU mit den südamerikanischen Mercosur-Staaten an. „Mercosur kann in der jetzigen Form nicht ratifiziert werden“, sagte Varadkar. Es sei nicht fair, Agrarimporte aus Ländern zu akzeptieren, die nicht dieselben Umweltauflagen hätten wie die EU. Deshalb seien rechtlich verbindliche Zusagen der Mercosur-Staaten zum Schutz der Umwelt erforderlich.""}]","[{""text5"":""Verständnis und Kompromissbereitschaft""},{""text5"":""Ukrainische Agrarimporte stoßen auf Widerstand""}]","[]"
"1717585871-11","https://www.faz.net/aktuell/wirtschaft/berlin-als-hoehepunkt-der-bauernproteste-das-treibt-die-landwirte-an-19448827.html","Bauernproteste in Berlin :","Diese Streitpunkte treiben die Landwirte in die Hauptstadt","Tausende Traktoren rollen nach Berlin. Die Wut der Landwirte entzündet sich an geplanten Rücknahmen von Steuervergünstigungen. Was bewegt sie noch und wie positioniert sich die Regierung?","[{""text4"":""Es ist der vorläufige Höhepunkt der Bauernproteste. An diesem Montag werden Tausende Teilnehmer mit vielen Traktoren zu einer Großdemonstration in Berlin erwartet. Unter Landwirten gibt es mächtig Ärger, weil die Bundesregierung Diesel-Vergünstigungen schrittweise streichen will. Die Ampel-Koalition will bisher im Falle des Agrardiesels hart bleiben – macht aber deutlich, sie wolle die Bauern beim Strukturwandel stärker unterstützen, zum Beispiel beim Umbau der Tierhaltung.""},{""text4"":""Mit Trecker-Korsos machten Landwirte in den vergangenen Tagen quer durch die Republik Front gegen schon abgeschwächte Einsparpläne der Bundesregierung für den Haushalt 2024. Konkret soll die seit mehr als 70 Jahren bestehende Agrardiesel-Begünstigung wegfallen. Noch können sich Betriebe die Energiesteuer teilweise zurückerstatten lassen – mit einer Vergütung von 21,48 Cent pro Liter. Ursprünglich sollte die Hilfe sofort ganz wegfallen. Nun soll sie über drei Jahre auslaufen. Eine zunächst geplante Streichung auch der Kfz-Steuerbefreiung für Landwirtschaftsfahrzeuge hat die Regierung ganz fallen gelassen.""},{""text4"":""Der Bauernverband hält die Korrekturen für unzureichend und fordert eine komplette Rücknahme der Mehrbelastungen. „Ein fauler Kompromiss, wie er derzeit auf dem Tisch liegt, kann keine Lösung sein – denn der wird keinen Traktor von der Straße holen“, hatte Bauernpräsident Joachim Rukwied deutlich gemacht. Der Verband setze darauf, dass die Fraktionsvorsitzenden der Ampel bei einem Gespräch mit Bauernverbänden eine Lösung zum Agrardiesel vorlegen. Rukwied sagte: „Um keine Missverständnisse aufkommen zu lassen: Beim Gespräch am Montag kann es zunächst nur um den Agrardiesel gehen.“""},{""text4"":""Kanzler Olaf Scholz (SPD) und mehrere andere Ampel-Politiker haben angesichts des Proteststurms schon Verständnis und Dialogbereitschaft signalisiert. Konkrete weitere Zugeständnisse beim Agrardiesel waren vorerst aber nicht in Sicht. Agrarminister Cem Özdemir (Grüne) dringt darauf, der Branche gerade jetzt neue Chancen und Planungssicherheit zu eröffnen – etwa mit einer dauerhaft gesicherten Finanzierung für den Umbau der Tierhaltung hin zu besseren Bedingungen über eine Tierwohlabgabe.""},{""text4"":""Die FDP signalisierte nun Bereitschaft für eine Tierwohlabgabe, die auch auf Verbraucher umgelegt werden könnte. Die stellvertretende FDP-Fraktionschefin Carina Konrad sagte der „Süddeutschen Zeitung“, eine Tierwohlabgabe könnte ein Weg sein, die Landwirte beim Umbau ihrer Ställe verlässlich zu unterstützen.""},{""text4"":""Bei der Demo am Montag redet auch Finanzminister Christian Lindner (FDP). Er dämpfte vorab Erwartungen, dass auf die Subventionsstreichungen komplett verzichtet werde. Lindner sagte am Sonntag, er werde bei der Kundgebung „nicht versprechen können, dass alle Bereiche der Gesellschaft Konsolidierungsbeiträge leisten müssen – nur einer nicht“. Die Bundesregierung muss wegen eines Urteils des Bundesverfassungsgerichts Milliardenlöcher im Bundeshaushalt stopfen.""},{""text4"":""Ins Zentrum rücken könnte eine Tierwohlabgabe. Lindner hatte weniger Regulierung und Bürokratie ins Spiel gebracht. Der SPD-Parteivorsitzende Lars Klingbeil sagte am Sonntag in der ARD, in den Mittelpunkt müsse die Frage gestellt werden, wie es gelingen könne, dass es in Deutschland eine starke Landwirtschaft gebe. „Ich finde, das muss dann auch mehr sein als die Frage Agrar-Diesel. Da geht es um die Marktmacht der Discounter. Da geht es beispielsweise auch um die Frage, wie wahnsinnig viel Bürokratie da im Bereich der Landwirtschaft vorhanden ist, wie die abgebaut werden kann.“""},{""text4"":""Was das aber konkret bedeuten könnte, ist unklar. Bei Bauernvertretern hieß es, die Hiobsbotschaft aus Berlin zum Agrardiesel habe das Fass zum Überlaufen gebracht. Denn auf vielen Höfen, die sich nach schwierigen Zeiten zuletzt stabilisieren konnten, hat sich seit Jahren einiger Frust aufgestaut. Schon Ende 2019 richteten sich breite Traktoren-Proteste gegen neue Umweltvorgaben und Düngeregeln – bei gleichzeitig vielen Billigpreisen im Supermarkt. Bauern forderten mehr Mitsprache und Wertschätzung für ihre Arbeit. Der Marktdruck der großen Supermarktketten ist generell hoch, auch wenn Bauern zuletzt von höheren Preisen profitieren konnten. Dazu kommen Anforderungen von Politik und Verbrauchern, nachhaltiger zu produzieren.""},{""text4"":""Auch um Risiken abzufedern, gehören europäische und nationale Subventionen zur Kalkulation der Betriebe. Zuschüsse und Zahlungen haben im Schnitt einen Anteil von 45 Prozent am Einkommen, wie es im Agrarpolitischen Bericht 2023 der Bundesregierung nach Daten für 2021/22 heißt – bei den großen Betrieben in den ostdeutschen Ländern fast 50 Prozent. Der Großteil davon entfällt auf Direktzahlungen aus der EU-Agrarfinanzierung, die auch an Umweltauflagen gekoppelt sind. Dabei sollen die Milliarden aus Brüssel die Nahrungsversorgung und den Erhalt der Landschaften und ländlichen Räume insgesamt sichern.""},{""text4"":""Die Pläne sind nun im parlamentarischen Verfahren. Dabei geht es um ein Gesetz, das Kürzungen im Etat 2024 umsetzen soll. Ende Januar soll der Bundestag über den Haushalt und auch über das Gesetz zum Agrardiesel abstimmen. Änderungen sind also prinzipiell noch möglich. Der Bundesrat könnte sich am 2. Februar damit befassen. Dabei ist das Haushaltsfinanzierungsgesetz nicht zustimmungsbedürftig, die Länder könnten es aber in den gemeinsamen Vermittlungsausschuss mit dem Bundestag schicken. Mehrere Ministerpräsidenten auch der SPD hatten den Bund aufgefordert, die Agrardiesel-Regelung nicht zu streichen.""}]","[{""text5"":""Worum dreht sich der Streit?""},{""text5"":""Was fordern die Bauern?""},{""text5"":""Wie ist die Position der Regierung?""},{""text5"":""Was könnten andere Lösungen für die Landwirtschaft sein?""},{""text5"":""Welche Subventionen gibt es für Landwirte?""},{""text5"":""Wie geht es beim Agrardiesel weiter?""}]","[]"
"1717585874-12","https://www.faz.net/aktuell/wirtschaft/gewalt-bei-bauernprotesten-in-bruessel-19490119.html","Bauernstreik :","Bauern protestieren mit Gewalt in Brüssel","Am Rande eines EU-Sondergipfels in Brüssel haben Landwirte teils gewaltsam gegen Umweltauflagen und ein Handelsabkommen protestiert.","[{""text4"":""Am Rande eines EU-Sondergipfels in Brüssel haben Landwirte teils gewaltsam gegen Umweltauflagen und ein Handelsabkommen protestiert. Wegen Aktionen um das Europaparlament war die Institution teilweise abgeriegelt worden. Mitarbeitende von der Verwaltung wurden zur Vorsicht gebeten. Vor den Gebäuden wurden Gegenstände in Brand gesetzt, die Polizei schützte den Haupteingang mit Stacheldraht und Einheiten in Schutzmontur, wie am Donnerstag auf Fotos zu sehen war. Der Tagungsort der Staats- und Regierungschefs war weiträumig von der Polizei abgeschirmt worden.""},{""text4"":""Derzeit protestieren Bauern in mehreren EU-Staaten. Unter anderem sehen sie sich durch Umweltauflagen der Europäischen Union unverhältnismäßig stark eingeschränkt. Auch das Handelsabkommen Mercosur steht in der Kritik. Die EU stellt Landwirten jedes Jahr Dutzende Milliarden Euro an Subventionen zur Verfügung. Damit diese ausgezahlt werden, müssen sie sich auch an gewisse Vorgaben halten.""},{""text4"":""An den Protesten in Brüssel beteiligten sich am Donnerstag Landwirte mit rund 1300 Traktoren, wie die Polizei mitteilte. In einigen Fällen sei es zu Auseinandersetzungen gekommen, wobei Gegenstände geworfen und Tränengas eingesetzt worden sei. Auf einem Video, das die Proteste zeigen soll, ist zu sehen, wie ein Brandsatz in Richtung Polizisten geschmissen wird. Eine Bestätigung der Polizei, ob das Video authentisch ist, gab es zunächst nicht. Angesichts massiver Bauernproteste signalisieren Regierungen und EU-Kommission Kompromissbereitschaft. In Frankreich kommt die Regierung den protestierenden Landwirten weiter entgegen. Premierminister Gabriel Attal kündigte am Donnerstag unter anderem 150 Millionen Euro an „steuerlicher und sozialer Hilfe“ für Viehzüchter an.""},{""text4"":""Zudem sollen Verpflichtungen wie die geplante Verringerung des Chemikalieneinsatzes gelockert werden. Auch will man den Import von Obst und Gemüse verhindern, die mit dem in Europa verbotenen Insektizid behandelt wurden. Auf einer gemeinsamen Pressekonferenz mit Finanz- und Wirtschaftsminister Bruno Le Maire, Landwirtschaftsminister Marc Fesneau und Umweltminister Christophe Béchu bekräftigte Attal zudem seine Ablehnung des Freihandelsabkommens zwischen der EU und den südamerikanischen Mercosur-Staaten.""},{""text4"":""„Wir ergreifen Maßnahmen, die es ermöglichen, die wirtschaftlichen Aktivitäten und das Leben in vielen Landesteilen aufrechtzuerhalten“, sagte Attal. Er ist seit Beginn der Proteste bemüht, auf die Bauern zuzugehen. Nach wie vor blockieren sie in ganz Frankreich Autobahnen. Unter anderem den Verzicht auf eine geplante Steuererhöhung für Agrardiesel hatte der Premierminister schon am vergangenen Freitag zugesagt. Wie Attal am Donnerstag weiter sagte, werde man außerdem das Ziel der „Ernährungssouveränität“ gesetzlich festschreiben und gemeinsam mit den Landwirten die zugehörigen Indikatoren definieren. Finanz- und Wirtschaftsminister Le Maire kündigte zudem an, „alle großen Handelsketten in den nächsten Tagen“ darauf zu kontrollieren, ob sie Bauern so fair entlohnen, wie es ein 2018 verabschiedetes Gesetz vorsieht.""},{""text4"":""Die beiden größten französischen Bauernverbände kündigten daraufhin an, die Blockaden auszusetzen. Voraussetzung sei allerdings, dass die Regierung ihre Ankündigungen schriftlich fixiere. Sollten die Versprechen bis Juni nicht umgesetzt werden, werde man zudem „nicht zögern, eine Bewegung von allgemeiner Tragweite wieder in Gang zu setzen“, kündigte der Präsident der Junglandwirte, Arnaud Gaillot, an.""},{""text4"":""Etliche EU-Regierungschefs äußerten am Donnerstag vor Beginn des EU-Gipfels Verständnis für die Kundgebungen. Irlands Regierung kündigte Widerstand gegen das EU-Mercosur-Handelsabkommen an. Bauernverbände fürchten Preisdruck durch erleichterte Agrarimporte aus Lateinamerika. Die EU-Kommission hatte schon in den vergangenen Tagen Ausnahmen bei den Umweltauflagen für Landwirte angekündigt und will die Konkurrenz durch Getreideimporte aus der Ukraine verringern. Die Bundesregierung hatte eine Entbürokratisierung versprochen und will bis zum Sommer entscheiden, wie sie die Landwirte entlasten kann.""}]","[{""text5"":""Verringerung des Chemikalieneinsatzes soll gelockert werden""},{""text5"":""Bundesregierung verspricht Entbürokratisierung""}]","[]"
"1717585876-13","https://www.faz.net/podcasts/f-a-z-podcast-fruehdenker/bauernproteste-enden-mit-grossdemonstration-in-berlin-faz-fruehdenker-19448495.html","F.A.Z.-Frühdenker :","Finale der Proteste: Legen die Bauern Berlin lahm?","Die Aktionswoche der Bauern geht mit einer Großdemonstration in Berlin zu Ende, bei klirrender Kälte starten in Iowa die Vorwahlen im US-Wahlkampf und in Davos beginnt das Weltwirtschaftsforum.","[{""text4"":""Politik: AfD-Geheimtreffen: Die Konzepte „wohltemperierter Grausamkeit“""},{""text4"":""Wirtschaft: Heidelberger Erklärung: CDU plant Abkehr vom Bürgergeld""},{""text4"":""Finanzen: Wahl der Krankenkasse: Teurer Wechsel in die gesetzliche Krankenversicherung""},{""text4"":""Feuilleton: Institut für Sozialforschung: Abschied mit Ansage""},{""text4"":""Sport: Deutsche Handballer erreichen vorzeitig die Hauptrunde""}]","[{""text5"":""1. Die Bauernproteste erreichen ihren Höhepunkt""},{""text5"":""2. Eiskalter Start ins US-Wahljahr""},{""text5"":""3. Krisengipfel im Winterwunderland""},{""text5"":""4. Keine Hoffnung auf Rückkehr in den Norden Gazas""},{""text5"":""5. Welcher Begriff wird „Unwort des Jahres“?""},{""text5"":""Empfehlungen der Redaktion""},{""text5"":""6. Wer wird FIFA-Weltfußballer?""},{""text5"":""7. Das wird diese Woche wichtig""}]","[{""text6"":""Am Montag kommen die Bauernproteste mit einer Großdemonstration in Berlin zu einem Abschluss.""},{""text6"":""Vorwahlkampf bei frostigen Temperaturen: Trump-Anhänger stehen für eine Veranstaltung mit Donald Trump in Iowa an.""},{""text6"":""Fünf Tage lang beraten Spitzenvertreter aus Politik, Wirtschaft und Gesellschaft in davos über Krisen, Kriege und Herausfordeungen.""},{""text6"":""Flüchtlinge suchen in Khan Yunis im Süden Gazas Schutz vor Regen (Archivfoto)""},{""text6"":""710 Begriffe stehen dieses Mal zur Auswahl für das „Unwort des Jahres“ 2023.""},{""text6"":""Konnten die Übergabe schon ein paar Mal üben: FIFA-Präsident Gianni Infantino und Lionbel Messi bei der Weltfußballer-Gala im Februar 2022 in Paris.""},{""text6"":""Vom Vereins- zum Parteivorsitzenden? Hans-Georg Maaßen will die Werteunion zur Partei machen.""}]"
