web-scraper-order,web-scraper-start-url,text1,text2,text3,text4,text5,text6
"1717585897-21","https://www.faz.net/aktuell/wirtschaft/klima-nachhaltigkeit/eu-gibt-bauernprotesten-nach-bauern-koennen-gesamtes-ackerland-nutzen-19487407.html","Agrarpolitik und Ukraine :","Brüssel gibt Bauernprotesten nach","Die Bauern können auch in diesem Jahr ihr gesamtes Ackerland nutzen. Die EU-Regeln zur Flächenstilllegung bleiben ausgesetzt. Paris hat sich durchgesetzt.","[{""text4"":""Eine Überraschung war die Ankündigung der EU-Kommission zumindest für die französischen Landwirte nicht mehr. Premierminister Gabriel Attal hatte die massiven Bauernproteste schon am Dienstag mit der Ankündigung zu beruhigen versucht, dass die EU ihnen auch in diesem Jahr erlauben werde, ihr ganzes Ackerland zu nutzen. Eigentlich schreibt die EU vor, dass Landwirte im Gegenzug für ihre Subventionen 4 Prozent der Fläche brach liegen lassen müssen. Das soll dem Umweltschutz dienen.""},{""text4"":""Tags darauf lieferte die Kommission: Die 2023 erlassene Ausnahmeregelung für die Flächenstilllegung wird ein Jahr verlängert. Voraussetzung ist, dass die Bauern auf 7 Prozent ihres Ackerlands stickstoffbindende Pflanzen wie Linsen oder Erbsen anbauen oder Zwischenfrüchte pflanzen, die als Futter für Tier oder Gründünger genutzt werden können. Gelten soll das rückwirkend zum 1. Januar. Die Staaten müssen die Ausnahme von der Flächenstilllegung in Brüssel beantragen.""},{""text4"":""Die Kommission folgt damit einem Vorschlag der französischen Regierung. Auch andere EU-Staaten hatten auf eine Verlängerung der Ausnahme gedrungen. Die Kommission hatte darauf aber lange zurückhaltend regiert. Grund war, dass sich die Lage auf den internationalen Agrarmärkten entspannt hat, mit der die Kommission nach dem russischen Angriff auf die Ukraine die Ausnahme für 2023 begründet hatte. Die Bauernproteste in Deutschland, Belgien und Frankreich haben sie nun offenkundig zum Einlenken bewegt.""},{""text4"":""Kommissionsvizepräsident Maros Šefcovic gestand ein, dass es bisher keine Analyse der Folgen der Ausnahme von der Flächenstilllegung für Landwirte und Umwelt gebe. Die Kommission reagiere mit ihrem Vorschlag auf eine ganze Serie von Ereignissen, unter denen die Bauern litten, von Extremwetter über hohe Energiepreise bis zum Preisverfall beim Getreide. Letzteres ist pikant, da die Kommission die Ausnahmeregelung für 2023 allen voran mit den hohen Getreidepreisen begründet hatte.""},{""text4"":""Um ein Jahr verlängern will die EU-Kommission auch die Zollbefreiung der Einfuhr aus der Ukraine und Moldau bis zum Sommer des kommenden Jahres. Auch dabei nimmt sie Rücksicht auf den Widerstand von Landwirten, vor allem in den Ukraine-Anrainerstaaten, gegen einen Anstieg der Einfuhr von Agrarprodukten in die EU. Es gebe zwar keinen Beleg dafür, dass die Zollbefreiung negative Auswirkungen auf den Agrarmarkt der EU gehabt habe, teilte die EU-Behörde mit. Das könne auf lokaler Ebene aber anders sein. Deshalb soll die Einfuhr nun schon auf Basis von Marktverwerfungen in einem einzigen EU-Staat beschränkt werden können. Zudem werden die Importe von Geflügel, Eiern und Zucker auf dem Niveau von 2022/2023 eingefroren. Die Kommission forderte Ungarn, Polen und die Slowakei abermals auf, nun ihre nationalen Einfuhrbeschränkungen aufzuheben.""}]","[]","[]"
"1717585900-22","https://www.faz.net/aktuell/rhein-main/was-die-europaeische-agrarpolitik-mit-den-bauernprotesten-zu-tun-hat-19461369.html","Agrarpolitik und Bauernproteste :","„Zum Dieseltraktor gibt es keine Alternative“","Der hessische Grünen-Politiker Martin Häusling ist selbst Biobauer. Er kann die Proteste der Landwirte verstehen und fordert mehr finanzielle Hilfen von der EU.","[{""text4"":""Martin Häusling hätte die Bundesregierung warnen können. Dass die Ampelkoalition massive Proteste heraufbeschwor, indem sie ankündigte, den Landwirten Begünstigungen wie den Agrardiesel und die Kfz-Steuerbefreiung für Landwirtschaftsfahrzeuge einfach zu streichen, hat ihn zumindest nicht überrascht. „Die Stimmung bei den Bauern ist schlecht“, sagt der 62 Jahre alte Politiker, der seit 2009 agrarpolitischer Sprecher der Grünen-Fraktion im Europäischen Parlament und selbst Landwirt, Biobauer, im nordhessischen Bad Zwesten-Oberurff ist. In der Landwirtschaft herrsche große Unzufriedenheit, und zwar nicht erst seit zweieinhalb Jahren, seit die Grünen Teil der Koalition in Berlin sind. Dass seine Partei derzeit für alles Schlechte verantwortlich gemacht werde, hält Häusling nicht nur für unfair, „da werden auch Grenzen überschritten“.""},{""text4"":""Die immer noch geplante Streichung der Subventionen für Agrardiesel, wenn auch inzwischen auf mehrere Schritte verteilt, sei lediglich der viel zitierte Tropfen, der das Fass zum Überlaufen gebracht habe. Die Ursachen für den Frust lägen tiefer. Und mit denen müsse sich auch die Politik in Berlin beschäftigen. „Zum Fahren mit dem Dieseltraktor gibt es für die Bauern doch keine Alternative“, sagt Häusling. „Es gibt noch keine E-Schlepper.“ Die auf den Markt zu bringen, darüber müsse dann erst einmal nachgedacht werden, „statt nachts um drei Uhr in Berlin die Idee zu entwickeln, beim Agrardiesel zu kürzen“.""},{""text4"":""Für den Grünen-Politiker sind die Berliner Kürzungspläne für den Haushalt 2024 mit Blick auf die Landwirte schlichtweg „Fehlentscheidungen“, die er vor allem der FDP zuschreibt. Die lege sich quer, wolle an den Kürzungen festhalten, statt den im Ampelkoalitionsvertrag vereinbarten Umbau hin zu mehr Biohöfen und zur Honorierung von Bauern, die Umweltauflagen einhielten, zu unterstützen. Das vielfach vorgetragene Argument, „die Landwirte“ hätten in den vergangenen beiden Jahren Rekordgewinne erzielt, lässt Häusling nicht gelten. Einige hätten profitiert, andere nicht. Landwirtschaft sei von den Erträgen her sehr schwankend: „Das ist kein Handwerk“, sagt Häusling.""},{""text4"":""Wenn die öffentlichen Proteste der Landwirte nun am Ende dazu führten, dass die Politik mit ihnen ins Gespräch komme, sei viel erreicht, meint Häusling. „Ich mache mir insgesamt Sorgen, dass die Landwirtschaft nicht ernst genommen wird.“ In den Geschäften gebe es genug Lebensmittel zu kaufen und damit seien für die meisten Bürger und Politiker die Produktionsbedingungen der Bauern kein Thema. Für ihn als Agrarpolitiker sei das ärgerlich. Zumal die Landwirte in aller Regel als politisch klar verortet eingeschätzt würden – im konservativen Lager mit den Bauernverbänden als Sprachrohr – und gleichzeitig die EU-Agrarpolitik als kaum zu durchdringen gelte. Das alles zusammen mache den Austausch schwierig, sagt Häusling und staunt, wie undifferenziert und mit wie wenig Kenntnis über seine Arbeit und die seiner Kollegen gesprochen werde. Dabei sei es dringend notwendig, gemeinsam darüber nachzudenken, „wie wir wegkommen von der dauerhaften Subventionsabhängigkeit der Landwirte“.""},{""text4"":""Gerade die deutschen Bauern hätten die Schwierigkeit, dass die Preise, anders als in anderen europäischen Ländern, durch die fatale Macht der vier großen Handels- und Discounterketten unter die Erzeugerkosten gedrückt würden. „Im Grunde“, sagt Häusling, „hat sich der Milchpreis in den vergangenen 40 Jahren nicht bewegt.“ Derzeit liege er bei circa 40 Cent je Liter, mitunter aber auch bei 30 bis 35 Cent. Als er 1989 den Familienbetrieb seiner Eltern, den Kellerwaldhof 40 Kilometer südlich von Kassel, übernommen habe, habe er 60 Pfennig für den Liter Milch erhalten. Heute, als Biobauer, könne er 50 Cent, etwas mehr als konventionell wirtschaftende Bauern, bekommen.""},{""text4"":""Die Landwirte zögen aus dieser Entwicklung die einfache Schlussfolgerung: Die, die überleben wollten, versuchten immer mehr zu produzieren. Andere hätten längst aufgegeben. In den vergangenen 15 Jahren habe sich in Deutschland die Zahl der Milchbauern halbiert. Häusling ist ein ruhiger, besonnener Mann. Es liegt ihm nicht, ein Horrorszenario zu entwerfen, wonach die Lebensmittelversorgung in Deutschland grundsätzlich gefährdet sei. Doch ihn treibt die Agrarpolitik – der EU, der Bauernverbände und der bisherigen Bundesregierungen – um, die seiner Ansicht nach seinen Bauernkollegen nur eine Empfehlung nahelegen: Setzt auf die Steigerung der Erträge, koste es was es wolle für die Natur, gleichgültig ob Tiere oder Böden.""},{""text4"":""„Jeder Landwirt kann Geschichten über die zunehmenden Wetterextreme erzählen.“ Auf diese globale Krise, die das Klima, die Biodiversität und das Trinkwasser betreffe, müssten gemeinsam mit den Landwirten Antworten gefunden werden, sagt Häusling. Schließlich würden von den Bauern 40 Prozent der Fläche Deutschlands bewirtschaftet. Dafür müsse die Politik in Deutschland gemeinsam mit der EU Regeln aufstellen und die entsprechende finanzielle Unterstützung gewähren.""},{""text4"":""„Es geht doch um die Lebensgrundlage von uns allen“, sagt der Grünen-Politiker. Das könne man nicht wegdiskutieren oder ausblenden, nur weil die Hintergründe und die Gemengelage etwas komplizierter seien.""},{""text4"":""„Auch der Handel nimmt uns Landwirte nicht ernst“, sagt Häusling und nennt Beispiele, wo Landwirte etwa 1000 Tonnen Kartoffeln angeliefert hätten, diese aber nicht akzeptiert worden seien, weil die Farbe unter Hinweis auf die Verbraucher nicht den Vorstellungen des Handels entsprochen habe. „Und diese Anforderungen steigen.“""},{""text4"":""Häusling wünscht sich, dass das deutsche und europäische Kartellrecht endlich angewandt würde, damit Bauern ihre Angebote bündeln und dem Handel gegenüber stärker und fordernder auftreten könnten, um zumindest die Erzeugungskosten inklusive eines Gewinns einzufordern. Stattdessen sei die deutsche Politik jahrelang nur daran interessiert gewesen, „dass die Verbraucher billig einkaufen können“. Dass diese Preise nicht dem Marktwert entsprächen, sondern sie über Steuern finanziert würden, davon sei nie die Rede. In Italien etwa erhielten die Bauern mehr für ihre Produkte. Dort legten die Verbraucher selbst viel Wert auf eine gute Qualität der Lebensmittel. In Deutschland habe der Markt mit Bioprodukten in der Pandemie floriert. Doch mit steigender Inflation schauten nun alle wieder nur auf die Preise.""},{""text4"":""Die Agrarpolitik ist das eine, das den Grünen-Politiker und Biolandwirt Häusling umtreibt, das andere ist Europa. Am 9. Juni stellt sich Häusling als Spitzenkandidat der hessischen Grünen und auf Platz sechs der bundesweiten Liste seiner Partei zum vierten Mal zur Wahl. Dass es nicht leicht ist, die Wähler für Politik in Brüssel und Straßburg zu interessieren, weiß Häusling. Er kennt die oft vorgebrachte Kritik an der „Regelungswut in Brüssel“. Vor vier Jahren hat er allerdings auch erlebt, wie Tausende etwa in Frankfurt auf die Straße gegangen sind, um für ein demokratisches Europa zu werben.""},{""text4"":""Das würde sich Häusling jetzt auch wieder wünschen, „denn wir stehen vor gewaltigen Aufgaben“, sagt er und verweist auf den Druck, dem die europä­ischen Demokratien von rechts ausgesetzt seien – auch in Deutschland. Er appelliert an die demokratischen Parteien, sich „zusammenzuraufen“ und miteinander zu reden, so wie sie es jetzt mit den Landwirten tun wollten. Denn wenn sich die AfD wie etwa bei der hessischen Landtagswahl im Herbst als zweitstärkste oder vielleicht sogar stärkste Kraft bei der Europawahl durchsetzen sollte, „dann haben wir alle verloren“, sagt Häusling. Das hätte seiner Ansicht nach „die Handlungsunfähigkeit der EU“ zur Folge.""}]","[{""text5"":""Preise werden durch die Discounter gedrückt""},{""text5"":""„Es geht doch um die Lebensgrundlage von uns allen“""},{""text5"":""„Wir stehen vor gewaltigen Aufgaben“""}]","[{""text6"":""Martin Häusling ist Biobauer und agrarpolitische Sprecher der Grünen-Fraktion im Europaparlament. Seinen Kellerwaldhof im nordhessischen Bad Zwesten-Oberurff bewirtschaftet er nach Bioland-Richtlinien.""}]"
"1717585902-23","https://www.faz.net/aktuell/wirtschaft/bauernproteste-in-berlin-im-liveticker-ampelkoalition-will-am-donnerstag-plan-vorlegen-faz-19432942.html","Liveblog zu Bauernprotesten :","Ampelkoalition will am Donnerstag Plan vorlegen","Lindner will keine Planänderung bei Agrardiesel und wird ausgebuht +++ Mehr als 1000 Polizisten begleiten Bauern in Berlin +++ „Weit über 5000 Traktoren“ und massive Verkehrsbehinderungen +++ alle Entwicklungen im Liveblog","[{""text4"":""Die Landwirte gehen bundesweit auf die Barrikaden. Kommt es zum Verkehrschaos? Wir halten Sie im Liveticker über den Bauernprotest auf dem Laufenden.""}]","[{""text5"":""Mehr als 5000 Fahrzeuge bei Protest in Berlin""},{""text5"":""Große Protestaktion in Frankfurt""},{""text5"":""Bauernpräsident zieht positive Zwischenbilanz""},{""text5"":""Kabinett bringt Subventionskürzungen für Landwirte auf den Weg""},{""text5"":""Sind die Proteste berechtigt?""}]","[]"
"1717585904-24","https://www.faz.net/aktuell/wirtschaft/klima-nachhaltigkeit/einige-alternativen-zum-agrardiesel-jedoch-bleibt-eine-huerde-19468602.html","Antriebe in der Landwirtschaft :","Die Alternativen zum Agrardiesel","Wenn die Bauern mehr für Diesel bezahlen müssen, werden andere Treibstoffe wieder interessant. Einige Optionen gäbe es.","[{""text4"":""„Die Bauern können nicht auf den Diesel verzichten“ – dieser Satz ist während der Bauernproteste oft gefallen. Der Wegfall der Steuerbegünstigung für „Agrardiesel“ wirft die Frage auf, wie lange Landmaschinen noch auf Diesel angewiesen sind und welche Alternativen es gibt. Während Pkw, Busse und Lkw längst mit Elektroantrieb unterwegs sind, gestaltet sich die Umstellung bei der Landtechnik aufgrund der schweren Lasten komplizierter. Schließlich müssen die Maschinen tonnenweise Getreide oder schwere Güllefässer ziehen; Elektroantriebe für schwere Geräte wie Mähdrescher oder Feldhäcksler sind allenfalls ferne Zukunftsmusik.""},{""text4"":""Auf der „Grünen Woche“ in Berlin, der weltgrößten Messe der Agrar- und Ernährungswirtschaft, wird viel über alternative Kraftstoffe diskutiert. Die Industrie signalisiert: Es gibt Lösungen, aber der Umstieg geht nicht von heute auf morgen. Batterieelektrische Antriebe gelten als Königsweg für CO2-arme Antriebe, sagt Peter Pickel, Honorarprofessor im Fachbereich Maschinenbau und Fahrzeugtechnik an der Fachhochschule Kaiserslautern und beim Landmaschinenhersteller John Deere tätig.""},{""text4"":""Aus anwendungstechnischen Gründen seien sie aber nur bis zu einer Leistung von etwa 100 PS sinnvoll. Das ist heute, wo die Maschinen immer größer werden, nicht mehr viel. Die Landtechnikindustrie arbeitet daran, Maschinen auf den Markt zu bringen, aber es gibt Grenzen, weil die Maschinen irgendwann zu schwer und die Batterien zu teuer werden. Zudem sei die Brennstoffzellentechnologie für den rauen Offroad-Einsatz noch nicht verfügbar. Kraftstoffe aus erneuerbarem Strom werden Schätzungen zufolge erst 2035 in ausreichender Menge verfügbar sein.""},{""text4"":""Elektroantriebe könnten sich jedoch in bestimmten Bereichen durchsetzen, etwa bei Hofarbeiten oder bei kleineren Traktoren, im Obstbau oder in Kommunen. Gegenwärtig sind elektrische Maschinen relativ teuer, könnten aber mit sinkenden Preisen attraktiver werden.""},{""text4"":""Um bis 2030 nennenswerte Treibhausgaseinsparungen bei Landmaschinen zu erreichen, hält Peter Pickel den Einsatz von dieselähnlichen Biokraftstoffen wie Biodiesel, hydriertem Pflanzenöl (HVO) und reinen Pflanzenölen (PPO) für notwendig – und für die beste Übergangslösung, bis andere Alternativen zur Verfügung stehen. Biokraftstoffe haben die gleiche Rohstoffbasis, meist Altspeisefette oder Pflanzenöle.""},{""text4"":""Doch eine Hürde bleibt: Unter dem Eindruck des Ukrainekrieges wollte die Bundesregierung eigentlich auf die Gewinnung von Treibstoff aus Ackerpflanzen verzichten. Das könnte sich jetzt ändern. Bundesumweltministerin Steffi Lemke (Grüne) hat sich kürzlich für den Einsatz von Kraftstoffen aus Pflanzenölen in der Landwirtschaft ausgesprochen. Damit rückt sie zumindest teilweise von ihrem Plan ab, Biokraftstoffe bis 2030 schrittweise zu verbieten. Zuvor hatte sich auch Bundeslandwirtschaftsminister Cem Özdemir (Grüne) offen gezeigt.""},{""text4"":""Die Diskussion um „Tank, Trog oder Teller“ bei Biokraftstoffen beruhe teilweise auf falschen Annahmen, so Peter Pickel. Der Anbau von Ölpflanzen für Biokraftstoffe habe auch positive Effekte, wenn man den Wert der Koppelprodukte berücksichtige. Wer beispielsweise Raps anbaut, erntet neben dem Öl auch Rapsschrot, das in der Tierfütterung importiertes Soja ersetzen kann. Peter Pickel rechnet vor, dass etwa sieben Prozent der landwirtschaftlichen Nutzfläche nötig wären, um den gesamten Kraftstoffbedarf der deutschen Landwirtschaft durch Biodiesel, hydriertes oder reines Pflanzenöl zu decken. Technisch sei die Nutzung relativ einfach. Preislich liege reines Pflanzenöl zwar etwas über dem Dieselpreis, dies könne sich aber langfristig ändern.""},{""text4"":""Hydriertes Pflanzenöl hingegen habe technisch bessere Eigenschaften als Diesel, sei aber bisher – anders als im Rest der EU – in Deutschland nicht zugelassen, andererseits aber auch teurer als Biodiesel. „In 15 Jahren wird hydriertes Pflanzenöl Biodiesel ablösen“, sagt Peter Pickel. Neben Pflanzenkraftstoffen und Elektroantrieben werden auf der Grünen Woche auch Alternativen wie Wasserstoff und Methan präsentiert.""},{""text4"":""Allerdings gibt es Probleme mit der Raum- und Energiedichte im Vergleich zu Diesel. Große oder zusätzliche Tanks sind notwendig, die Speicherkapazitäten begrenzt, was zu einer geringeren Reichweite führt. Experte Peter Pickel hält Biomethan für sinnvoll, wenn es aus Reststoffen wie Gülle und Mist hergestellt wird. Für die Produktion sei aber viel Infrastruktur nötig. In Kraftstoffen auf Basis von Ethanol sieht er für Europa derzeit keine Lösung. Die Rohstoffausbeute sei zu gering im Vergleich zu Nord- oder Südamerika, wo zum Beispiel Zuckerrohr zur Ethanolgewinnung angebaut wird.""},{""text4"":""Biokraftstoffe gelten derzeit vielfach als sinnvollste Lösung, bis etwa E-Fuels zur Verfügung stehen. Doch muss sich der Einsatz für Bauern rechnen. In der Diskussion sind daher etwa Steuerentlastungen für Biokraftstoffe. Derzeit werden sie nicht steuerlich begünstigt. Denkbar wäre alternativ eine Teilnahme am Handel mit Treibhausgasquoten, von dem Bauern profitieren könnten, wenn sie Biokraftstoffe einsetzen.""}]","[{""text5"":""Lemke für Kraftstoffe aus Pflanzenölen""},{""text5"":""Biokraftstoffe als sinnvollste Übergangslösung?""}]","[]"
"1717585907-25","https://www.faz.net/aktuell/wirtschaft/vor-bauernprotesten-habeck-verteidigt-entscheidung-zum-agrardiesel-19389473.html","Bauern planen Proteste :","Wirtschaftsminister Habeck verteidigt Entscheidung zum Agrardiesel","Um zu sparen, will die Bundesregierung Steuervergünstigen für Treibstoff im Agrarsektor streichen. Die Landwirte sind empört. Robert Habeck beteuert, die Härten zu kennen, hält den Schritt aber weiter für richtig.","[{""text4"":""Vizekanzler Robert Habeck (Grüne) hat die anvisierte Streichung von Steuervergünstigungen beim Agrardiesel vor den für Montag geplanten Protesten von Landwirten verteidigt. Zugleich nahm er Agrarminister Cem Özdemir (Grüne) gegen Kritik in Schutz.""},{""text4"":""„Der Bundeskanzler, der Finanzminister und ich haben die Entscheidung zur Agrardiesel-Beihilfe im Sinne einer Gesamtlösung treffen müssen“, sagte Habeck der Nachrichtenagentur dpa. „Das war nicht leicht und auch ich weiß um die Härten. Der Landwirtschaftsminister hat davor gewarnt, die Agrardiesel-Beihilfe zu streichen. Cem Özdemir kennt die Lage der Bauern und die Belastung und hat das sehr deutlich gemacht.“""},{""text4"":""Er habe diese Argumente auch mit den Regierungspartnern diskutiert, sagte Habeck. „Aber wir müssen in Folge des Urteils des Bundesverfassungsgerichts mit weniger Geld auskommen und Ausgaben beschränken. Und wir drei haben diese Entscheidung im Rahmen des Gesamtpakets getroffen.“""},{""text4"":""Der Deutsche Bauernverband hat für diesen Montag zu einer Kundgebung unter dem Motto „Zu viel ist zu viel“ in Berlin aufgerufen. Damit soll Empörung über ein Aus für Regelungen zum Agrardiesel und für die Kfz-Steuerbefreiung für die Land- und Forstwirtschaft gezeigt werden.""},{""text4"":""Auch in der Union wird der Protest gegen Streichungen im Agrarbereich immer lauter. „Die Ampel verspielt den letzten Funken des Vertrauens der Agrar- und Ernährungswirtschaft in Deutschland“, sagte die stellvertretende CDU-Vorsitzende und Bundestagsabgeordnete Silvia Breher. Die grüne Branche werde mit fast einer Milliarde Euro pro Jahr zusätzlich belastet. „Dem Klima dient diese Entscheidung nicht, denn Alternativen stehen den Land- und Forstwirten nicht zur Verfügung.“ Es gebe weder Planungssicherheit noch würden die notwendigen finanziellen Mittel für den Umbau der Tierhaltung bereitgestellt.""},{""text4"":""Die Chefin des Wirtschaftsflügels der Union, Gitta Connemann, warnte, ohne Diesel könne kein Acker bestellt werden: „Eine Kostenexplosion ist vorprogrammiert.“ Die CDU-Abgeordnete und Vorsitzende der Mittelstands- und Wirtschaftsunion sagte der dpa: „Die Pläne der Ampel wirken wie ein Sonderopfer. Ein Prozent der Bevölkerung sollen zehn Prozent der Einsparungen tragen.“ Es drohe eine weitere Verlagerung der Lebensmittelproduktion.""},{""text4"":""Wirtschaftsminister Habeck hatte sich am Mittwoch nach langen Verhandlungen mit Kanzler Olaf Scholz (SPD) und Finanzminister Christian Lindner (FDP) darauf geeinigt, wie nach einem Urteil des Bundesverfassungsgerichts Milliardenlöcher im Bundeshaushalt für 2024 sowie im Klima- und Transformationsfonds gestopft werden sollen. Dazu gehören auch die Kürzungspläne im Agrarbereich.""}]","[{""text5"":""Landwirte sind empört""}]","[]"
