web-scraper-order,web-scraper-start-url,text1,text2,text3,text4,text5,text6
"1717585839-1","https://www.faz.net/aktuell/wirtschaft/kommentar-zur-eu-reaktion-auf-bauernprotest-von-der-leyens-beruhigungspille-19517053.html","EU kommt Bauern entgegen :","Politik nach Protestlage","Brüssel bewegt sich auf die Bauern zu und setzt die Pflicht zur Flächenstilllegung aus. Kommissionspräsidentin von der Leyen treibt dabei weniger die Sorge um die Bauern. Es geht ihr um etwas ganz anderes.","[{""text4"":""Wohl oder Wehe der Bauern hat EU-Kommissionspräsidentin Ursula von der Leyen bisher wenig interessiert. Nun aber, da die Trecker Berlin, Paris und Brüssel lahmgelegt haben, und die Europawahl naht, beeilt sie sich, die traditionelle CDU-Wählerschaft vom Lande zu bedienen. Die Bauern müssen auch in diesem Jahr keine Brachen für den Artenschutz lassen und dürfen ihre gesamte Fläche beackern.""},{""text4"":""Nun lässt sich über den Sinn solcher Brachen streiten. Mit durchdachter Agrarpolitik hat der Beschluss dennoch nichts zu tun. Er kommt für viele Bauern zu spät, die ihre Planung für dieses Jahr längst abgeschlossen und umgesetzt haben.""},{""text4"":""Auch die Begründung spricht Bände. 2023 hat Brüssel die Flächenstilllegung ausgesetzt, da die Agrarpreise stark gestiegen waren. 2023 macht sie es, da sie stark gefallen sind. Das ist Politik nach Protestlage. Es ist leicht zu durchschauen, was von der Leyen antreibt. Es ist nicht die Sorge um die Bauern. Es ist die Sorge der CDU-Politikerin um den Rückhalt in der eigenen Partei für ihre kurz bevorstehende Kandidatur als Spitzenkandidatin.""}]","[]","[]"
"1717585841-2","https://www.faz.net/aktuell/wirtschaft/bauernprotest-in-frankreich-gruene-westen-19469075.html","Bauernprotest in Frankreich :","Grüne Westen?","Dies- wie jenseits des Rheins tut man gut daran, die tief in die Mittelschicht reichende Sorge über eine schleichende „Deklassierung“ ernst zu nehmen.","[{""text4"":""Ein Gespenst geht wieder einmal um in Paris, das Gespenst wütender Bürger vom Land, die gegen die Eliten aufbegehren: Seit dieser Woche hat der Bauernprotest auch Frankreich voll erfasst. Wie in Deutschland rollen im streikfreudigen Nachbarland Traktoren durchs Land und versperren Landwirte mit Straßenblockaden den Weg. Die Regierung ist alarmiert. Schon ist in Anlehnung an die einstigen Demonstranten in gelben Westen vom Beginn eines „Grünwestenprotests“ die Rede, bei dem die Bauern nur Auslöser einer großen Bewegung sein könnten, die in einem weitverbreiteten Unmut über die Wohlstandsverteilung und die politische Repräsentation gründet. Noch steht Frankreich nicht in Flammen, noch sollte man die Lage trotz des tödlichen Unglücks südlich von Toulouse nicht dramatisieren. Diesseits wie jenseits des Rheins tut man aber gut daran, die tief in die Mittelschicht reichende Sorge über eine schleichende „Deklassierung“ ernst zu nehmen. Hohe Steuer- und Abgabenlast, politisch verursachter Energiekostenanstieg, erdrückende Bürokratie – Grund zur Klage haben nicht nur die Bauern.""}]","[]","[]"
"1717585844-3","https://www.faz.net/aktuell/wirtschaft/klima-nachhaltigkeit/einige-alternativen-zum-agrardiesel-jedoch-bleibt-eine-huerde-19468602/abhaengig-vom-verbrenner-mit-19468601.html","Antriebe in der Landwirtschaft :","Die Alternativen zum Agrardiesel","Wenn die Bauern mehr für Diesel bezahlen müssen, werden andere Treibstoffe wieder interessant. Einige Optionen gäbe es.","[{""text4"":""„Die Bauern können nicht auf den Diesel verzichten“ – dieser Satz ist während der Bauernproteste oft gefallen. Der Wegfall der Steuerbegünstigung für „Agrardiesel“ wirft die Frage auf, wie lange Landmaschinen noch auf Diesel angewiesen sind und welche Alternativen es gibt. Während Pkw, Busse und Lkw längst mit Elektroantrieb unterwegs sind, gestaltet sich die Umstellung bei der Landtechnik aufgrund der schweren Lasten komplizierter. Schließlich müssen die Maschinen tonnenweise Getreide oder schwere Güllefässer ziehen; Elektroantriebe für schwere Geräte wie Mähdrescher oder Feldhäcksler sind allenfalls ferne Zukunftsmusik.""},{""text4"":""Auf der „Grünen Woche“ in Berlin, der weltgrößten Messe der Agrar- und Ernährungswirtschaft, wird viel über alternative Kraftstoffe diskutiert. Die Industrie signalisiert: Es gibt Lösungen, aber der Umstieg geht nicht von heute auf morgen. Batterieelektrische Antriebe gelten als Königsweg für CO2-arme Antriebe, sagt Peter Pickel, Honorarprofessor im Fachbereich Maschinenbau und Fahrzeugtechnik an der Fachhochschule Kaiserslautern und beim Landmaschinenhersteller John Deere tätig.""},{""text4"":""Aus anwendungstechnischen Gründen seien sie aber nur bis zu einer Leistung von etwa 100 PS sinnvoll. Das ist heute, wo die Maschinen immer größer werden, nicht mehr viel. Die Landtechnikindustrie arbeitet daran, Maschinen auf den Markt zu bringen, aber es gibt Grenzen, weil die Maschinen irgendwann zu schwer und die Batterien zu teuer werden. Zudem sei die Brennstoffzellentechnologie für den rauen Offroad-Einsatz noch nicht verfügbar. Kraftstoffe aus erneuerbarem Strom werden Schätzungen zufolge erst 2035 in ausreichender Menge verfügbar sein.""},{""text4"":""Elektroantriebe könnten sich jedoch in bestimmten Bereichen durchsetzen, etwa bei Hofarbeiten oder bei kleineren Traktoren, im Obstbau oder in Kommunen. Gegenwärtig sind elektrische Maschinen relativ teuer, könnten aber mit sinkenden Preisen attraktiver werden.""},{""text4"":""Um bis 2030 nennenswerte Treibhausgaseinsparungen bei Landmaschinen zu erreichen, hält Peter Pickel den Einsatz von dieselähnlichen Biokraftstoffen wie Biodiesel, hydriertem Pflanzenöl (HVO) und reinen Pflanzenölen (PPO) für notwendig – und für die beste Übergangslösung, bis andere Alternativen zur Verfügung stehen. Biokraftstoffe haben die gleiche Rohstoffbasis, meist Altspeisefette oder Pflanzenöle.""},{""text4"":""Doch eine Hürde bleibt: Unter dem Eindruck des Ukrainekrieges wollte die Bundesregierung eigentlich auf die Gewinnung von Treibstoff aus Ackerpflanzen verzichten. Das könnte sich jetzt ändern. Bundesumweltministerin Steffi Lemke (Grüne) hat sich kürzlich für den Einsatz von Kraftstoffen aus Pflanzenölen in der Landwirtschaft ausgesprochen. Damit rückt sie zumindest teilweise von ihrem Plan ab, Biokraftstoffe bis 2030 schrittweise zu verbieten. Zuvor hatte sich auch Bundeslandwirtschaftsminister Cem Özdemir (Grüne) offen gezeigt.""},{""text4"":""Die Diskussion um „Tank, Trog oder Teller“ bei Biokraftstoffen beruhe teilweise auf falschen Annahmen, so Peter Pickel. Der Anbau von Ölpflanzen für Biokraftstoffe habe auch positive Effekte, wenn man den Wert der Koppelprodukte berücksichtige. Wer beispielsweise Raps anbaut, erntet neben dem Öl auch Rapsschrot, das in der Tierfütterung importiertes Soja ersetzen kann. Peter Pickel rechnet vor, dass etwa sieben Prozent der landwirtschaftlichen Nutzfläche nötig wären, um den gesamten Kraftstoffbedarf der deutschen Landwirtschaft durch Biodiesel, hydriertes oder reines Pflanzenöl zu decken. Technisch sei die Nutzung relativ einfach. Preislich liege reines Pflanzenöl zwar etwas über dem Dieselpreis, dies könne sich aber langfristig ändern.""},{""text4"":""Hydriertes Pflanzenöl hingegen habe technisch bessere Eigenschaften als Diesel, sei aber bisher – anders als im Rest der EU – in Deutschland nicht zugelassen, andererseits aber auch teurer als Biodiesel. „In 15 Jahren wird hydriertes Pflanzenöl Biodiesel ablösen“, sagt Peter Pickel. Neben Pflanzenkraftstoffen und Elektroantrieben werden auf der Grünen Woche auch Alternativen wie Wasserstoff und Methan präsentiert.""},{""text4"":""Allerdings gibt es Probleme mit der Raum- und Energiedichte im Vergleich zu Diesel. Große oder zusätzliche Tanks sind notwendig, die Speicherkapazitäten begrenzt, was zu einer geringeren Reichweite führt. Experte Peter Pickel hält Biomethan für sinnvoll, wenn es aus Reststoffen wie Gülle und Mist hergestellt wird. Für die Produktion sei aber viel Infrastruktur nötig. In Kraftstoffen auf Basis von Ethanol sieht er für Europa derzeit keine Lösung. Die Rohstoffausbeute sei zu gering im Vergleich zu Nord- oder Südamerika, wo zum Beispiel Zuckerrohr zur Ethanolgewinnung angebaut wird.""},{""text4"":""Biokraftstoffe gelten derzeit vielfach als sinnvollste Lösung, bis etwa E-Fuels zur Verfügung stehen. Doch muss sich der Einsatz für Bauern rechnen. In der Diskussion sind daher etwa Steuerentlastungen für Biokraftstoffe. Derzeit werden sie nicht steuerlich begünstigt. Denkbar wäre alternativ eine Teilnahme am Handel mit Treibhausgasquoten, von dem Bauern profitieren könnten, wenn sie Biokraftstoffe einsetzen.""}]","[{""text5"":""Lemke für Kraftstoffe aus Pflanzenölen""},{""text5"":""Biokraftstoffe als sinnvollste Übergangslösung?""}]","[]"
"1717585846-4","https://www.faz.net/aktuell/wirtschaft/treffen-der-agrarminister-bauernproteste-in-bruessel-19546716.html","Treffen der Agrarminister :","Bauernproteste in Brüssel","Hunderte Landwirte protestieren während des Agrarministertreffens in Brüssel vor dem EU-Hauptquartier. Sie kritisieren Umweltschutzmaßnahmen, die mit zusätzlichen Kosten und Vorschriften einhergehen. Die Polizei ist mit einem Großaufgebot im Einsatz.","[]","[]","[]"
"1717585848-5","https://www.faz.net/aktuell/politik/bauernproteste-in-polen-gegen-die-ukraine-und-die-eu-19549563.html","Bauernproteste in Polen :","Die Probleme der neuen Regierung","Eigentlich wollte Polens neue Regierung eine EU-freundliche Politik machen. Nun fordern die Bauern, Front gegen deren Green Deal zu machen.","[{""text4"":""Die Bauernproteste in Polen sind eine große Herausforderung für die neue Regierung des Landes. Sie hat die Wahl vorigen Herbst mit dem Versprechen gewonnen, die Beziehungen zwischen Polen und der EU wieder zu entspannen – und steht nun der massiv vorgetragenen Forderung gegenüber, in Brüssel Front gegen den Green Deal der EU zu machen.""},{""text4"":""Sie trommelt für eine stärkere Unterstützung der bedrängten Ukraine – und hat gleichzeitig damit zu kämpfen, dass die polnischen Bauern Grenzübergänge zur Ukraine blockieren und ein weitgehendes Verbot der Einfuhr ukrainischer Agrarprodukte fordern.""},{""text4"":""Und all das geschieht vor dem Hintergrund der im April bevorstehenden Kommunalwahlen und der Europawahl im Juni. Für einen der Warschauer Koalitionspartner, die Bauernpartei, ist ein Erfolg bei beiden Wahlen lebenswichtig.""},{""text4"":""Die polnische Regierung versucht die Bauern mit dem Versprechen zu beruhigen, ihre Anliegen gegenüber EU und Ukraine robust zu vertreten. Aber die Stimmung ist aufgeheizt – und sogar die Erfüllung der Forderungen dürfte viele der Probleme nicht lösen.""}]","[{""text5"":""Blick auf die Kommunalwahlen im April""}]","[]"
"1717585852-6","https://www.faz.net/aktuell/politik/ausland/polen-bauernprotest-gegen-green-deal-und-niedrige-getreidepreise-19549911.html","Bauernprotest in Warschau :","Was Polens Bauern so wütend macht","Die Böller krachen ohrenbetäubend, bengalisches Feuer wird entzündet. Die Wut von Polens Bauern ist groß. Auch Imker und Jäger solidarisieren sich mit ihnen. Ein Augenschein auf der Großkundgebung in Warschau.","[{""text4"":""Etwas ratlos wirken die vier Demons­tranten in der Unterführung im Zentrum von Warschau: Krystian, seine Schwester Katarzyna, Paweł und Grzegorz aus dem südpolnischen Landkreis Miechów. Allein sind sie nicht. Hunderte Menschen drängen mit noch eingerollten Nationalfahnen und Transparenten vorwärts. Wo geht es hier bitte zum Kulturpalast?""},{""text4"":""Der wuchtige Bau aus der Epoche des Stalinismus wird an diesem Dienstag Kulisse sein für einen „Sternmarsch“ von Demonstranten aus ganz Polen, hauptsächlich Landwirten. Auf dem Platz davor haben Busse geparkt, mehrere Tausend Menschen haben sich lange vor Beginn versammelt. Einige Bauern machen Lärm. Böller krachen ohrenbetäubend, kräftige Männer holen tief Luft und blasen in ihre knallroten Tröten hinein. Dazu wird bengalisches Feuer entzündet, wie es zur polnischen Demo-Folklore gehört. Zu Gewalt kommt es offenbar nicht.""},{""text4"":""Seit Monaten protestieren Landwirte in Polen. Zunächst ging es gegen zollfreie und angeblich „unkontrolliert einströmende“ Agrarimporte aus der Ukraine, in den vergangenen Wochen auch gegen den „Green Deal“ der Europäischen Union. Krystian, 30 Jahre alt, verheiratet, zwei Kinder, hat vor elf Jahren den Hof seines Vaters übernommen. Damals waren es 30 Hektar, heute bewirtschaftet er schon hundert. Er hat bereits in seiner Heimatregion demonstriert, nun ist er deswegen nach Warschau gekommen.""},{""text4"":""Krystian macht keine großen Worte, als er überlegt, ob der Hauptgrund seiner Unzufriedenheit die EU oder die Ukraine ist. „Beides“, sagt er. Vor allem sind es wohl die Preise, die ihm das Leben schwer machen. „Vor dem Krieg (in der Ukraine) haben wir guten Weizen zu 900 Złoty (umgerechnet 210 Euro) verkauft. Jetzt liegt der Kaufpreis bei 580 Złoty.“ Die andere Seite sind die Ausgaben: „Vor dem Krieg kostete Stickstoffdünger 900 Złoty, jetzt sind es 1800. Vieles ist deutlich teurer geworden: Pflanzenschutzmittel, Treibstoff, alles Mögliche. Und die Steuern für die Bauern sind in diesem Jahr erhöht worden.“""},{""text4"":""Liegt das mit den Steuern noch an der alten, nationalkonservativen Regierung oder an der seit Dezember amtierenden neuen, liberalen? Krystian schaut seine Schwester fragend an, Katarzyna blickt ratlos zurück. Sie wissen nur eines: „Zu Politik wollen wir uns nicht äußern. Wir gehen immer wählen, aber dazu sagen wir nichts.“""},{""text4"":""Mit dem Namen Michał Kołodziejczak können sie natürlich etwas anfangen. Der 35 Jahre alte Landwirt und einstige Kommunalpolitiker hat sich in den vergangenen Jahren einen Namen gemacht als radikaler Bauernführer. Wenn Polens Landwirte der Schuh drückte, griff er das Thema auf und organisierte Straßenblockaden. Oft konnte man von ihm populistische Parolen hören. Vor den Parlamentswahlen im Herbst änderte sich das Bild. Kołodziejczak suchte politisch Anschluss, um mit seiner „Agrounion“ wenigstens ein paar Parlamentssitze zu erobern. Die Fünfprozenthürde war außer Reichweite, doch Oppositionsführer Donald Tusk, der jetzige Regierungschef, bot ihm überraschend ein paar Listenplätze an. Jetzt ist er Abgeordneter und Agrarstaatssekretär.""},{""text4"":""Auf die Frage hin, ob er es schafft, unzufriedene Bauern zu besänftigen, ihnen die Regierungspolitik zu erklären oder gar ihre Interessen zu vertreten, schauen sich die Demonstranten an und grinsen. Dann sagt Paweł: „Ich denke, Kołodziejczak weiß vor allem, wie man an Geld kommt.“ Sein Wandel vom Bauernaktivisten zum etablierten Regierungsmitglied weckt offenbar auch Misstrauen.""},{""text4"":""Krystian wirkt nicht wie ein EU-Gegner. Doch Brüssels Klima- und Agrarpolitik bürde den Bauern immer neue Aufgaben auf. Als Beispiel nennt er die kürzlich ausgesetzte Richtlinie, einen kleinen Teil des Landes brachliegen zu lassen. „Wir haben gutes Land und dürfen es nicht bebauen.“ Außerdem machten Zertifizierungen der Produkte, Register, Schulungen „viel Papierarbeit“. Oft müsse man mehr reinstecken, als man von der EU bekomme. Durch die Maßnahme der Gemeinschaft, den Agrarhandel aus Solidarität mit der Ukraine zu liberalisieren, sagt der Landwirt, sei Ware ins Land gekommen, welche die EU-Normen nicht erfülle, und sie habe die Preise gedrückt.""},{""text4"":""Ein anderer junger Demonstrant, Kacper, Kleinbauer aus der Gegend von Lublin, erzählt, er habe am Wochenende zwei Nächte am von Landwirten blockierten Grenzübergang nahe Dorohusk verbracht. „Ich habe die Gleise gesehen, wo Protestierer Raps aus zwei ukrainischen Waggons ausgekippt haben. Aber später war dann schon viel Polizei und Bahnpolizei im Einsatz, die haben niemanden mehr zu den Gleisen durchgelassen.“""},{""text4"":""Nicht nur Bauern sind am Dienstag in Warschau auf der Straße. Auch Imker in ihrer Schutzkleidung sind mit Transparenten unterwegs. „Stoppt den Import von Honig“ steht drauf, eine Forderung, die sich vor allem gegen die Ukraine richtet. Dazu grün gekleidete Jäger wie Grzegorz, der sich gegen den „Ökoterror“ der Umweltschützer wendet, gegen das unkontrollierte Wachsen der Wolfspopulation sowie gegen eine Regelung der PiS-Regierung, die es verbot, Minderjährige auf die Jagd mitzunehmen. „Die Eltern wissen doch, was für ihre Kinder gut ist, oder nicht?“""},{""text4"":""Vor dem Kulturpalast spricht auch ein deutscher Bauernvertreter. „Ich möchte euch unseren Dank aussprechen“, ruft er ins Mikrofon. „Ihr blockiert die Grenze zur Ukraine auch für uns.“ Er kritisiert, dass das ukrainische Getreide seit 2022 durch Polen weiter „in die Dritte Welt gelangen sollte, aber dann ist es in der EU hängen geblieben und hat uns die Preise versaut“.""},{""text4"":""Die Proteste sollen noch wochenlang weitergehen, obwohl nicht absehbar ist, inwieweit die Bauern dauerhaft auch andere Berufsgruppen mobilisieren können. Polens Bauernschaft ist zahlreich und selbstbewusst. Die Politik behandelt sie mit Samthandschuhen. Tusk sagte am Dienstag, man wolle der Ukraine helfen, aber nicht mit Methoden, die „für ganze Wirtschaftsbereiche mörderisch sind“. Parlamentspräsident Szymon Hołownia empfing Demonstranten und versprach einen „Runden Tisch“.""}]","[{""text5"":""Ein Bauernführer ist nun Staatssekretär""},{""text5"":""Auch ein deutscher Bauernvertreter spricht""}]","[{""text6"":""Paweł, Katarzyna, Krystian und der Jäger Grzegorz vor dem Kulturpalast in Warschau""}]"
"1717585856-7","https://www.faz.net/aktuell/politik/ausland/bauernproteste-in-frankreich-weiterhin-demonstrationen-und-blockaden-19475576.html","Bauernproteste in Frankreich :","Weiterhin Demonstrationen und Blockaden","Die Proteste gehen mittlerweile in die zweite Woche, landesweit blockieren die Landwirte Autobahnen und Landstraßen. Die Demonstrierenden nähern sich der Hauptstadt Paris, wo sie den Druck noch einmal erhöhen wollen.","[]","[]","[]"
"1717585860-8","https://www.faz.net/aktuell/wirtschaft/bauernproteste-frankreich-schlaegt-tuer-zu-mercosur-zu-19482705.html","Wegen Bauernprotesten :","Frankreich schlägt die Tür zu Mercosur zu","Nach den Bauernprotesten ziehen dunkle Wolken über Europas größtes Freihandelsabkommen auf. Frankreichs Premier betont: Wir sind entschieden dagegen.","[{""text4"":""Mit Hilfszusagen und Versprechen hat die fran­zösische Regierung auf die Proteste der heimischen Bauern reagiert. Das hat auch Folgen für Deutschland. So gehört neben der Rücknahme der höheren Steuer auf Agrardiesel die Absage an das Freihandelsabkommen mit Brasilien, Argentini­en, Paraguay und Uruguay zu dem Maßnahmenbündel, das Frankreichs Premierminister Gabriel Attal vorgelegt hat. Über das Abkommen zwischen der EU und den vier südamerikanischen Mercosur-Staaten wird seit Jahren verhandelt. Es schüfe ei­nen Markt mit mehr als 700 Millionen Menschen. Es wäre damit die größte Handelsübereinkunft der EU und gerade für die exportorientierte deutsche Wirtschaft von großer Bedeutung.""},{""text4"":""„Frankreich lehnt die Unterzeichnung des Mercosur-Vertrags entschieden ab“, sagte Attal am Freitag vor Bauern. Er fügte mit Blick auf vorherige Äußerungen von Präsident Emmanuel Macron an: „Ich sage es hier noch einmal ganz klar und deutlich: Der Präsident der Republik hat sich immer dagegen ausgesprochen, und wir werden uns auch weiterhin dagegen aussprechen.“ Tatsächlich war Anfang Dezember eine von der EU-Kommission anvisierte Einigung beim Mercosur-Gipfel in Rio de Janeiro in letzter Mi­nute auch deshalb gescheitert, weil sich Macron zuvor abermals gegen das Abkommen gewandt hatte. Er betont, es sei weder im Interesse der EU noch im Interesse der französischen und europäischen Bauern. Zudem hatte Argentinien kurzfristig mitgeteilt, zunächst die Amtsübergabe an den neu gewählten Präsidenten Javier Milei abwarten zu wollen.""},{""text4"":""EU-Handelskommissar Valdis Dombrovskis indes hatte noch vor wenigen Tagen nach einem Treffen mit der argentinischen Außenministerin Diana Mondino bekräftigt, beide Seiten seien fest dazu entschlossen, die Verhandlungen schnell über die Ziellinie zu bringen. Dabei geht es um ein Zusatzprotokoll zu dem eigentlich schon seit 2019 abgeschlossenen Han­delsabkommen. Das Protokoll soll den Schutz des Regenwalds sicherstellen und die europäischen Landwirte vor unfairer Konkurrenz schützen. Kritik gibt es auch aus Österreich oder Irland, die ihre Landwirte vor der Konkurrenz aus Südamerika schützen wollen. Im EU-Par­lament lehnen insbesondere die Grünen das von den EU-Staaten einstimmig zu ra­tifizierende Abkommen wegen des ih­rer Ansicht nach zu schwachen Schutzes des Regenwalds ab.""},{""text4"":""Durch den bekräftigten Widerstand aus Frankreich ist der Fortgang der Verhandlungen nun ungewisser denn je. Freihandelsabkommen müssten „die Verbraucher schützen und unseren Produzenten garantieren, dass sie mit gleichen Waffen gegen ihre ausländischen Konkurrenten kämpfen“, hieß es ergänzend aus dem Haus von Premierminister Attal. Nur wenn eine solche Reziprozität gewährleistet sei, könne man einer Unterzeichnung zustimmen. In Paris man damit auf die Linie der führenden Bauernverbände eingeschwenkt.""},{""text4"":""Frankreichs Agrarlobby gilt als sehr einflussreich. Die Landwirtschaft ist für große Teile der Bevölkerung identitätsstiftend und mit rund 9,5 Milliarden Euro jährlich größter EU-Subventionsempfänger. „Sie können in Frankreich nichts tun, was sich gegen die Landwirte richtet“, verlautet es aus ranghohen Regierungskreisen. In seiner aktuellen Form sei das Mercosur-Abkommen eine „Kriegserklärung“ an die heimischen Bauern. Schon im Herbst hieß es, dass mit einer Unterzeichnung nicht vor den Europawahlen im Juni zu rechnen sei. Zu den größten Gegnern gehören Frankreichs Fleisch-, Zucker- und Getreidehersteller, während Teile der Industrie, aber auch Wein- und Spirituosenhersteller durchaus von dem Freihandel profitierten.""}]","[{""text5"":""„Kriegserklärung“ an Frankreichs Bauern""}]","[]"
